,date,hour,title,subtitle,text
76,23/02/2018,02:10,Five things to look out for in the Bundesliga,"Bayern Munich coach Jupp Heynckes will be chasing a 38-year-old club record when his team host Hertha Berlin on Saturday, but will do so without the injured James Rodriguez.","Heynckes is looking to become the first Bayern coach to win 15 games in a row as his team look to consolidate a commanding 19-point lead at the top of the Bundesliga. Second-place Borussia Dortmund host Augsburg on Monday, with fans from both sides set to boycott the game. Elsewhere, Bruno Labbadia takes charge of Wolfsburg for the first time against Mainz on Friday, while RB Leipzig look set to host Cologne without star midfielder Naby Keita. Here are five things to look out for in this weekend's Bundesliga action: Jupp Heynckes has worked wonders since returning to Bayern Munich, and on Saturday he looks set to break an incredible club record. Heynckes, who has led Bayern to 23 victories in 24 games since October, could now become the first Bayern coach ever to win 15 games in a row. The 72-year-old watched his side romp to victory over Besiktas in midweek to pick up a 14th consecutive win, equalling a club record set under Pal Csernai back in 1980. Bayern are expected to be without James Rodriguez, who was forced to leave the pitch after 44 minutes against Besiktas with a calf problem. A diagnosis on Wednesday confirmed that the Colombian will be out of action for no more than a few days. More fan protests are expected this Monday when Borussia Dortmund take on Augsburg in the Bundesliga's second Monday night fixture. Last week's inaugural Monday game saw fierce protests from Eintracht Frankfurt fans, who blew whistles and held up banners in protest at the new scheduling. This Monday, both Dortmund and Augsburg fan groups are expected to continue protests. Around 300 Dortmund fan clubs have reportedly signed up to a boycott led by the influential fan group ""Suedtribuene Dortmund"". ""We accept every opinion and every protest, as long as it is carried out peacefully,"" said Dortmund CEO Hans-Joachim Watzke. RB Leipzig will be without star midfielder Naby Keita when they host Cologne on Sunday evening. The Guinean midfielder left the field after just an hour in Leipzig's defeat to Frankfurt on Monday, having pulled his hamstring. Captain Willi Orban is also a doubt after suffering a cut to his knee in a collision with Frankfurt's Sebastien Haller on Monday. Coach Ralph Hasenhuettl, though, claimed that the injuries were not a disaster for his team, as Leipzig look to muscle their way back into the top four this weekend. ""We have enough quality to replace both of them,"" insisted Hasenhuettl. Bruno Labbadia takes charge of Wolfsburg for the first time on Friday evening, as the Wolves travel to Mainz for a crucial bottom of the table clash. Labbadia took charge of the struggling Wolves after Martin Schmidt's sudden resignation earlier this week, and is now tasked with leading the club back to safety. ""We have to use every hour available to us,"" said Labbadia. ""I will demand of my players that they invest everything into this fight."" Relegation threatened Hamburg find themselves in last chance saloon ahead of Saturday's visit to arch rivals Werder Bremen. Hamburg have not won in 10 games, and are now six points from safety as they prepare for a must-win game over fellow strugglers Bremen. ""The derby is coming just at the right time,"" said Hamburg's Aaron Hunt. ""It is a great chance for us to turn things around."" Playing Friday (all times GMT) Mainz v Wolfsburg (1930) Playing Saturday Bayern Munich v Hertha Berlin, Hoffenheim v Freiburg, Hanover v Borussia Moenchengladbach, Stuttgart v Eintracht Frankfurt (1430), Werder Bremen v Hamburg (1730) Playing Sunday Bayer Leverkusen v Schalke (1430), RB Leipzig v Cologne (1700) Playing Monday Borussia Dortmund v Augsburg (1930)"
77,18/02/2018,20:44,Pitch battle as Reus ends goal drought in Dortmund win,A brilliant first-half strike saw Marco Reus grab his first Bundesliga goal since May to secure a 1-0 win for Borussia Dortmund at Borussia Moenchengladbach on Sunday in a match played on an atrocious pitch.,"The two teams were forced to play on a highly uneven surface in Moenchengladbach after recent poor weather had badly-affected the pitch at Borussia-Park. There were chances for both Lars Stindl and Raul Bobadilla early on, but the pitch remained the focus of attention, as Andre Schuerrle appeared to slip and hurt himself. Schuerrle recovered to set up Reus as Dortmund took the lead against the run of play on 32 minutes. Picking up a pinpoint long pass from Mario Goetze, Schuerrle squared the ball to Reus, whose dipping shot glanced off the crossbar on its way in. ""I actually wanted to hit it further to the left,"" Reus told Sky. ""But the main thing is that the ball went in. We had to scrap today, and we have a lot of work ahead of us."" Reus has missed most of the current campaign with a cruciate ligament tear, and had not been on the scoresheet for Dortmund since scoring a brace on the final day of last season. Jannik Vestergaard found the net for Gladbach just before half-time, but was judged to be offside by the video assistant referee. Thorgan Hazard should have equalised moments later, darting into the box from the left wing before slicing the ball wide. Gladbach continued to push forward after the break, chances falling to both Denis Zakaria and Matthias Ginter before Sokratis denied Bobadilla with a goal-line clearance on 55 minutes. As the second half wore on, Roman Buerki was forced into a string of saves, denying Stindl, Bobadilla and Nico Elvedi to keep Dortmund ahead. At the other end, Reus saw his fizzing half-volley beaten away by Yann Sommer. Earlier in the day, Mario Gomez's goal was enough to secure a first away win of the season for Stuttgart, and inflict a first home defeat since October on Augsburg. The veteran striker gave Stuttgart the lead just before the half-hour mark. After Erik Thommy's free-kick was blocked by the defensive wall, Gomez pounced on the loose ball and swept it into the bottom corner. Michael Gregoritsch appeared to equalise for Augsburg ten minutes later, but he too was correctly ruled offside after a two-minute long consultation with the video assistant referee. Only a superb save from Marwin Hitz stopped Stuttgart from doubling the lead on 65 minutes, the Augsburg goalkeeper denying Gomez from point blank range. ""We should really have won by three or four goals today,"" Gomez told Sky. ""But we showed amazing character, and we're going in the right direction."" The win lifts Stuttgart four points clear of the bottom three, while Dortmund move into second ahead of RB Leipzig's visit to Eintracht Frankfurt on Monday."
78,11/02/2018,20:44,"Kainz brace boosts Bremen survival bid, Ginczek gives Stuttgart hope","Florian Kainz netted two superb goals in Werder Bremen's 3-1 Bundesliga win at home to Wolfsburg on Sunday, helping ease his side's relegation worries.","Stuttgart also boosted their chances of Bundesliga survival with a 1-0 victory over Borussia Moenchengladbach. Werder finished the weekend three points above the relegation zone in 15th with Stuttgart a point and a place above that. Swedish defender Ludwig Augustinsson headed Bremen into an early lead before Austrian international Kainz curled a long-range shot inside the far post on 40 minutes at Bremen's Weser Stadion. Wolfsburg captain Paul Verhaegh gave the visitors hope by converting a penalty early in the second half. However, Bremen sealed the win after midfielder Maximilian Eggestein won possession and striker Max Kruse sent Kainz in behind the defence, the Austrian slotting an ice-cool finish past ex-Bremen goalkeeper Koen Casteels with 18 minutes left. The win leaves Bremen unbeaten in their last seven homes games in all competitions, while Wolfsburg are 13th, but only four points from danger. Earlier, Stuttgart got their first victory under new coach Tayfun Korkut as striker Daniel Ginczek netted the only goal of the game. Korkut, 43, a German-born former Turkey international, was brought in as head coach a fortnight ago to stop Stuttgart's slide after predecessor Hannes Wolf was sacked following a run of seven defeats in eight league games. After overseeing Stuttgart's 1-1 draw at Wolfsburg last weekend, Korkut got off to a winning start at Stuttgart's Mercedes Benz Arena. Just five minutes in, veteran Germany striker Mario Gomez threaded a pass between two defenders for Ginczek to sprint onto and cooly slot home his fourth league goal of the season. Gladbach had their chances as Josip Drmic, Brazil forward Raffael and Germany striker Lars Stindl all went agonisingly close for the visitors, who have now suffered three straight league defeats. This was only Stuttgart's fifth league win since October. Erratic Moenchengladbach drop to tenth despite being the only team other than Hoffenheim to beat runaway leaders Bayern Munich in the Bundesliga this season. On Saturday, Bayern's Robert Lewandowski scored for the 11th straight home league match, equalling the Bundesliga record, with Thomas Mueller also netting in a 2-1 win over Schalke that left Munich 18 points clear."
79,11/02/2018,17:54,Stuttgart eke out first league win under Korkut,Stuttgart got their first victory under new coach Tayfun Korkut to boost their Bundesliga survival chances as striker Daniel Ginczek netted in Sunday's 1-0 home win against Borussia Moenchengladbach.,"Korkut, 43, a German-born former Turkey international, was brought in as head coach a fortnight ago to stop Stuttgart's slide down the table after predecessor Hannes Wolf was sacked having lost seven of eight league games. After overseeing Stuttgart's 1-1 draw at Wolfsburg last weekend, Korkut got off to a winning start at home as Ginczek scored the winner at Stuttgart's Mercedes Benz Arena with just five minutes gone. Veteran Germany striker Mario Gomez threaded a pass between two defenders for Ginczek to sprint onto and then cooly slot home his fourth league goal of the season. Gladbach had their chances as Josip Drmic, Brazil forward Raffael and Germany striker Lars Stindl all went agonisingly close for the visitors who have now suffered three straight league defeats. This is only Stuttgart's fifth league win since October as they remain 14th, still in the relegation battle and just four points from the bottom three. Erratic Moenchengladbach drop to tenth despite being the only other team alongside Hoffenheim to beat runaway leaders Bayern Munich in the Bundesliga this season. On Saturday, Bayern's Robert Lewandowski scored for the 11th straight home league match, equalling the Bundesliga record, as Thomas Mueller also netted as the 2-1 win over Schalke which left Munich 18 points clear."
80,05/02/2018,12:11,Five things we learned from the Bundesliga weekend,"Michy Batshuayi made a blistering start to life at Borussia Dortmund on Friday, firing the team back into the top four with two goals on his debut.","The Belgian wasn't the only debutant to make an impact, as 20-year-old English forward Ademola Lookman grabbed a late winner in his first game for RB Leipzig. The goal saw Leipzig move up to third in the Bundesliga, drawing level on points with second-place Bayer Leverkusen. Both Leverkusen and Leipzig are now 18 points behind leaders Bayern Munich, whose victory over Mainz on Saturday was overshadowed by speculation over coach Jupp Heynckes' future. Here are five things we learned from this weekend's Bundesliga action. Who needs Pierre-Emerick Aubameyang when you have Michy Batshuayi? Just three days after joining Dortmund on a six-month loan deal, Batshuayi enjoyed an explosive debut, grabbing two goals and an assist to inspire his new team to a 3-2 victory in Cologne. ""The way the game went for him today was like a dream,"" said coach Peter Stoeger of his new striker. Batshuayi, meanwhile, is already dreaming of big goals for his six-month sojourn in Westphalia. ""I want to get into the Champions League with Dortmund,"" he said. ""I want to win every single game."" Bayern Munich's dominance of the Bundesliga continued at the weekend, but there was more attention paid to Jupp Heynckes' future. The 72-year-old's contract runs until June, and he has repeatedly refused to talk about extending it. ""I can imagine that readers, viewers and listeners are bored of this topic,"" he said on Friday. Since coming out of retirement to take over at Bayern in the autumn, Heynckes has led the team to 14 victories in 15 Bundesliga games, so it is little wonder that the club would like him to stay beyond the end of the season. ""If I stood naked in front of him, I might have a small chance of persuading him to stay,"" joked club president Uli Hoeness earlier in the week. Everton loanee Ademola Lookman grabbed the headlines on Saturday, scoring 12 minutes into his RB Leipzig debut to secure a late victory over Borussia Moenchengladbach. The 20-year-old Englishman might, however, want to invest in a pair of new boots. ""He was lucky that I didn't take him off again straight away,"" admitted Leipzig coach Ralph Hasenhuettl. ""He was just sliding around in the boots he was wearing. They were the only pair he had brought with him from England, and he didn't want to take them off."" Both goalkeepers were left blushing in Gelsenkirchen as Werder Bremen snatched a late 2-1 win over Schalke. Bremen 'keeper Jiri Pavlenka allowed Yevhen Konoplyanka's shot to slip through his fingers in the first half. His error was overshadowed by the woes of opposite number Ralf Faehrmann, however -- he first fumbled a free-kick to gift Bremen an equaliser, before being nutmegged by Zlatko Junuzovic's late winner. ""Ralf said sorry in the dressing room, and I told him he had nothing to apologise for,"" said Schalke coach Domenico Tedesco. Michael Gregoritsch will have enjoyed watching the Super Bowl on Sunday, having secured three points for Augsburg just hours earlier. The Austrian scored Augsburg's second in a 3-0 win over Eintracht Frankfurt, and celebrated by miming a quarterback's throw. ""I will definitely be watching the Super Bowl later,"" admitted Gregoritsch after the game. ""My four best friends are coming over; I never sleep after a game anyway."""
81,20/12/2017,20:46,Bailey sends Leverkusen into Cup quarters,Leon Bailey netted the winner as Bayer Leverkusen beat Borussia Moenchengladbach 1-0 to reach the quarter-finals of the German Cup on Wednesday.,"Goalless until the 71st minute, the game burst into life when Bailey broke down the left to pick up Kevin Volland's through ball and fire past Yann Sommer. Werder Bremen joined Leverkusen in the last eight by beating Freiburg 3-2. After goals from Ishak Belfodil and Florian Kainz had put Bremen two goals up within 20 minutes, Nils Petersen pulled a goal back from the penalty spot just before the half-hour mark. With 20 minutes to play, Philipp Bargfrede swept the ball in for Bremen's third, the referee overruling the linesman's offside flag. A late goal from Yoric Ravet proved too little for Freiburg."
82,07/12/2016,14:34,Schubert under pressure at Gladbach,Andre Schubert is in danger of becoming the sixth Bundesliga coach fired this season with Borussia Moenchengladbach winless in their last eight games following their 4-0 trashing at Barcelona.,"Gladbach are in freefall down the German league table, they are currently 13th -- five points from the relegation places -- and their last Bundesliga win was at the end of September. Despite a string of changes, Barcelona strolled past Gladbach at the Camp Nou as Arda Turan netted a hat-trick in 17 second-half minutes while Lionel Messi scored his 10th Champions League goal of the season. Director of sport Max Eberl says Gladbach's next three Bundesliga games, against bottom-half clubs Mainz, Augsburg and Wolfsburg matter more than the Barcelona defeat, but the lack of confidence is clear. ""Barcelona are not a team to use as a yardstick, they play no role in my evaluation,"" said Eberl. ""What matters for us is the next three Bundesliga games."" Gladbach finished the Champions League's pool games third in their group to progress to the knock-out stages of the Europa League. But reversing the run of poor results and preserving their Bundesliga status is now top priority. ""We clearly have too few points,"" said Eberl, with Gladbach having taken 13 points from 13 league games. ""We all know we're lagging behind, we will try to change that."" A victory at Mainz on Sunday is now compulsory, a situation Schubert is all too mindful of. The 45-year-old says the team is missing a leader, like Swiss midfielder Granit Xhaka who was sold to Arsenal in the off season. ""A vocal leading player like Granit Xhaka is not there at he moment,"" said Schubert. ""We are in a points situation which causes unrest. ""We have to take the situation in hand and attack."" Schubert replaced Lucien Favre in September 2015 and impressively turned five straight Bundesliga defeats into a 10-match unbeaten run, guiding the team to fourth last season to qualify for the Champions League. Now, he is currently the hot favourite to follow the fate of Norbert Meier, who was sacked by Darmstadt on Monday. Viktor Skrypnyk (Werder Bremen), Bruno Labbadia (Hamburg), Dieter Hecking (Wolfsburg) and Markus Kauczinski (Ingolstadt) have all been dismissed by Bundesliga teams since September."
83,22/11/2016,02:00,Top spot at stake as Arsenal host PSG,"worldfootball looks ahead to Wednesday's Champions League action with Arsenal v Paris Saint-Germain the plum tie while Barcelona, Manchester City and Bayern Munich all face challenging away games (kick-offs 1945 GMT unless stated):","<strong>Group A</strong> at London Arsenal (ENG) v Paris Saint-Germain (FRA) The Gunners will be out to put one over the French champions, whom they held 1-1 in Paris, as both struggle for top spot in Group A, the pair having already booked passage to the knockout phase. The Londoners could look to Olivier Giroud, who rescued a point from the bench at Old Trafford, to spearhead their attack after Alexis Sanchez played through hamstring trouble. As Arsenal drew with Manchester United to leave them fourth in the Premier League, PSG warmed up for Wednesday with a fourth straight win, 2-0 over Nantes, as they chase down French leaders Nice. PSG's Old Trafford misfit Angel Di Maria scored against Nantes but came off in the first half with a thigh injury, albeit not one expected to keep him out. Argentine playmaker Javier Pastore is set to miss the trip to London with a knee problem. Ludogorets (BUL) v Basel (SUI) at Sofia Bulgarians Ludogorets and Basel have proved the makeweights in Group A with both garnering a solitary point to date. A Europa League spot is the consolation prize that awaits the side that can cement third place. The two parted 1-1 in the first meeting in Switzerland. Previous encounters saw the Swiss win handsomely in a two-leg playoff three years ago. Ludogorets will be slight favourites, courtesy of home advantage, and they gave Arsenal a brief scare in their last outing, but let slip a two-goal lead to succumb 3-2. <strong>Group B</strong> Napoli (ITA) v Dynamo Kiev (UKR) at Naples Napoli might just about top the group but they are locked in a three-way struggle with Benfica and Besiktas for two places in the last 16. They came from behind to see off Kiev in Ukraine in the reverse fixture and badly need three points here. Their weekend 2-1 win at Udinese kept them in touch with the top four in Serie A, though prolific striker Arkadiusz Milik is still out injured. Lorenzo Insigne grabbed a brace at Udinese and the Italians will be looking to him and Jose Callejon to fire them past Dynamo, the whipping boys of the group with just one point. Besiktas (TUR) v Benfica (POR) at Istanbul (Kick-off at 1745 GMT) Benfica, level on points with Napoli, travel to Turkey's still-unbeaten Besiktas, who are just a point adrift of the top pair. A Benfica victory will take the two-time champions, top in the Portuguese league, through to the knock-out phase. But they cannot afford to be complacent against a Besiktas side which held them to a draw in Lisbon. The Turkish champions are looking to get out of the pool phase for the first time in six attempts and their fans are sure to give Benfica a hostile reception. <strong>Group C</strong> Celtic (SCO) v Barcelona (ESP) at Glasgow Top spot is still up for grabs in Group C as Barcelona, two points clear of Manchester City, travel to a Celtic side they squashed 7-0 at the Camp Nou. A win for Lionel Messi and Co. -- he is set to return after a sickness bug at the weekend -- will see the Spanish champions into the last 16, though a draw might also do it depending on the other game. Luis Suarez will be back from suspension, which is bad news for a Celtic side who are two points adrift at the bottom of the group. The Scottish giants warmed up for Barca with a 1-0 win over Kilmarnock which left them 13 points clear in their domestic league. Borussia Moenchengladbach (GER) v Manchester City (ENG) at Moenchengladbach, Germany City's Yaya Toure-inspired weekend win at Crystal Palace keeps them a point off leaders Chelsea in the Premier League. But it is at the back that they have worries, particularly the fitness of talisman centre-back Vincent Kompany, who suffered a head injury in a collision with keeper Claudio Bravo at Palace. Victory in Germany for Pep Guardiola's side will see them into the next round. The home side look on course for a Europa League slot and need to pull off a surprise win if they are to have any hope of making further progress in this competition. On current form that looks a tall order after successive domestic losses, to Cologne and Hertha Berlin, sent them into the bottom six in the Bundesliga. <strong>Group D</strong> Rostov (RUS) v Bayern Munich (GER) at Rostov, Russia (Kick-off 1700 GMT) Five-time European champions Bayern head to Russia's Rostov for their Group D clash licking their wounds after being knocked from the top of the Bundesliga. Their 1-0 defeat at Dortmund on Saturday allowed RB Leipzig to finish the weekend top of the German league table. Bayern are already into the last 16 but need a win at Rostov to stay in touch with group leaders Atletico Madrid, who they host on December 6 for a potential top-spot decider. Bayern will be without injured keeper Manuel Neuer, meaning Sven Ulreich will deputise. Rock-bottom Rostov and PSV have a single point each so are locked in a struggle for a Europa League place only. The Russians have a solid home record and held Rubin Kazan to a goalless draw on Friday. Atletico Madrid (ESP) v PSV Eindhoven (NED) at Madrid Atletico might already be through and top of the group, but they are on a poor run in the Spanish league. Beaten finalists in two of the last three editions of the Champions League, the Spaniards will qualify as group winners if they win and Bayern do worse. Coach Diego Simeone seems to be losing his iron grip a tad and success built on a rock-solid defence appears to be slipping. Phillip Cocu's PSV will be massive underdogs nonetheless and they only drew 0-0 at lowly Willem II at the weekend in domestic action, with their Dutch championship hopes evaporating slowly."
84,02/11/2016,12:52,'Wouldn't happen to Bayern' fumes Gladbach boss,"Borussia Moenchengladbach have accused Bundesliga bosses of favouritism towards Bayern Munich as they face a successive Friday night match, three days after a mid-week game in Europe.","Gladbach were held to a 1-1 draw home to Celtic in the Champions League on Tuesday and play Hertha Berlin away in a key Bundesliga match on Friday. It is the second time in quick succession Gladbach have been given a short turn-around by the German Football League (DFL) after they drew 0-0 with Frankfurt last Friday -- three days after a German Cup win home to Stuttgart. Borussia, 11th in Germany's top flight, are struggling for form and are winless in their last four German league games. ""I have to say, what were the league thinking giving a Champions League side a game directly on a Friday?"" Max Eberl, Gladbach's director of sport, asked magazine Kicker. ""That would never happen to Bayern Munich. I have never heard of Bayern playing on a Friday after a Champions League game. ""They always play on Saturdays and Sundays. Borussia Moenchengladbach must now run out at Hertha Berlin. I find that extremely unfortunate."" Following their Champions League draw Gladbach remain third in Group C, three points behind Manchester City, who they host in three weeks' time in a must-win clash. Eberl is realistic about his side's chances of progressing to the knock-out stages with Pep Guardiola's City and Barcelona in pole position to reach the last 16. But the Germans are still mathematically in contention and third at least carries automatic qualification for the Europa League, if it comes to that. ""We still have matters in our own hands and can go into the winter break (in January) in the Europa League,"" said Eberl. ""Bold fans have dreamt of 'a final' against Manchester City, but that was not in our heads against Celtic."""
