,date,hour,title,subtitle,text
121,03/11/2015,23:10,Lichtsteiner nets on return as Juve draw at Gladbach,Ten-man Juventus took a step towards the Champions League's knock-out phase with a 1-1 draw at Borussia Moenchengladbach on Tuesday as Stephan Lichtsteiner scored on his return from heart surgery.,"The Swiss defender netted just before the half-time break to cancel out Fabian Johnson's 18th-minute opener for the visitors. It was Lichtsteiner's first match since the 31-year-old wing-back had an operation to fix an irregular heartbeat after coming off during a match in September with breathing difficulties. Juventus played the last 35 minutes with ten men after their Brazilian midfielder Hernanes was sent off for a late tackle on Gladbach's Alvaro Dominguez, just as the visitors were starting to take control of the game. Despite the point, Juventus remain unbeaten in Europe, but dropped to second in Group D with Manchester City going top by virtue of their 3-1 away win at Sevilla, in so doing qualifying for the last 16. Gladbach remain bottom of the group with just two points from four games and probably need to beat Sevilla in their next home Champions League match later this month just to qualify for the Europa League's knock-out phase as third in the group. ""We're all very disappointed, we controlled the game and had the better chances,"" Gladbach's Guinea international Ibrahima Traore told Sky. ""Unfortunately all that was missing at the end was a goal."" After their teenage defensive midfielder Mahmoud Dahoud hit the crossbar with a curling long-range shot, the hosts took a deserved lead at Borussia Park. Juve's Giorgio Chiellini failed to clear a low cross into the box, Brazilian striker Raffael collected the loose ball and played in US international Johnson, who slotted his shot past the Italian goalkeeper Gianluigi Buffon. Having been named in the starting line-up, Lichtsteiner showed he is back to his best when Paul Pogba lifted a superb pass over the Gladbach defence and the Swiss smashed the ball past his national team-mate Yann Sommer on the volley on 44 minutes. It was 1-1 at the break but the game's tempo changed when Dutch referee Bjorn Kuipers showed Hernanes a straight red card on 55 minutes, although replays showed both he and Dominguez went fully committed into a challenge for the loose ball. However, the few clear chances Gladbach carved out were expertly saved by the impressive Buffon. With time almost up, Juventus's veteran goalkeeper kept his side in the game when the 37-year-old palmed Thorgan Hazard's shot over the bar with a reflex save. Gladbach's caretaker coach Andre Schubert has yet to secure a contract despite winning six straight Bundesliga games. His record in Europe is now two draws and a defeat after his side earned a point in the away match in Turin a fortnight ago and lost at home to Manchester City."
122,02/11/2015,18:35,"I'm no Harry Potter, says Gladbach's Schubert",Borussia Moechengladbach's caretaker coach Andre Schubert says there is no magic secret to his side's remarkable revival as he laughed off a comparison to the fictional wand-waving character Harry Potter.,"Gladbach host Juventus on Tuesday in the Champions League needing a win to keep alive their faint hopes of reaching the knock-out phase after two defeats, plus a draw at Juventus a fortnight ago. Schubert took charge of Gladbach at the end of September when Lucien Favre walked out with the team bottom of the Bundesliga after five straight league defeats. He has hauled them up to fifth with a Bundesliga record-equalling six consecutive victories, which led to an Italian journalist asking if he is the 'Harry Potter of Moenchengladbach' in a reference to the central character of the JK Rowling novels. ""I have no magic wand, but fortunately I do have a few wizards out on the pitch,"" quipped Schubert. ""We'll try and present the opponents with a challenge and, of course, we want to win. ""Juve are a strong side, but we have an idea how to face them and we'll see if it is a good idea."" Gladbach are bottom of Group D with just a point after defeats away to Sevilla, home to Manchester City and a goalless draw in Turin a fortnight ago, while Juve are top. But the draw away to the 2015 Champions League finalists has instilled further confidence in a Gladbach team buoyed by their recent victories. ""In Turin, we played very well defensively, but we didn't attack as well as we do in the Bundesliga,"" said Gladbach midfielder Ibrahima Traore. ""Maybe we were lacking a bit of courage, but we want to do things differently at home (against Juventus),"" said the Guinea international. ""We need a win to keep alive our hopes of progressing, that's why I believe that we will play differently, with more courage. ""From day one, the new coach has given us a lot of confidence, which we were lacking after five straight league defeats. ""The most important thing, however, was regaining the confidence -- he told us that we were very good footballers and capable of winning against any team."" Despite turning Gladbach's fortunes around after just 40 days in charge, Schubert has yet to be offered a full-time contract and is waiting for Borussia to make a decision on his future. Juventus coach Massimiliano Allegri said he is impressed by what Schubert has achieved, but said his side can ill afford to show Gladbach too much respect. ""Gladbach are currently on a good run, they have six straight wins in the league. We have not managed two wins in a row this season,"" he said. ""There are always changes to a team, whether it is the personnel or tactics. ""It is not so much a question of tactics, but of attitude on the pitch. We have made changes too, but not so many of them. ""The Champions league is the highest level there is in football. ""In the league, you always have the possibility to correct a bad patch, but in the Champions League, every game is like a final, lose and you are out quickly."""
123,02/11/2015,02:10,Bottom side Gladbach host Juventus on record high,"Borussia Moenchengladbach host Juventus on Tuesday bottom of their Champions League group, but buoyed by their record run of six league wins which has seen them shoot up the Bundesliga.","Under caretaker coach Andre Schubert, Gladbach have won all of their league games to climb from bottom of the German league to fifth. Schubert's six wins on his first stint in the Bundesliga equals the record Willi Entenmann achieved with VfB Stuttgart in 1986. To give that context, Bayern Munich's coach Pep Guardiola won only his opening three games in his first Bundesliga season in 2013/14. But Borussia are bottom of Group D in Europe after losing their opening two games: 3-0 at Sevilla and 2-1 at home to Manchester City before drawing at Juventus a fortnight ago. Gladbach's 4-1 Bundesliga win at Hertha Berlin on Saturday was a timely booster after holding Juventus to a goalless draw in Turin. Gladbach need to beat Juventus to keep alive their faint hopes of reaching the knock-out stages. Since Schubert took charge, after Lucien Favre's shock resignation in September, Gladbach have only lost once -- when Manchester City secured a 2-1 comeback win at Borussia Park in the Champions League. Gladbach have never lost to Serie A opposition in six games at this level, but this is their first year they are playing in Europe since the 1977/78 season. Unbeaten in Europe, Juventus will secure qualification for the last 16 if they beat Gladbach and Sevilla lose at Manchester City on Tuesday. Juve will be without Germany midfielder Sami Khedira who tore his calf early in Saturday's 2-1 win at Torino and came off after ten minutes. ""He told me he had a problem, but I risked him and used him in the game,"" said Juventus coach Massimiliano Allegri. Juventus have had a disappointing start to the season and are tenth in the Italian league, but top Group D after wins over City and Sevilla before drawing with Gladbach. The Germans are relishing taking on last season's finalists again and right-back Havard Nordveit, who scored their fourth goal in Berlin, says there will be a special atmosphere. ""We're really looking forward to this special game,"" said the Norway international. ""This is the second Champions League match at Borussia Park and the atmosphere will be top. ""I hope we can play our game and then anything can happen. ""It's a good time to play such a big match. ""I don't believe that Juventus will think: 'this will be easy'. ""They also know that we have won six league games in a row, that we are self-confident and that it will be difficult against us."" Despite hauling his team up the league table, Schubert does not have a permanent contract, but director of sport Max Eberl has hinted he is set to get the head coach job full-time. A win over Juve would be another step in the right direction. ""Now comes the Champions League, and there's every reason I'll still be here, I think,"" said Schubert after Gladbach's win in Berlin. ""For anything else, you have to ask Max Eberl. ""I'll do this job as long as I can. ""I am enjoying working with the team and I like working in professional football, but it's not something I have to do."""
124,02/11/2015,02:10,Bottom side Gladbach host Juventus on record high,"Borussia Moenchengladbach host Juventus on Tuesday bottom of their Champions League group, but buoyed by their record run of six league wins which has seen them shoot up the Bundesliga.","Under caretaker coach Andre Schubert, Gladbach have won all of their league games to climb from bottom of the German league to fifth. Schubert's six wins on his first stint in the Bundesliga equals the record Willi Entenmann achieved with VfB Stuttgart in 1986. To give that context, Bayern Munich's coach Pep Guardiola won only his opening three games in his first Bundesliga season in 2013/14. But Borussia are bottom of Group D in Europe after losing their opening two games: 3-0 at Sevilla and 2-1 at home to Manchester City before drawing at Juventus a fortnight ago. Gladbach's 4-1 Bundesliga win at Hertha Berlin on Saturday was a timely booster after holding Juventus to a goalless draw in Turin. Gladbach need to beat Juventus to keep alive their faint hopes of reaching the knock-out stages. Since Schubert took charge, after Lucien Favre's shock resignation in September, Gladbach have only lost once -- when Manchester City secured a 2-1 comeback win at Borussia Park in the Champions League. Gladbach have never lost to Serie A opposition in six games at this level, but this is their first year they are playing in Europe since the 1977/78 season. Unbeaten in Europe, Juventus will secure qualification for the last 16 if they beat Gladbach and Sevilla lose at Manchester City on Tuesday. Juve will be without Germany midfielder Sami Khedira who tore his calf early in Saturday's 2-1 win at Torino and came off after ten minutes. ""He told me he had a problem, but I risked him and used him in the game,"" said Juventus coach Massimiliano Allegri. Juventus have had a disappointing start to the season and are tenth in the Italian league, but top Group D after wins over City and Sevilla before drawing with Gladbach. The Germans are relishing taking on last season's finalists again and right-back Havard Nordveit, who scored their fourth goal in Berlin, says there will be a special atmosphere. ""We're really looking forward to this special game,"" said the Norway international. ""This is the second Champions League match at Borussia Park and the atmosphere will be top. ""I hope we can play our game and then anything can happen. ""It's a good time to play such a big match. ""I don't believe that Juventus will think: 'this will be easy'. ""They also know that we have won six league games in a row, that we are self-confident and that it will be difficult against us."" Despite hauling his team up the league table, Schubert does not have a permanent contract, but director of sport Max Eberl has hinted he is set to get the head coach job full-time. A win over Juve would be another step in the right direction. ""Now comes the Champions League, and there's every reason I'll still be here, I think,"" said Schubert after Gladbach's win in Berlin. ""For anything else, you have to ask Max Eberl. ""I'll do this job as long as I can. ""I am enjoying working with the team and I like working in professional football, but it's not something I have to do."""
125,31/10/2015,20:24,"Schubert equals record, but still no Gladbach contract",Borussia Moenchengladbach's caretaker coach Andre Schubert still has no contract despite having equalled the record number of wins for a new Bundesliga coach on Saturday.,"Gladbach's 4-1 win at Hertha Berlin on Saturday was their sixth since Schubert took charge in September, when they were bottom of the table after five straight defeats which led to Lucien Favre's shock resignation. Schubert has now hauled Gladbach up to fourth and his six wins on his first stint in the Bundesliga equals the record Willi Entenmann achieved with VfB Stuttgart in 1986. To give Schubert's remarkable run context, Bayern Munich's coach Pep Guardiola won only his opening three games in his first Bundesliga season in 2013/14. ""We're all just caretaker coaches -- I don't even have a contract,"" said Schubert of his backroom staff. Gladbach host last seasons finalists Juventus in the Champions League on Tuesday. While Schubert's results speak for themselves, Gladbach's director of sport Max Eberl hinted that he is likely to get the job permanently. ""We are successful. It is a good and clear situation and we will make a good decision,"" Eberl said. Swiss international Granit Xhaka said the team want Schubert, who was promoted from Gladbach's youth team coach, to keep the job. ""When you win so much and pick up so many points, then that is also down to the coaches,"" said Xhaka. ""We would like to keep him. ""We can only put in our performances on the pitch, the board has to decide everything else."" In his nine games and 40 days in charge, Schubert has lost just once, 2-1 at home to Manchester City in the Champions League. They have won seven matches, including knocking Schalke out of the German Cup and earned a Champions League point with a goalless draw at Juventus. Schubert is the coach of Germany's Under-15 team and had only previously worked in the second division at Paderborn and St Pauli at senior level. But his Gladbach side is playing with confidence as they blitzed Hertha with two goals in as many first-half minutes at Berlin's Olympic Stadium. Left-back Oscar Wendt put them ahead, then a solo effort from Brazil striker Raffael made it 2-0 after 28 minutes. Gladbach grabbed a third when Xhaka drilled home a penalty on 55 minutes after Ivory Coast winger Ibrahima Traore was fouled in the area. Alexander Baumjohann converted a late penalty for Hertha after being fouled before Havard Nordtveit grabbed Gladbach's fourth in added time. The result boosts Gladbach before they face Juventus. ""Now comes the Champions League, and there's every reason I'll still be here, I think,"" said Schubert. ""For anything else, you have to ask Max Eberl. ""I'll do this job as long as I can. ""I am enjoying working with the team and I like working in professional football, but it's not something I have to do."""
126,22/10/2015,02:15,Allegri slams 'selfish' Juventus players,Juventus coach Massimiliano Allegri slammed the selfish players whose misses heaped unwelcome pressure on the Italian champions following a scoreless draw with Champions League rivals Borussia Monchengladbach on Wednesday.,"After beating Manchester City (2-1) away and dominating Sevilla in a 2-0 win last time out, Juve, last season's beaten finalists, were fully expected to claim their third consecutive win to keep City at arm's length. But a determined performance from the revived Bundesliga side, City's last-gasp 2-1 win over Sevilla at the Etihad Stadium and a string of misses in Turin means Juve's lead on Manuel Pellegrini's side at the top of Group D has been cut to just one point. After frustrating the Bianconeri in Turin, Andre Schubert's side will fancy causing an upset when the Italian champions visit in their next Champions League outing next month. Certain to be given a tough game by City in Turin in their penultimate game before Juventus then travel to Sevilla, it is a prospect Allegri appears to have already considered when he emerged angry and pointing the finger at unnamed players after Wednesday's fixture. ""We had three situations in which we had players that were better placed in goalscoring positions,"" said Allegri, who in an earlier interview with Mediaset claimed some players ""made the wrong choices because they were selfish"". He added: ""Maybe they didn't see they were there, but these are things we have to improve on. We had to deal with a lot of counter attacks, and then if you make a bundle of errors, winning becomes difficult. ""We're making too many mistakes in the final 30 metres of the pitch and not scoring enough."" It is the second successive game Juve have failed to find the net, following a scoreless draw in the 'Derby d'Italia' away to Inter Milan at the San Siro on Sunday. It was not for a lack of trying, but the Italian champions struggled to find a way past Gladbach goalkeeper Yann Sommer to clinch the win that would have given them an element of comfort ahead of their remaining three group games. Allegri had used some of his pre-match conference on Tuesday to call on misfiring midfielder Paul Pogba to lift his flagging game, and the Frenchman responded positively. Pogba produced a number of chances, mostly from distance, in either half but failed to break down a stubborn visitors' backline. Allegri did not name names and despite the 22-year-old saying he had taken his coach's advice on board, Pogba insisted he would not change the fundamentals of his game, telling Premium Sport: ""I always listen to what Allegri says and I always give 100 percent on the pitch. ""I should always do what he says, but I also have to play football the way I know how. I have to be patient and maybe the goals will come."" Juve's Spanish striker Alvaro Morata had been bidding for his sixth consecutive goal in a Champions League game, having pulled level with the club record of Alessandro Del Piero last time out. But the Spaniard was frustrated throughout and replaced in the latter stages by Paulo Dybala. Juve had late penalty claims waved away when Mario Mandzukic fell as he tried to run past Dominguez and on to Sami Khedira's through ball. Allegri's frustration grew and minutes later Mandzukic was replaced by Simone Zaza, while Morata later made way for Paulo Dybala. Their arrivals injected some pace and vibrancy into Juve's attack, but were not sufficient to stop Gladbach from claiming a first point that could prove useful in the event they end up battling for a third place finish for which the reward is a place in the Europa League. ""This time last season we had three points,"" added the Juve boss. ""It's wide open. We have to keep going like this in terms of our defence but start scoring goals."" Schubert said: ""It's great to be coach of this side and I'm proud of the fact we snatched our first point from Juventus. ""I don't know how our next games will go but what is important is how we play, not where we finish in the group."""
127,20/10/2015,20:59,Allegri calls out misfiring Pogba on eve of Gladbach clash,Juventus coach Massimiliano Allegri has called on under-fire Paul Pogba to defy his critics when the Italian champios host Borussia Monchengladbach looking to edge closer to the Champions League last-16 on Wednesday.,"France midfielder Pogba is routinely touted as one of the most sought-after players in the world, but the Juventus midfield star has failed to live up to expectations so far this season. His case has not been helped by the summer departures of former midfield companions Andrea Pirlo and Arturo Vidal, and the arrival of Sami Khedira among other new recruits to Juve's new-look side. Pogba was virtually invisible during the first half of Sunday's 'Derby d'Italia' away to Inter Milan, re-emerging into focus during an improved second half before the match finished scoreless. A win at home to Gladbach would make it three out of three for Allegri's men in Turin on Wednesday, following victories away to Manchester City (2-1) and at home to Sevilla (2-0). But Pogba, unlike Germany star Sami Khedira, is keeping Allegri occupied. ""During the first half (last weekend) Pogba didn't play well, then he did. He's going through a period in which he needs to find himself again and start doing the things he knows how to,"" Allegri told reporters. ""He needs to give a lot, and I expect it. Pogba has a lot of room for improvement and has to start asking questions of himself."" Juventus start as favourites despite Andre Schubert's side recently overturning their poor start to the campaign with a run of five league wins, including a 5-1 thrashing of Eintracht Frankfurt last weekend. Similarly, Juve's Champions League form has been at odds with their Serie A results. An underwhelming start has left the champions just four points above the relegation zone and nine points behind leaders Fiorentina after eight games. But in true Jekyll and Hide style, Juve -- last season's beaten finalists -- appear to transform when the challenge of Europe's premier club competition looms. They are among only six teams with maximum points from their first two games and on Sunday, at a sold-out San Siro, played with a swagger on their way to earning a deserved point. Part of Juve's revival is down to Khedira, the Germany international who has only recently returned to the fray following a more than two-month injury absence. While Pogba is giving Allegri food for thought, Khedira is making him purr. ""He's among the best in Europe. On Sunday, along with (Andrea) Barzagli, he had an amazing game,"" said Allegri. ""He makes few mistakes and is always in the right place at the right time. And he's not reched full fitness yet."" Khedira accepted the plaudits gracefully, saying: ""I feel right at home here."" Allegri has left doubts over who will start up front, hinting that Mario Mandzukic or even Simone Zaza could partner Alvaro Morata, who has scored in Juve's five past Champions League outings, in place of Paulo Dybala. ""Zaza is doing really well and he showed that on Sunday, whereas Dybala has to be left in peace to come into his own, just as we did with Morata last year."" Schubert earlier promised his ""aggressive"" side would be pressing Juve hard for the win and Allegri expects a harder challenge than last time out when Sevilla failed to spark in Turin. ""It will be decisive if we win, but it will be different to what we faced against Sevilla,"" added Allegri. ""They're coming here with good form, they've won the last five Bundeliga games. Given that it's decisive if one of us wins, we have to play this as a totally one-off game."""
