,date,hour,title,subtitle,text
20,19/08/2018,00:25,"Messi, Coutinho get Barcelona off to winning start",Two goals from Lionel Messi either side of a Philippe Coutinho strike allowed Barcelona to start their defence of the Spanish title with a 3-0 win over Alaves at the Camp Nou on Saturday night.,"Wearing the captain's armband following the departure of Andres Iniesta to Japan, Messi stepped up to send a cheeky second-half free-kick under the jumping wall and into the net for the opener, and Barca's 6,000th La Liga goal. Coutinho, who had come off the bench, lashed in the second goal before Messi added gloss to the scoreline in stoppage time, with the clock having ticked past midnight in Catalonia. While they took their time to get going, it was an ideal opening result for Ernesto Valverde's side, who are hoping to once again see off the challenges of Real Madrid and Atletico Madrid in the battle for the title. While Cristiano Ronaldo has left Real for Juventus, Messi remains as the figurehead at Barcelona and he won his 33rd trophy with the club in the Spanish Super Cup victory over Sevilla last weekend. The 31-year-old will be aiming to put behind him the desperate disappointment that was Argentina's World Cup campaign, and he was unlucky not to get a hat-trick here. Messi saw a free-kick crash back off the bar late in the first half after going over the wall, so when he was handed another chance from a similar position in the 64th minute, he changed tack. This time, 22 yards out, he surprised the jumping Alaves defenders by going underneath and giving Fernando Pacheco in goal no chance. He then sent another curling effort off the post soon after. Coutinho started the match on the bench alongside summer signings Arthur, Malcom, Clement Lenglet and Arturo Vidal. However, he was sent on at the start of the second half and his goal seven minutes from the end effectively killed the game. The Brazilian had just squandered one chance after being played in by Messi when he picked up a pass from compatriot Arthur before lashing in, ensuring victory on the opening weekend for Barca for the 10th consecutive season. Messi, the top scorer in La Liga last season, then controlled a ball into the box on his chest before slotting in his second and his team's third in stoppage time. After the departures of Ronaldo and Zinedine Zidane, Real play their first league game under new coach Julen Lopetegui on Sunday night when they entertain near neighbours Getafe. Last season's runners-up Atletico, fresh from beating Real 4-2 after extra time in the UEFA Super Cup in Tallinn in midweek, start at Valencia on Monday. Elsewhere on Saturday, former Arsenal midfielder Santi Cazorla played his first competitive game in almost two years following a nightmare time with injuries. The 77-times capped Spanish international, who is now 33, suffered a serious Achilles injury playing for Arsenal in the Champions League in October 2016. After eight operations, the little attacking midfielder suffered a serious infection in the tendon that almost led to an amputation. But he fought back and recently returned to Villarreal, seven years after his departure for Malaga. Cazorla started in Villarreal's season-opener at home to Real Sociedad, as his side took a first-half lead through Gerard Moreno. However, the visitors fought back to win 2-1 with goals from Willian Jose and Juanmi, giving the Basque club's new coach Asier Garitano the perfect start. The other winners so far on the opening weekend are Levante, who triumphed 3-0 at Betis on Friday."
21,19/08/2018,00:25,"Messi, Coutinho get Barcelona off to winning start",Two goals from Lionel Messi either side of a Philippe Coutinho strike allowed Barcelona to start their defence of the Spanish title with a 3-0 win over Alaves at the Camp Nou on Saturday night.,"Wearing the captain's armband following the departure of Andres Iniesta to Japan, Messi stepped up to send a cheeky second-half free-kick under the jumping wall and into the net for the opener, and Barca's 6,000th La Liga goal. Coutinho, who had come off the bench, lashed in the second goal before Messi added gloss to the scoreline in stoppage time, with the clock having ticked past midnight in Catalonia. While they took their time to get going, it was an ideal opening result for Ernesto Valverde's side, who are hoping to once again see off the challenges of Real Madrid and Atletico Madrid in the battle for the title. While Cristiano Ronaldo has left Real for Juventus, Messi remains as the figurehead at Barcelona and he won his 33rd trophy with the club in the Spanish Super Cup victory over Sevilla last weekend. The 31-year-old will be aiming to put behind him the desperate disappointment that was Argentina's World Cup campaign, and he was unlucky not to get a hat-trick here. Messi saw a free-kick crash back off the bar late in the first half after going over the wall, so when he was handed another chance from a similar position in the 64th minute, he changed tack. This time, 22 yards out, he surprised the jumping Alaves defenders by going underneath and giving Fernando Pacheco in goal no chance. He then sent another curling effort off the post soon after. Coutinho started the match on the bench alongside summer signings Arthur, Malcom, Clement Lenglet and Arturo Vidal. However, he was sent on at the start of the second half and his goal seven minutes from the end effectively killed the game. The Brazilian had just squandered one chance after being played in by Messi when he picked up a pass from compatriot Arthur before lashing in, ensuring victory on the opening weekend for Barca for the 10th consecutive season. Messi, the top scorer in La Liga last season, then controlled a ball into the box on his chest before slotting in his second and his team's third in stoppage time. After the departures of Ronaldo and Zinedine Zidane, Real play their first league game under new coach Julen Lopetegui on Sunday night when they entertain near neighbours Getafe. Last season's runners-up Atletico, fresh from beating Real 4-2 after extra time in the UEFA Super Cup in Tallinn in midweek, start at Valencia on Monday. Elsewhere on Saturday, former Arsenal midfielder Santi Cazorla played his first competitive game in almost two years following a nightmare time with injuries. The 77-times capped Spanish international, who is now 33, suffered a serious Achilles injury playing for Arsenal in the Champions League in October 2016. After eight operations, the little attacking midfielder suffered a serious infection in the tendon that almost led to an amputation. But he fought back and recently returned to Villarreal, seven years after his departure for Malaga. Cazorla started in Villarreal's season-opener at home to Real Sociedad, as his side took a first-half lead through Gerard Moreno. However, the visitors fought back to win 2-1 with goals from Willian Jose and Juanmi, giving the Basque club's new coach Asier Garitano the perfect start. The other winners so far on the opening weekend are Levante, who triumphed 3-0 at Betis on Friday."
22,22/04/2018,21:14,Las Palmas relegated from La Liga after Alaves hammering,Las Palmas had their relegation from La Liga confirmed on Sunday following an emphatic 4-0 defeat at home to Alaves.,"The club from Gran Canaria needed a win to keep alive their slim hopes of staying in Spain's top flight for a fourth straight season. However, they suffered a fifth successive defeat in front of a sparse crowd on a wet Sunday in the Canary Islands, with Barcelona loanee Munir El Haddadi's second-half brace having Alaves in control before Alvaro Medran and Ruben Sobrino added late goals. The appointment of Paco Jemez as coach midway through the season failed to improve the fortunes of the struggling side, who have now gone 12 games without a win. They are the second team to be relegated from La Liga after bottom club Malaga's fate was sealed in midweek."
23,17/03/2018,23:06,"Rodrigo, Zaza send Valencia third in Spain",Rodrigo and Simone Zaza scored for Valencia in a 3-1 win over Alaves on Saturday that lifted them above defending champions Real Madrid and into third place in La Liga.,"Italy international Zaza teed up Rodrigo to open the scoring on 19 minutes at Mestalla as the latter found the net for the fourth time in three games. Zaza doubled the advantage just past the half hour when he bundled in a cross for his 12th goal of the season, but Ruben Sobrino cut the deficit for Alaves early in the second half. An own goal from centre-back Victor Laguardia on 54 minutes sealed a sixth league win in seven for Marcelino's Valencia, who climbed two points above Real ahead of their home game against Girona on Sunday. ""The team played well, an extraordinary first half, then the goal just as the second half began gave us some doubts in defence, but we recovered quickly with the third,"" said Marcelino. Real Betis climbed to within a point of a potential Europa League spot with a 3-0 home win over Espanyol, while Getafe are one point further back after coming from behind to claim a 2-1 victory at Real Sociedad. Deportivo La Coruna and Las Palmas remain mired in deep trouble in the relegation zone following a 1-1 draw. Former Barcelona starlet Alen Halilovic fired Las Palmas ahead after just three minutes in northwest Spain, but hosts Deportivo levelled through Raul Albentosa. The result favoured neither side with Deportivo's winless run stretching to 14 matches and leaving them seven points from safety, while Las Palmas are six points adrift of 17th-placed Levante. Leaders Barcelona host Athletic Bilbao on Sunday as second-placed Atletico Madrid, who are eight points behind, travel to Villarreal. Sevilla, fresh off their shock elimination of Manchester United in the Champions League last 16, return to domestic duty away to Leganes."
24,23/02/2018,02:05,Bale blues cloud Real Madrid's return to form,"Talk of a crisis at Real Madrid is over for now, but the form of Gareth Bale remains a cause of concern ahead of this weekend's meeting with Alaves in La Liga.","The Welshman was back on the bench for Wednesday's 3-1 victory at Leganes, his involvement restricted to a late cameo as Zinedine Zidane's side claimed a fourth consecutive win. Bale had started in last weekend's 5-3 success at Betis but failed to impress, having also been left out of the line-up for the 3-1 Champions League win against Paris Saint-Germain. He has not completed 90 minutes since September due to injury and poor form, and the Madrid media appear to have made their minds up -- ""Bale's credit has run out"", said the headline in one piece in sports daily Marca on Thursday. When Zidane was asked if Bale had been left out in Leganes to protect him, the Frenchman's response hinted all is not well. ""It was a little bit of everything. I am happy with Gareth, but we need to go little by little with him,"" he said. ""We want him to find his best form, then we'll see what we do in the coming games. We are playing well at the moment and I am going to need everyone."" Cristiano Ronaldo was rested at Leganes but could return as Madrid look to extend a run that has seen them take 16 points from a possible 18. That form has lifted them into the top three, although they remain 14 points behind leaders Barcelona. ""I never look back the way. Now we have recovered third place, we need to keep going until we get second and on until the end,"" added Zidane, who nevertheless has considerable selection issues. Sergio Ramos is suspended against Alaves, while Marcelo, Toni Kroos and Luka Modric are all fighting to shake off injuries ahead of the PSG second leg on March 6. Alaves could be dangerous opponents too, thanks to a stunning turnaround under new coach Abelardo that has lifted them 10 points clear of the relegation zone. Following their 1-1 Champions League draw at Chelsea, Barcelona host Girona looking to extend their unbeaten run in La Liga to 32 matches. That would be a new club record, after their 2-0 win at Eibar last weekend saw them match the previous mark of 31 games set under Pep Guardiola in 2010/11. Seven points behind Barcelona in second, Atletico Madrid face a tough trip to Sevilla, who were unfortunate not to beat Manchester United in the Champions League in midweek. Saturday's Catalan derby at the Camp Nou will see two Uruguayan strikers in prolific form go up against one another. Barca's Luis Suarez has scored 17 La Liga goals this season, with 14 in his last 13 games. Meanwhile, his compatriot Stuani -- his first name is indeed written that way -- is in the form of his life at Girona since returning to Spain from Middlesbrough. The 31-year-old ex-Espanyol player has 13 in 20 La Liga appearances this season, including one in last week's win over Leganes. He has formed a fine partnership in the newly-promoted side's attack with nine-goal Portu. Stuani and Suarez have been joined by another Uruguayan, Celta Vigo's 12-goal Maxi Gomez, near the top of the scorers' charts. ""Seeing so many Uruguayans up there is very important for us, a source of pride,"" Stuani said this week. Fixtures (all kick-offs GMT)"
25,10/02/2018,15:04,Villarreal miss chance to put pressure on Real Madrid,"Villarreal squandered an opportunity to climb above Real Madrid in La Liga, for a few hours at least, as they lost 2-1 at home to Alaves on Saturday.","The visitors were seeking to continue their improvement since former Barcelona and Spain defender Abelardo was appointed coach in December. They went in front six minutes before half-time when Alfonso Pedraza returned the ball into the box and Rodrigo Ely nodded home. Pedraza, who is on loan from Villarreal, missed a glorious chance to double the away side's lead early in the second half. However, John Guidetti set up substitute Ibai Gomez to make it 2-0 in the 71st minute. Carlos Bacca pulled one back for the hosts at the Estadio de la Ceramica with the aid of a huge deflection, but Villarreal could not find an equaliser, with Enes Unal hitting the bar late on. Villarreal's second straight defeat leaves them fifth in the table, two points behind Real Madrid in fourth, having played two games more. Zinedine Zidane's side entertain Real Sociedad later on Saturday. Villarreal face Lyon in the Europa League next week."
26,28/01/2018,23:47,Messi strikes late to down tough Alaves,Barcelona escaped a scare on Philippe Coutinho's first start as Lionel Messi struck with a trademark free-kick to drag the La Liga leaders back from a goal down to beat Alaves 2-1 and restore their 11-point lead at the top.,"Messi whipped home a beautiful free-kick six minutes from the end to down resilient Alaves, who are just two points from the drop zone in 17th despite John Guidetti silencing the Camp Nou with a shock breakaway opener in the 23rd minute. Luis Suarez had broken the away side's tough resistence with a sweet volley from Andres Iniesta's cross 18 minutes from the end, setting the stage for Messi's dramatic and stylish winner. The Argentine's strike ensures that Barca stay unbeaten in the league, and keeps Atletico Madrid 11 points back despite their 3-0 hammering of Las Palmas earlier. Barca coach Ernesto Valverdes said he was happy with Coutinho who had started Thursday's Copa del Rey clash with Valencia on the bench before making a second-half appearance. ""Players are not machines who can fit in at once, like a new part,"" said Valverde. ""He did well, he wanted the ball. This is one more step for him. The other day, he played 25 minutes, this time a little more, he will integrate little by little."" With Diego Costa out injured, Atletico took a while to get going and had to wait until the 61st minute to open the scoring, Antoine Griezmann latching on to Juanfran's fine ball down the right flank before dinking neatly over Las Palmas stopper Leandro Chichizola. ""The first half was not very good but the coach gave us a good talking to at half-time, and we responded well,"" said Griezmann, whose goal was just his seventh in the league this season but his fourth in league and cup since the turn of the year. ""I feel good, I've started the year well and I hope to continue the goals and assists."" Frenchman Griezmann started the move that led to Atletico's second, intercepting a loose pass and setting Angel Correa free to scamper down the pitch and feed Fernando Torres, who shifted the ball onto his right foot and lashed home just his second goal of the season, the 600th scored by Atletico in all competitions during Diego Simeone's seven-year reign as coach. An easy tap-in from Thomas Partey after great work from Yannick Carrasco two minutes from time completed the second-half rout of a desperate Las Palmas, who remain second from bottom and five points from safety. Sevilla were denied the chance to close within three points of Real Madrid and the Champions league places after Angel Rodriguez scored a controversial equaliser deep in stoppage time to snatch a 1-1 draw for Getafe at the Roman Sanchez Pizjaun stadium. Luis Muriel had slid in a 72nd-minute opener for hosts but with seconds to spare Juan Cala challenged Sevilla keeper Sergio Rico for a hopeful high ball, and with the Sevilla fans and players clamouring for a free-kick, Angel lashed home the leveller and celebrated under a hail of whistles and boos."
