,date,hour,title,subtitle,text
11,21/12/2019,18:20,Messi shines in sparkling Barcelona Christmas stroll,Barcelona go into the brief Spanish winter break on top of La Liga after a glittering show from Lionel Messi helped the defending champions beat Alaves 4-1 on Saturday.,"Real Madrid, who drew 0-0 in Barcelona in the midweek Clasico, can draw level top on 39 points but behind on goal difference if they win at home to Atletico Bilbao on Sunday. Seville are assured third place over Christmas on 34 points after their 2-0 win in Mallorca. French star Antoine Griezzman put Barca ahead with a lovely snap-shot from outside the area after a slick exchange with Messi on 14 minutes. ""I needed to score a goal before the holidays, now I can go into them happy with myself,"" said the French World Cup winner who has scored just seven goals since his summer move. ""We have a great team with some of the best players around and when we don't click, well, there's always Messi."" Messi had already had a better strike ruled out by a harsh VAR decision, while Mohican-haired Chilean forward Arturo Vidal had tried a dramatic overhead effort that the Alaves 'keeper just about stopped with his feet. Vidal bagged a second just before half-time when put into open space on the right as Barcelona overwhelmed the visitors, but they should have gone into the break more than 2-0 ahead. Pere Pons pulled one back on 56 minute for Alaves with neither Gerard Pique nor the returning Samuel Umtiti on hand as his header flew home from close range. Even with four defenders around him, Messi was unstopabble on 69 minutes as he unleashed a trademark left foot strike from outside the box. The goal illustrated why the diminutive attacker recently won a sixth Ballon d'Or. A sweetly-struck Luis Suarez penalty made it 4-1 on 75 minutes."
12,30/11/2019,15:24,Madrid go top with gutsy win at Alaves,Sergio Ramos scored a goal and conceded a penalty as Real Madrid battled past Alaves on Saturday to go top of La Liga before Sunday's game between Barcelona and Atletico Madrid.,"Barca and Atletico face off at the Wanda Metropolitano and Madrid did all they could to take advantage, with Dani Carvajal the unlikely matchwinner in a gritty 2-1 victory over Alaves. ""We know at these grounds that teams give everything against Madrid,"" said Marcelo. ""It's in these matches that leagues are won."" ""We fought until the end,"" added Madrid coach Zinedine Zidane. Ramos had headed them in front shortly after half-time only to concede a needless penalty for throwing his arm across Joselu, which Lucas Perez converted before Carvajal poked in. Madrid pull three points clear of Barcelona and six ahead of Atletico, who have played a game more than the top two. Sevilla, in third, host Leganes on Sunday. Alaves stay 13th. A 1-0 defeat at Mendizorrotza 13 months ago came three weeks before Julen Lopetegui was sacked as coach but this time Madrid showed the kind of steel that was so painfully lacking last season. On a wet and windy afternoon in the Basque country, Zidane's side never showed the verve and creativity that was so impressive in the draw against Paris Saint-Germain on Wednesday. But this was a gutsy performance that means they have now won six and drawn two of their last eight matches in all competitions, with the Clasico against Barcelona next month fast approaching. ""A few weeks ago people were saying a lot about this team,"" said Zidane. ""But we have to stay the same, stay calm and keep working because this is just the start."" Gareth Bale made his first Madrid start since October 5 after recovering from a calf injury and his first too since his controversial celebration with Wales earlier this month, which sparked anger among his club's supporters. Bale hit the post in the first half but faded and was replaced by Rodrygo after Alaves' equaliser. With Eden Hazard out injured, Isco also kept his place while Alphonse Areola was given a rare outing in goal ahead of the rested Thibaut Courtois. Madrid were lucky not to concede another penalty early on as Aleix Vidal slalomed inside Ramos and then Eder Militao, whose dangling leg caught Vidal's foot. Referee Guillermo Cuadra felt the fall was exaggerated. At the other end, Bale hit the post with a header and Karim Benzema latched onto a quick throw but instead of shooting, hooked the ball back for Isco whose effort was saved. Alaves grew in confidence as the rain grew heavier yet Madrid regrouped at half-time and took the lead soon after as Ramos was given a free header to glance in Toni Kroos' crossed free-kick. But after scoring his sixth goal of the season, Ramos gifted Alaves an equaliser in the 66th minute by outmuscling Joselu in the penalty area, only to throw an arm across the forward's chest. Perez made no mistake. Bale went off for Rodrygo and Alaves might have been able to build on their momentum if they had consolidated. Instead, parity lasted three minutes as Isco met Luka Modric's cross at the back post and while Pacheco did brilliantly to save, Carvajal reacted faster than Victor Laguardia to the rebound. Perez almost drove in a late equaliser but Marcelo made a diving block and Ximo Navarro's header had to be clawed away by Areola as Madrid held on."
13,15/09/2019,18:30,Jordan free-kick fires Sevilla to top of La Liga,Sevilla moved to the top of the early La Liga table on Sunday as Joan Jordan's brilliant free-kick helped them seal a 1-0 win at Alaves.,"Julen Lopetegui's side continued their excellent start to the campaign, remaining unbeaten and moving a point clear of Atletico Madrid, who lost 2-0 at Real Sociedad on Saturday, at the summit. Sevilla host Real Madrid next Sunday in a meeting of two sides yet to taste defeat. ""That means nothing (being top),"" said Sevilla coach Lopetegui, whose team next face a marathon trip to Baku to play Qarabag in their Europa League opener on Thursday. ""The only thing that (being top) tells me is that the team is doing things well. We have to keep improving before going to Baku, where they will make it very difficult for us."" It was a first defeat of the season for Alaves, who slipped to 11th in the standings. Lopetegui, who joined Sevilla for his first job since being sacked in quick succession by both Spain and Real Madrid, saw one of his close-season signings produce the game's defining moment. Midfielder Jordan, who arrived at Sevilla from Eibar for a reported 14 million euros ($15.62 million), curled home a wonderful free-kick in the 37th minute which flew into the top corner to give him his second goal of the season. The visitors comfortably saw out the match to claim their third league win this term, as Alaves failed to muster a shot on target. Elsewhere on Sunday, Robert Ibanez's 81st-minute equaliser kept Osasuna unbeaten after a 1-1 draw at Valladolid, while Granada moved up to seventh with a 2-0 success at nine-man Celta Vigo and Espanyol won at Eibar. Real claimed a 3-2 win over Levante at the Santiago Bernabeu on Saturday, when reigning champions Barcelona eased to a 5-2 victory against Valencia, with 16-year-old Ansu Fati scoring inside two minutes."
14,24/04/2019,00:18,Messi rested as win over Alaves edges Barca closer to the title,Barcelona will win La Liga on Wednesday if Atletico Madrid lose to Valencia after a 2-0 victory over Alaves gave them a 12-point lead at the top of the table.,"Lionel Messi started on the bench at Mendizorrotza on Tuesday in a move that made clear just how comfortable Barca are in this title race, its conclusion surely now only a matter of when rather than if. Should Atletico avoid defeat to Valencia at the Wanda Metropolitano, the Catalans will still be crowned champions on Saturday at the Camp Nou with a victory over Levante. They could even have it wrapped up before kick-off on Saturday if Atletico fail to take at least four points from Valencia and Real Valladolid, the latter whom they face a few hours earlier on Saturday. ""It's an incredibly valuable win,"" coach Ernesto Valverde said. ""In the end however much as people say the league is won, it has to be achieved on the field. ""We are at the gates now, needing three points more with four games ahead. It is an immense joy to be in this position after so many months of work."" Real Madrid, who play their game in hand against Getafe on Thursday, sit 16 points adrift in third. Alaves stay eighth, their hopes of a Europa League spot fading fast. Messi came on as a substitute in the 61st minute shortly after his team had scored twice, Carles Alena guiding one into the corner before Luis Suarez, in Messi's absence, took and dispatched a penalty. Valverde leaving out his captain and star player, presumably with an eye on next week's Champions League semi-final against Liverpool, was a luxury Barcelona have earned and can afford. Liverpool, still jostling with Manchester City in the Premier League, are unlikely to feel the same sort of confidence when they face Huddersfield on Friday. ""The idea at half-time was to play Leo because the result was not clear,"" Valverde said. ""But regarding the Golden Boot and that sort of thing, we are only focused on what we have to do to win. ""Leo has a lot of individual challenges ahead but today it was time to rest."" Other players were preserved too. Jordi Alba, Clement Lenglet and Arthur Melo all began on the bench, allowing Samuel Umtiti more minutes as he recovers from a knee injury, while the struggling Philippe Coutinho started in a front three with Ousmane Dembele and Suarez. Alena, the 21-year-old Spaniard, scored his second La Liga goal and showed again why many believe he could be a key figure for Barcelona in the years to come. Suarez's goal, meanwhile, was his 21st in the league and marks the fourth consecutive season in which he has passed the 20 mark for Barca. He might have scored earlier but shot straight at Fernando Pacheco when sent clear in the opening stages, while Coutinho followed up but his rebound was blocked. Sergi Roberto fired over from inside the area but it was his run down the right that created Alena's opener in the 54th minute. After a neat exchange with Arturo Vidal, Sergi played inside, through the legs of Suarez and to the feet of Alena. He controlled and placed the ball coolly into the corner. Six minutes later, and one before the introduction of Messi, Suarez doubled the lead from the spot. Umtiti bundled in on the line and as VAR checked him for offside, Alaves' Tomas Pina was shown to have handballed moments before. Suarez made no mistake. Messi hit the woodwork, his shot well saved by Pacheco, and Coutinho drove wide late on. Two was enough for the win and, possibly, the title."
15,04/04/2019,22:06,Sevilla back into European contention,Goals from Roque Mesa and Pablo Sarabia lifted Sevilla back into European contention on Thursday with a crucial 2-0 win over Alaves.,"The Basque side moved up from seventh to sixth, displacing Alaves to go level on points with fifth-placed Valencia who downed Real Madrid 24 hours earlier. Mesa put Sevilla into a 41st minute lead with a perfectly weighted rising shot from the right that dipped over keeper Fernando Pacheco and into the far corner of the net. With Alaves struggling to make an impact the home side doubled their advantage when Sarabia's skimming shot flashed past the hapless Pacheco and into an empty net with 10 minutes remaining. For Sevilla this was a vital three points after Valencia had inflicted Zinedine Zidane's first defeat since returning as Real boss on Wednesday. Valencia's 2-1 home success moved them to within a point of La Liga's top four, on 46 points, only ahead now of Sevilla on goal difference."
16,06/10/2018,22:18,Lopetegui dismisses uncertain future after Madrid hit 33-year drought,Julen Lopetegui insisted it is too early to be questioning his future despite Real Madrid suffering a shock defeat by Alaves on Saturday to make it four games without a victory.,"It is four games without a goal too for the European champions, their longest scoring drought since 1985, as Manu Garcia headed home in the 95th minute to send the Mendizorrotza Stadium wild. It is the first time they have beaten Madrid at home in 87 years. Alaves fans ran onto the pitch to celebrate their stunning 1-0 win and the chants continued long after the final whistle. For Real, this was another body blow and to make matters worse, Gareth Bale and Karim Benzema, their chief attacking threats, were both forced off injured. Bale had missed the Champions League loss to CSKA Moscow on Tuesday with a groin strain. It means Barcelona can go three points clear if they win their game in hand against Valencia on Sunday while Alaves' excellent start to the season continues. They move up to third, level on points with Real. Lopetegui had been asked on Friday if he felt under pressure at the club he left Spain for on the eve of the World Cup and the question was put to him again after the match here. ""It interests you but is not a question that concerns me,"" Lopetegui said. ""We know what the life of a coach is, especially at Real Madrid, but we also know it is October and you have to keep perspective and stay calm."" Captain Sergio Ramos was more emphatic. ""It's other people who make those decisions but it's never good to have a change of coach,"" he said. ""It would be crazy."" Talk of change feels premature but it will increase if Madrid fail to find fluency soon and, in particular, if Barca pull away. The Clasico at the Camp Nou looms at the end of the month. ""We are disappointed,"" Lopetegui added. ""In the end, defeat is a harsh punishment."" Thibaut Courtois took over from Keylor Navas in goal and was at fault for Alaves' winner. The Belgian edged out but failed to claim a cross, leaving Garcia to head into any empty net. Supporters behind that goal had unfurled three banners during the match that read: 'A club is not made great by its titles but by its people'. Some of the 19,000 fans here might have seen their team beat Madrid at the Santiago Bernabeu in 2000, but not at home. It was 1931 when that last happened. There was a UEFA Cup final too in 2001, which they lost to Gerard Houllier's Liverpool, but recent years have been tough, with three seasons spent in the third tier. Alaves climbed their way back up and reached the final of the Copa del Rey in 2017. But for drama, this will be hard to beat. ""I feel very proud,"" Garcia said. ""It is the most beautiful day of my sporting life."" Bale had been passed fit to start while Luka Modric and Ramos returned after being rested against CSKA. Ramos clattered Jonathan Calleri early on and then elbowed the Alaves striker in the face. The referee deemed it accidental but Calleri responded with a clip on the defender's leg. Bale span in behind and backheeled to Benzema, who teed up Dani Ceballos to shoot. Benzema had a header volleyed off the line by Victor Laguardia. But Alaves grew into the half and it took Raphael Varane's diving header to prevent Ibai Gomez from tapping in at the back post. Benzema was replaced at half-time by Mariano Diaz, who instantly looked more dangerous. The rain came down and the whistles grew louder as Madrid dominated the ball but their opponents could have won it sooner when Jony sprinted clear, only to drag his finish wide. Bale trudged off and another Alaves chance arrived in injury time. Courtois came for the cross but failed to gather and Ruben Sobrino sent the ball to the back post. Garcia was perfectly placed."
17,06/10/2018,20:47,Real Madrid slip to shock Alaves defeat,Real Madrid sank to a shock 1-0 defeat by Alaves on Saturday after a 95th-minute winner from Manu Garcia consigned the European champions to a fourth game without victory.,"It is four games without a goal too for Julen Lopetegui's side, their longest scoring drought since 1985, as Garcia headed home to send the Mendizorrotza Stadium wild. Alaves fans ran onto the pitch to celebrate their famous win and the chants continued long after the final whistle blew. For Madrid this was another body blow and to make matters worse, Gareth Bale, their chief forward threat, had hobbled off injured late on. He missed the Champions League loss to CSKA Moscow on Tuesday with a groin strain. Karim Benzema, out of form and bereft of confidence, was off too after being substituted at half-time but it was Thibaut Courtois at fault for the goal. He came for the cross but failed to claim. It means Barcelona can go three points clear if they win their game in hand against Valencia on Sunday while Alaves' excellent start to the season continues. They move up to third, level on points with Real. Lopetegui had been asked on Friday if he felt under pressure at the club he left Spain for on the eve of the World Cup. Talk of change is perhaps premature but it will certainly increase if Madrid cannot find fluency soon and, in particular, if Barca pull away. The Clasico at the Camp Nou looms at the end of the month. Bale had been passed fit to start while Luka Modric and Sergio Ramos returned after being rested against CSKA. Courtois took over from Keylor Navas in goal. The first half was a fight, full of heavy touches, tussles and collisions but largely vacant of clear-cut chances. Ramos was at the heart of the battle as he clattered Jonathan Calleri and then elbowed the Alaves striker in the face. The referee deemed it accidental but Calleri clearly did not and responded soon after with a late clip on the defender's leg. Bale span in behind, backheeled to Benzema who teed up Dani Ceballos to shoot, before Benzema had a header volleyed off the line by Victor Laguardia. But Alaves grew into the half and it took Raphael Varane's diving header to prevent Ibai Gomez from tapping in at the back post. Benzema was hauled off at half-time and Mariano Diaz instantly looked more dangerous. Only a dangling Laguardia leg ended his weaving run in the penalty area while Real right-back Alvaro Odriozola was slipped in behind but failed to find a team-mate with the pull-back. Lopetegui threw his arms up in frustration. The rain came down, the whistles grew louder as Madrid dominated possession but Alaves could have won it sooner when Jony sprinted clear, only to drag his finish wide. Bale went off and another Alaves chance came in injury time. Courtois came for a cross but failed to gather, allowing Garcia to head in a dramatic winner."
18,20/08/2018,14:06,African players in Europe: Iwobi goal in vain as Arsenal flop again,"Nigeria and Arsenal winger Alex Iwobi opened his 2018/2019 English Premier League goal account at the weekend, but could not prevent a 3-2 loss at London rivals Chelsea.","The Gunners might have avoided a second straight league defeat had 2015 African Footballer of the Year Pierre-Emerick Aubameyang from Gabon not fluffed several scoring chances. Algerian Riyad Mahrez, who succeeded Aubameyang as African Footballer of the Year, made an impressive but goalless home debut for Manchester City in a 6-1 rout of Huddersfield. ALEX IWOBI (Arsenal) Iwobi scored with a clinical close-range finish, but missed a chance to put the Gunners ahead and Chelsea took full advantage. Marcos Alonso's late winner left Arsenal to rue a second successive defeat under new boss Unai Emery. PIERRE-EMERICK AUBAMEYANG (Arsenal) The striker endured a dismal afternoon at Stamford Bridge as his misses contributed to Arsenal's defeat. Aubameyang should have equalised after Chelsea's opening goal, but fluffed his lines with a woeful close-range miss. After Arsenal had battled back to 2-2 from two goals down, Aubameyang misfired again from close-range. RIYAD MAHREZ (Manchester City) The Algeria winger made his home debut for the Premier League champions in their demolition of Huddersfield. Mahrez arrived from Leicester in a £60 million (67 million euros, $76.5 million) move in the close season and made his first appearance in the Community Shield win over Chelsea at Wembley. Mahrez finally got to play in front of the City faithful at Eastlands when he came off the bench as a 64th-minute substitute against Huddersfield. Although he did not get on the scoresheet, he impressed for dominant City. MUBARAK WAKASO/PATRICK TWUMASI (Alaves) Ghana internationals Wakaso and Twumasi were both in the squad for Alaves' tricky trip to Barcelona for the La Liga season opener. Wakaso was part of a four-man midfield as the visitors attempted to snuff out Barcelona's attacking threat and it worked for over an hour until Lionel Messi inspired a 3-0 win. Wakaso had one shot blocked while winger Twumasi, signed from Astana, had to watch from the bench as an unused substitute. SEKO FOFANA (Udinese) Ivorian midfielder Fofana got his first goal of the season, scoring the equaliser as Udinese completed a comeback from two goals down to draw 2-2 at promoted Parma. Fofana, 23, scored four minutes after teammate Rodrigo De Paul had pulled the northeastern side, who narrowly avoided relegation last season, back into the game. It was his ninth league goal in his third season with the club. KWADWO ASAMOAH (Inter Milan) Ghana midfielder Asamoah began life as an Inter Milan player with a 1-0 defeat to Sassuolo after six years at Turin giants Juventus. The 29-year-old had appeals for a spot-kick waved away after being brought down by Francesco Magnanelli. KEVIN-PRINCE BOATENG (Sassuolo) Boateng played an important role in his new centre-forward role after moving to Sassuolo from Germany during the close season. ""Proud of my team and so happy to be back,"" tweeted the 31-year-old former AC Milan player after the win over Inter Milan. Boateng thought he had made it 2-0 for the side from Modena after 65 minutes but his effort bounced off the post. DENIS BOUANGA (Nimes) The Le Mans-born Gabon winger scored his first goal for Nimes since arriving from Lorient last month and the first for his new employers in the top flight at home since 1993 in the 3-1 defeat of Marseille. He also had a decisive role in the counter-attack that led to the second goal."
19,19/08/2018,14:21,Messi 'sees things others don't' says Barcelona coach,Barcelona coach Ernesto Valverde has heaped praise on Lionel Messi's start to the Liga season after the Argentine bounced back from a disappointing World Cup with two goals against Alaves.,"Messi sent an audacious second-half free-kick under the jumping wall and into the net for the opener, and Barca's 6,000th La Liga goal, at the Camp Nou on Saturday before slotting in his second in injury-time after Philippe Coutinho had also scored in the 3-0 win. ""With Messi, you can expect absolutely anything,"" Valverde said. ""He sees things that others don't see on the pitch. ""Sometimes we get too used to seeing it, he does things like he did today and we want him to pull a rabbit of the hat every time. ""He's a genius and we're lucky to be able to see him play every day."" Messi has been left out of Argentina's squad for the first post-World Cup friendlies following reports that the five-time Ballon d'Or winner asked to be excused from the four games. He was unable to prevent a shambolic Argentina side from being knocked out of the World Cup in the last 16 stage in a 4-3 defeat to eventual winners France."
