,date,hour,title,subtitle,text
20,17/05/2020,21:13,"German league without fans like ""old man's football"", says Mueller","Thomas Mueller joked that the Bundesliga without fans feels like ""old man's football, 7pm, under floodlights"" after Bayern Munich brushed aside Union Berlin 2-0 behind closed doors on Sunday.","A first-half Robert Lewandowski penalty and a late Benjamin Pavard header sealed Bayern's win in front of empty terraces in Berlin. The result leaves defending champions Bayern four points clear as the German league restarted this weekend after a two-month hiatus due to the COVID-19 virus. However, Mueller admitted it was strange to play Union behind closed doors at their compact Alten Foersterei stadium, which is usually packed with 22,000 passionate home fans. ""It felt a bit like the atmosphere you get for old man's football, 7pm, under floodlights, but as soon as the ball started to roll, the game took our focus,"" said Mueller. The Bundesliga became the first top European league to resume this weekend, using draconian hygiene guidelines, regular testing of players and insisting on games in near-empty stadiums. Hugging, embracing and handshakes were also banned. ""There were a few butterflies before the restart, wondering how it would go, like before the first game of the season in August,"" said Mueller. ""I wasn't worried about anything going wrong, everything was explained clearly to us. ""Union Berlin, just like us, were well prepared, no handshakes before kick-off etc."" Mueller said the defending champions were just happy to win their first game after the restart to keep them on course for an eighth consecutive league title. ""We came here with the goal of getting the three points,"" added Mueller. ""We had a bit more security after the second goal."""
21,17/05/2020,21:13,"German league without fans like ""old man's football"", says Mueller","Thomas Mueller joked that the Bundesliga without fans feels like ""old man's football, 7pm, under floodlights"" after Bayern Munich brushed aside Union Berlin 2-0 behind closed doors on Sunday.","A first-half Robert Lewandowski penalty and a late Benjamin Pavard header sealed Bayern's win in front of empty terraces in Berlin. The result leaves defending champions Bayern four points clear as the German league restarted this weekend after a two-month hiatus due to the COVID-19 virus. However, Mueller admitted it was strange to play Union behind closed doors at their compact Alten Foersterei stadium, which is usually packed with 22,000 passionate home fans. ""It felt a bit like the atmosphere you get for old man's football, 7pm, under floodlights, but as soon as the ball started to roll, the game took our focus,"" said Mueller. The Bundesliga became the first top European league to resume this weekend, using draconian hygiene guidelines, regular testing of players and insisting on games in near-empty stadiums. Hugging, embracing and handshakes were also banned. ""There were a few butterflies before the restart, wondering how it would go, like before the first game of the season in August,"" said Mueller. ""I wasn't worried about anything going wrong, everything was explained clearly to us. ""Union Berlin, just like us, were well prepared, no handshakes before kick-off etc."" Mueller said the defending champions were just happy to win their first game after the restart to keep them on course for an eighth consecutive league title. ""We came here with the goal of getting the three points,"" added Mueller. ""We had a bit more security after the second goal."""
22,17/05/2020,21:04,Five things from the Bundesliga comeback,Bayern Munich maintained their four-point lead at the top of the Bundesliga as Germany gave fans across the world their first taste of elite football for two months amid empty stands and stringent hygiene guidelines designed to curtail the spread of the coronavirus.,"AFP looks at the five things we learned from one of oddest weekends in the game's history. The Bundesliga has a head start of at least a month on the other major leagues aiming to restart this summer, and some of strange scenes seen in Germany will become the new normal should football return to England, Italy and Spain. La Liga and Serie A are aiming for mid-June as a potential start date for their suspended seasons, and fans in both countries may have to get used to silent, empty stadiums, socially-distanced goal celebrations, footballers in face masks and the spectre of players catching COVID-19. Italy's clubs for example are debating a medical protocol that currently rules that if a player tests positive for the virus he and anyone who has come into close contact with him must be quarantined for two weeks, in contrast to Germany where only the player is isolated. How Bundesliga teams fare under their hygiene regulations could provide the model for the coming months. Heading into his team's tough trip to giant-killers Union Berlin, Bayern Munich coach Hansi Flick wondered whether his team would be able to last a full 90 minutes after only being given the go-ahead to resume full team training last week. However a dominant display in the German capital, against a team that had already beaten two different league leaders at home this season, showed why they are the strongly-tipped to win their eighth straight league title. Bayern had two thirds of possession at the Alten Foesterei stadium, and once Robert Lewandowski slotted home his 26th league goal of the season from the penalty spot five minutes before the break, the result was never in doubt as the champions went on to claim a 2-0 win. In the aftermath of Dortmund's 4-0 thumping of Ruhr rivals Schalke, teen striking sensation Erling Braut Haaland was a young man of few words with the awaiting media desperate for something from the 19-year-old goal machine. However, according to AFP subsidiary SID, Haaland mumbled a total of eight English words to reporters, including ""Why not?"" and ""Yes"". It didn't really matter, as Haaland had done his talking on the pitch, picking up where he left off before the world went into virus lockdown. The Norwegian, who turns 20 this summer, swept home the opener, the league's first goal of its restart, before laying on the first of Raphael Guerreiro's brace, showing once again that he is Europe's player to watch. He has 41 goals this season in all competitions and 13 for Dortmund in just 12 games since joining in January from Red Bull Salzburg. Specialist website DWDL.de reported on Sunday that over six million people in Germany watched the first top-tier matches in two months, with 3.68 million tuning into broadcaster Sky Germany's subscription channels on Saturday. A further 2.45 million tuned into the 'Konferenz' -- a simultaneous live broadcast of the five afternoon games -- on free-to-air Sports News Channel. Sky Germany had a market share of 27.4 percent on their pay-to-view channels and 18.2 percent on their free channel. The German Football League (DFL) told AFP that matches were televised by more than 70 broadcasters worldwide, all on previously-agreed deals. British newspaper the Daily Mail reports that UK viewers were left frustrated as the BT Sport application showing the matches buckled under the weight of demand from fans. Germany has one of the world's most vibrant football fan cultures, with raucous fans packing stadiums where entrance fees are priced at a fraction of what Premier League fans have to shell out. And while millions tuned in to watch some live football, a significant portion of match-going supporters are livid at the idea of games going ahead without the noisy backdrop provided by German fans. On Saturday Augsburg fans left a banner inside their team's ground which read ""Football gives life -- your business is sick"". St Pauli, meanwhile, on Sunday published a picture on Twitter of a banner that read: ""Football lives through its fans! Without you, it's all nothing!"""
23,17/05/2020,20:34,Leaders Bayern brush Union aside on Bundesliga return,Robert Lewandowski bagged his 26th league goal this season as leaders Bayern Munich restarted the Bundesliga season with a 2-0 win at Union Berlin behind closed doors on Sunday.,"Lewandowski netted a first-half penalty and defender Benjamin Pavard scored a late header for Bayern in Berlin after the Bundesliga became the first top European league on Saturday to resume during the COVID-19 pandemic. Poland star Lewandowski, who missed two games with injury before the league was interrupted in mid-March, reached 40 goals for the campaign in all competitions as Bayern restored their four-point lead over Borussia Dortmund. Dortmund, who thrashed Schalke 4-0 in the Ruhr derby on Saturday, host Bayern in a pivotal fixture in 10 days' time, another game that will be behind closed doors due to the league's strict hygiene guidelines. Union had shocked previous leaders Dortmund and Borussia Moenchengladbach earlier in the season, backed by passionate home support at their Alten Foersterei stadium. However, with the players' voices echoing around the Union stadium, Bayern dominated their mid-table opponents. Thomas Mueller looked to have given Bayern an early lead on 18 minutes when Serge Gnabry presented him with a simple tap-in. However, the goal was disallowed when the video assistant referee (VAR) spotted Mueller was offside. With Bayern enjoying around 70 percent possession, it was just a matter of time before they took the lead. Sure enough when Union defender Neven Subotic fouled Leon Goretzka in the area on 38 minutes, Lewandowski stepped up to slot home the resulting penalty. After the break, dogged defending by the hosts repeatedly frustrated Bayern. To help grab a second goal to seal the result, Bayern coach Hansi Flick brought on French winger Kingsley Coman for his 100th Bundesliga appearance. It was his countryman Pavard who made the points safe on 80 minutes when he headed a Joshua Kimmich corner inside the far post. Union's best chance came in the dying stages when Felix Kroos, brother of Germany star Toni, fired straight at Bayern goalkeeper Manuel Neuer. Earlier, Cologne striker Mark Uth said that the absence of fans was no excuse for throwing away a two-goal lead in a 2-2 draw with struggling Mainz. ""If you're up 2-0, you have to finish things off -- with or without spectators,"" fumed goalscorer Uth. The hosts took an early lead when Uth, on loan from Schalke, converted a penalty with just six minutes gone after the striker was brought down in the area. With hugs and handshakes banned, and fans excluded from the ground due to the pandemic, the players celebrated with elbow bumps instead. Cologne added a second goal when Florian Kainz headed home a cross with just over half an hour left. However, Mainz came roaring back with an hour played as the visitors knuckled down. Replacement striker Taiwo Awoniyi, who had only been on for five minutes, tapped home from close range for his first Bundesliga goal. Cameroon midfielder Pierre Kunde floored Cologne and earned a point for Mainz when he beat two defenders and poked the ball past goalkeeper Timo Horn to equalise on 72 minutes. ""It was like street football, a huge game for us,"" said Mainz sports director Rouven Schroeder. ""For the first game after so many weeks, it was really good. The guys didn't want to be left behind."" The result leaves Mainz on the verge of the relegation places but four points above the bottom three while Cologne are 10th."
24,17/05/2020,16:26,Bayern aim to shake off cobwebs with quiet confidence in Berlin,Bayern Munich restart their charge for an eighth straight Bundesliga title at Union Berlin on Sunday amid doubts the Bavarian giants will be able to last the distance after a two-month hiatus.,"Hansi Flick's side hold a slender one-point lead at the top of the league heading into their trip to the German capital, which has been the scene of some impressive upsets thanks to promoted Union's form at their Alten Foersterei stadium. Union have twice shocked the league leaders this season, beating Borussia Dortmund 3-1 in August and turning out 2-0 victors over Borussia Moenchengladbach three months later. Now it's Bayern's turn. Bayern flew up to Berlin by private jet from a military airport in Ingolstadt, near Munich, with the two team buses allowed to drive directly onto the tarmac. The players and Flick's backroom staff tested negative for the coronavirus -- for the fifth time -- and the squad all wore face masks for the brief flight. Flick is unsure of his team's ability to play out a full match after having only received the go-ahead to resume team training last week. ""We don't know if the team can hold out over 90 minutes,"" said Flick. ""We have to just deal with the situation."" The Bundesliga is the first major league in Europe to return to action since the coronavirus brought football to a halt two months. The restart was only possible thanks to a host of strict health regulations, such as near-empty stands in what are usually passion-filled stadiums and regular testing for the virus. That means Union won't be able to count on their ferocious home support at their ground in east Berlin on the outskirts of the German capital. They will also be without their coach Urs Fischer after breaking the team quarantine following the death of his father-in-law. ""It's not possible to surprise Bayern with the experience their players have,"" said Union assistant coach Markus Hoffmann, who is in charge against Bayern. ""They've already experienced everything. ""We have to concentrate on ourselves and try to implement what we can to influence the game in the best possible way."" Bayern's lead was cut to a single point by Borussia Dortmund, who on Saturday showed no ring rustiness in a 4-0 demolition of Ruhr rivals Schalke. Norwegian sensation Erling Braut Haaland, 19, scored the first Bundesliga goal after the restart and set up Raphael Guerreiro for the first of his brace. As well as the echoing arenas, a host of other rules have been put in place to try to stop the spread of the virus, from frequent testing to masks for players on the subs bench and a week-long quarantine for teams ahead of the restart. However, advice to socially distance didn't stop Hertha Berlin players from celebrating their goals in a 3-0 win at Hoffenheim by hugging each other. ""The fact is that this is part of football,"" said Hertha coach Bruno Labbadia. ""We've been tested so many times that we can allow it. ""If you can't celebrate anymore, the whole thing breaks down."" A German Football League (DFL) spokesman confirmed there will be no punishment, as it had only offered ""guidelines"" on how goals should be celebrated. However senior politician Markus Soeder, the state minister for Bavaria, said Sunday that he expects Bundesliga bosses to ""tighten up"" the hygiene guidelines after Hertha's hugs in Hoffenheim. The DFL has also made no secret of the fact that several clubs are in a dire financial situation as a result of the lockdown. If they are able to complete the nine remaining rounds of matches by June 30, clubs could receive around 300 million euros ($324 million) from television contracts. Clubs in England, Spain and Italy, where leagues are weeks away from returning, will be watching to see how the rest of weekend goes. td-ryj/td <org>BORUSSIA DORTMUND</org>"
25,17/05/2020,15:10,Germany kicks off as Europe eases curbs but virus marches on,"German football champions Bayern Munich were set to play their first match in more than two months on Sunday as coronavirus restrictions ease in parts of Europe, but the devastating pandemic remains on the march elsewhere with deaths soaring in Brazil.","With the worldwide death toll topping 311,000 and the global economy reeling from the vast damage caused by lockdowns, the reopenings in some of the hardest-hit countries such as Italy provided much-needed relief. But the number of COVID-19 fatalities soared past 15,000 in Brazil with 230,000 infections, making it the country with the fourth-highest number of cases, a grim reminder of the scale of the crisis. And in the United States -- the worst-hit country -- former President Barack Obama launched a scathing attack on the way the crisis has been handled, saying a lot of American leaders ""aren't even pretending to be in charge"". In Germany, where authorities have started a gradual easing of restrictions, reigning Bundesliga champions Bayern Munich were set to play Union Berlin in the capital Sunday night, a day after the league resumed play in empty, echoing stadiums. Already attracting a record TV audience, the Bundesliga restart is under intense scrutiny as a test case, with top sports competitions trying to find ways to resume play without increasing the risk of spreading the virus, which has infected 4.6 million people globally. The first big-purse golf tournament in months also wrapped up Sunday, with the normally overlooked Korean LPGA Championship winning new interest to women's golf. ""The moment I had always dreamt of finally has come true,"" said the tearful 20-year-old winner Park Hyun-kyung, who was congratulated by her mask-wearing peers with elbow-bumps. One question that has arisen during the pandemic is whether masks are an effective weapon against the virus, with little research on the subject leading several countries to backflip on their official advice. A team of leading experts in Hong Kong said Sunday that research conducted on hamsters found that non-contact transmission of the virus could be reduced by more than 60 percent when masks are used. There have been positive signs in a slowly reopening Europe, with Spain reporting its number of new deaths dropped to 87 on Sunday -- the first time the number has fallen below 100 in two months. But despite the optimism in some European countries, the rising infection and fatality numbers in other parts of the world offered reminders of the threat posed by the deadly disease. The number of infections in Latin America passed half a million on Sunday, as Chile locked down its capital Santiago following a sharp rise in cases. Despite the surging numbers in Brazil, far-right President Jair Bolsonaro is keen to end lockdowns, which he claims have unnecessarily damaged the economy. ""Unemployment, hunger and misery will be the future of those who support the tyranny of total isolation,"" Bolsonaro tweeted. In Russia, which has the world's second highest number of infections, the top health official claimed Sunday the country had ""halted the growth"" of the virus, just a day after reporting its deadliest day. There were happier scenes in Europe, with excited swimmers diving into the waters off newly reopened beaches in France, Greece and Italy, while Britons enjoyed the sun in parks after lockdown measures eased. Italy, for a long stretch the world's worst-hit country, announced that European Union tourists would be allowed to visit from June 3, and a 14-day mandatory quarantine would be scrapped. ""We're facing a calculated risk in the knowledge that the contagion curve may rise again,"" Prime Minister Giuseppe Conte said. With the threat of a second wave of infections and with no vaccine available, authorities in many countries have asked people not to throng public spaces as they are made accessible again. And a stark warning came on Sunday from one of the top medical experts in China, where the disease first emerged late last year but has largely been brought under control after more than 4,600 deaths. ""The majority of... Chinese at the moment are still susceptible... because (of) a lack of immunity,"" Zhong Nanshan, the Chinese government's senior medical advisor, told CNN. ""We are facing (a) big challenge, it's not better than the foreign countries I think at the moment."" But with people growing weary of confinement and suffering immense economic pain, pressure is growing on governments to ease lockdowns despite the threat of a second wave. With more than 88,000 deaths and 1.47 million confirmed coronavirus cases, the US is the worst-hit country on the planet, and President Donald Trump is keen to restart the world's biggest economy despite experts warning against moving too quickly. Former president Barack Obama on Saturday took a swipe at the response to the pandemic, telling graduates at a virtual college commencement ceremony that many leaders today ""aren't even pretending to be in charge"" -- a remark widely regarded as a rare rebuke of his successor. ""Doing what feels good, what's convenient, what's easy -- that's how little kids think,"" he later told high school students Someone whose handling of the pandemic has been more praised is New Zealand Prime Minister Jacinda Ardern -- however even she is not exempt from coronavirus measures. She was denied entry to a cafe over the weekend as it had reached its customer limit. ""I have to take responsibility for this, I didn't get organised and book anywhere,"" her fiancee Clarke Gayford tweeted. burs-dl/bp <org>BORUSSIA DORTMUND</org> <org></org>"
26,15/05/2020,19:21,Union coach Fischer to miss Bayern clash after quarantine breach,Bundesliga giant-killers Union Berlin will be without head coach Urs Fischer for Sunday's home clash against Bayern Munich after he broke the team quarantine following a family bereavement.,"The Bundesliga becomes the first top European league to resume this weekend behind closed doors despite the coronavirus pandemic. The guidelines for the German top flight's restart include a week-long quarantine for every club, which Fischer broke on Monday to join his family after the death of his father-in-law. The Swiss plans to return to Berlin on Saturday, but will not rejoin the team, because he broke the German Football League (DFL) guidelines, the club said Friday. ""All our sympathy goes to the Fischer family in this difficult time,"" said Union president Dirk Zingler. In the build-up to Sunday's game, Fischer's assistant coach Markus Hoffmann will take charge of Union and be on the bench for the match. According to DFL guidelines, Fischer will only return to the team after two negative tests for the coronavirus. Mid-table Union, in their first ever season in the top division, are a force to be reckoned with at home having beaten previous league leaders Dortmund and Moenchengladbach this season. However, the terraces of their east Berlin stadium will be empty Sunday with Bayern looking to build on their four-point lead in their bid to win an eighth straight league title. Also set to miss the return of the Bundesliga is Augsburg coach Heiko Herrlich, whose trip from his team's hotel to buy toothpaste cost him his place on the bench for the home fixture with Wolfsburg on Saturday. ""I made a mistake by leaving the hotel,"" admitted Herrlich who said he went to a supermarket to buy toothpaste and skin cream. ""In this situation, I didn't live up to my position as a role model for my team and the public."" The former Germany international took over Augsburg from Martin Schmidt earlier his year, penning a deal until 2022. His team are 14th in the Bundesliga, five points clear of the relegation play-off spot."
