,date,hour,title,subtitle,text
23,16/02/2019,18:12,Ten-man Schalke draw blank ahead of Man City clash,Schalke 04 warmed-up for the Champions League visit of Manchester City with a goalless draw at home to fellow Bundesliga strugglers Freiburg on Saturday.,"Schalke are winless in their last three Bundesliga games and sit just above the relegation places in 14th spot. Next up is a huge challenge at home to Pep Guardiola's Premier League giants Man City in their Champions League last 16, first-leg tie on Wednesday. In Saturday's bad-tempered clash, both Schalke and Freiburg finished with ten men. The Royal Blues played for nearly 50 minutes without defensive midfielder Suat Serdar, sent off for a first-half foul, while Freiburg defender Christian Guenter was dismissed late on for a second yellow card. Schalke came close to conceding a penalty with 10 minutes left when Spanish midfielder Omar Mascarell was suspected of a handball, but the video assistant referee (VAR) over-ruled the referee's initial decision. Welsh teenage winger Rabbi Matondo, who Schalke signed last month from Man City, struggled to make an impact on only his second Bundesliga appearance, his first over 90 minutes. The 18-year-old had a good chance with 16 minutes left but ballooned his shot over the bar. Freiburg hit the Schalke woodwork twice in the second half through substitutes Jerome Gondorf and Luca Waldschmidt. League leaders Borussia Dortmund are at bottom side Nuremberg on Monday. They are two points ahead of Bayern Munich, who won 3-2 at Augsburg on Friday. RB Leipzig took their chance to stay in the title race as a 3-1 win at Stuttgart left them fourth, just a point behind Borussia Moenchengladbach, who play Sunday at Eintracht Frankfurt. Yussuf Poulsen netted two goals as Leipzig took the three points. The Denmark striker opened the scoring after just six minutes when Leipzig's Germany striker Timo Werner fired in a cross, which clipped a defender's knee for Poulsen to tap home. Steven Zuber equalised from the spot for Stuttgart ten minutes later when the video assistant referee spotted the ball had hit Willi Orban's arm after a Mario Gomez header. However, Leipzig rallied as midfielder Marcel Sabitzer curled home a superb free-kick with 20 minutes left, then Poulsen claimed his second goal soon after, tapping home following an impressive run by US international Tyler Adams. Wolfsburg climbed to fifth with a 3-0 win at Mainz with goals by midfielder Maximilian Arnold, striker Wout Weghorst and defender Robin Knoche. Hoffenheim also moved up after Algeria forward Ishak Belfodil, Brazilian striker Joelinton and Germany midfielder Kerem Demirbay netted in their 3-0 win at second-from-bottom Hanover 96 to go seventh."
24,15/12/2014,17:19,Bullish Freiburg boss aims to tackle Bayern head on,Coach Christian Streich has urged his struggling Freiburg side to tackle run-away Bundesliga leaders Bayern Munich head on in Tuesday's Bundesliga match despite his team losing several key players to injury.,"Freiburg, who are 15th and just above the relegation places, are yet to win at Munich's Allianz Arena having suffered 13 defeats and two draws, coming away with a 4-0 thrashing the last time they played there in February. Streich's side, who have won just two of their 15 league matches this season, have been weakened by injuries to key midfielders Vladimir Darida and Jonathan Schmid. Strikers Philipp Zulechner and Mike Frantz are also ruled out with a cold and a bruised shin respectively. But despite their poor form and missing personnel, Streich dismissed any talk of damage limitation against Bayern who have won 12 of their 15 league games and are nine points clear in the German league table. ""Damage limitation - that's not something we're into,"" said Streich, whose side last won more than a month ago. ""We want to take the bull by the horns. ""We have lost only five of our fifteen games and are unbeaten in the other ten. ""So we're going with lots of energy to Munich."" Bayern's Spanish midfielder Xabi Alonso is their main concern as the 33-year-old has a cold while fellow defensive midfielder Sebastian Rode has a sore toe. Bayern have conceded just three goals all season and last lost to Freiburg in 1996, but their coach Pep Guardiola, as is his custom, said the team must be on their guard against a Freiburg side who play ""with their heads"". Bayern are in the middle of playing three games in six days, they thrashed Augsburg 4-0 away on Saturday, before travelling to Mainz for their final league match of the year on Friday."
25,26/09/2014,09:27,Victory needed by both Schalke and Dortmund in derby,Bayern Munich are right where they want to be atop the Bundesliga after five rounds and ahead of a tough showdown against Cologne this weekend while Schalke and Borussia Dortmund both head into the 145th derby needing a victory.,"Munich head to Cologne on Saturday to face a team which had not conceded a goal in their first four games this season until Hanover scored in the midweek round of games. Bayern are happy about where they are, knowing that the weekend/midweek rhythm is just starting with a match-up against CSKA Moscow coming in the Champions League next week. ""I think we can be satisfied after the first five games. We've picked up 11 out of a possible 15 points, three wins and two draws - that's okay,"" said Munich board chairman Karl-Heinz Rummenigge after the team's 4-0 victory over the previous surprise leaders SC Paderborn. ""Some people expected a bumpy start after the World Cup. We can be very satisfied with the season to date including the Champions League."" Bayern winger Arjen Robben said the win over Paderborn was important but the Cologne game matched that in their bid to stay atop the Bundesliga. ""It was really important for us to win and lay down a marker. That's what we're aiming for, where we want to be and - much more important - we want to stay there,"" said Robben. The top two challengers at the moment - Bayer Leverkusen and Hanover 96 - both have 10 points and play at teams who have not yet won this season in SC Freiburg and VfB Stuttgart respectively. Stuttgart sit second-to-last with two points after failing to hold a 2-0 lead at Dortmund in a 2-2 draw midweek. Stuttgart's troubles - they had scored just one goal going into the Dortmund match - resulted in the sacking of sporting director Fredi Bobic. ""In the end, we probably have to consider ourselves somewhat fortunate to be taking a point. With this performance, we have certainly taken a step in the right direction,"" said Daniel Didavi, who scored both goals against Dortmund. The Yellow-Blacks actually could have beaten Stuttgart but had a shot blocked at the line in stoppage time. In general, though, Dortmund know they cannot give up two goals every game. ""We need more stability in defence. We have already conceded nine goals in five matches which is not just a poor record, it is a very poor record,"" said captain Mats Hummels, who came on in the second half for his first action this season. ""We need to defend better as a team, and all eleven players have to play their part. If you concede two goals in each game, as has already happened four times this season, it's very hard to win."" And Dortmund need to win, having already dropped four points behind Bayern and three behind Leverkusen and Hanover. Schalke come into the match having finally won their first competitive match of the season - a 3-0 beating of Werder Bremen. The Royal Blues have won just one of the last four derbies at home against Dortmund. Manager Jens Keller knows his team will be well served to put together a string of victories to move back up the table. And Dortmund are a perfect opponent for that. ""We don't need to motivate the players for this match. It's the biggest derby in Germany. We are all excited for the match,"" said Keller, whose team has five points in 13th place. Fixtures (all times GMT)"
26,31/08/2014,19:57,Tired Gladbach settle for Freiburg draw,Freiburg missed a penalty but picked up their first point of the new Bundesliga season following a 0-0 draw with Borussia Moenchengladbach on Sunday.,"Swiss attacker Admir Mehmedi scooped a spot-kick high over the bar midway through the second half in a drab encounter at Freiburg's Mage Solar Stadion. Gladbach had beaten FK Sarajevo 7-0 in the Europa League play-offs on Thursday but a fifth competitive match in 16 days looked to be a step too far for the visitors. Freiburg 'keeper Roman Buerki tipped over a shot from fellow Swiss international Granit Xhaka 14 minutes into a game that was desperately short of goalmouth action. Approaching the hour mark, Mehmedi found Jonathan Schmid at the back post but his volley was comfortably turned behind by Gladbach 'keeper Yann Sommer. Freiburg were given a great chance to go in front when Gladbach defender Tony Jantschke chopped down home substitute Maximilian Philipp after 62 minutes. Mehmedi blazed over, however, meaning the home side are still waiting for their first goal of the new campaign. Earlier, Mainz and Hanover 96 also played out a scoreless draw. Mainz had more of the game in the first half but Hanover striker Joselu went closest to scoring before Hiroshi Kiyotake had a shot cleared off the line for the visitors in the second half. Ja-Cheol Koo, who scored an injury-time penalty in Mainz's draw at Paderborn on the opening day, had a decent appeal for another spot-kick turned down on 13 minutes after a challenge from Leonardo Bittencourt. Shinji Okazaki fired wide from a tight angle inside the box and the Japanese striker then had his own appeal for a penalty waved away by referee Sascha Stegemann after going to ground under Hanover defender Marcelo. Hanover, who beat Schalke last weekend, almost broke the deadlock six minutes into the second half after a botched clearance from Stefan Bell fell to Kiyotake. The Japanese midfielder showed good footwork to create some space before drilling a shot towards the corner - Mainz thankful that Moritz was on the line to clear. Joselu had a chance to win it with 13 minutes left but, after Artur Sobiech picked him out in the area, he couldn't direct the ball beyond Karius and both sides had to settle for a point. On Saturday, Xabi Alonso made his Bayern Munich debut and Robert Lewandowski scored his first goal for the club as the defending champions drew 1-1 at Schalke 04. The result means that Bayer Leverkusen sit top of the fledgling table following their 4-2 home win over Hertha Berlin. On Friday, Borussia Dortmund held off a late comeback to beat Augsburg 3-2 in what was their first league win of the new campaign."
27,19/08/2014,02:05,Germany riding crest of wave as Bundesliga begins,The new Bundesliga season gets underway this weekend with German football riding the crest of a wave following the national team's triumph at the World Cup in Brazil last month.,"That thoroughly deserved victory, given to Joachim Loew's side by Mario Goetze's extra-time strike in the final against Argentina, saw a unified Germany crowned as world champions for the first time. But at club level, the Bundesliga has been leading the way for some time. It averaged 3.16 goals per game last season, considerably more than any of its major European counterparts, while average gates were over 42,000, making the German top flight the best attended league anywhere. ""In my opinion, the Bundesliga's the most attractive league in the world,"" Borussia Moenchengladbach coach Lucien Favre told bundesliga.com. ""The hype in Germany is amazing, and now they've won the World Cup so it's not going to tail off in a rush."" Nevertheless, the biggest problem facing the Bundesliga, as ever, is how to counter the dominance of Bayern Munich, who have romped to the title and added the German Cup in each of the last two campaigns. They have seen Toni Kroos and Mario Mandzukic depart and lost Javi Martinez to a serious knee injury in last week's SuperCup defeat to Borussia Dortmund, but the Bavarians remain favourites. And yet the rest can draw some hope from the very fact this is a Bundesliga season immediately following a World Cup, and that has not tended to help Bayern in the recent past. After Germany hosted the 2006 World Cup, Stuttgart went on to win the Bundesliga, while in 2011 Dortmund pipped Bayern to the title. In 2009, after Germany reached the Euro 2008 final, it was Wolfsburg who were champions. Six members of Pep Guardiola's squad played in the World Cup final, including Goetze, while Dante and Arjen Robben were also involved until the latter stages in Brazil. That is why chairman Karl-Heinz Rummenigge wanted the start of the new season delayed in order to give these players longer to prepare, but that request was unsurprisingly turned down by Bayern's rivals. ""We have to face the fact that the first half of the season will be difficult,"" said Guardiola, who at times had only a skeleton squad in pre-season training. ""We are at least one month behind schedule."" Guardiola has added to his squad with compatriots Juan Bernat from Valencia and Pepe Reina, who will provide competition in goal for Manuel Neuer. But the marquee signing was Robert Lewandowski, a prolific goalscorer for Dortmund in the last four years. However, Dortmund have moved to replace the Pole by signing Italy striker Ciro Immobile from Torino and Colombia's Adrian Ramos from Hertha Berlin. Stability is key at the Signal Iduna Park, where coach Jurgen Klopp, who led Dortmund to back-to-back titles in 2011 and 2012 and a Champions League final defeat to Bayern in 2013, is entering his seventh season in charge. ""We want to establish ourselves further at the top of the league and qualify directly for the Champions League,"" said sporting director Michael Zorc modestly. However, Guardiola knows where the danger lies, saying: ""We may have won the last two league titles, but they clinched the previous two. Our great challenge is to keep up our level to keep them at distance."" Beneath them, Schalke, Bayer Leverkusen and Wolfsburg will again be hoping to contend for Champions League qualification at least. Schalke have kept Klaas-Jan Huntelaar and Julian Draxler, while Sidney Sam has joined from Leverkusen, and few teams can boast a midfield as strong as Wolfsburg, with Kevin de Bruyne, Luiz Gustavo and France's Josuha Guilavogui. Bayer have signed Swiss striker Josip Drmic from Nuremberg and have a new coach in Roger Schmidt, back in his native country after winning the Austrian title with Salzburg. Hamburg will be hoping for a stable campaign after almost being relegated for the first time in their history last season. There are new coaches at Mainz, Eintracht Frankfurt and Stuttgart, who have reappointed Armin Veh, the architect of their 2007 title triumph, while Cologne are back among the elite and Paderborn are in the Bundesliga for the first time."
28,06/04/2014,19:24,Football: German league results -- collated,Collated German league results on Sunday:,"Eintracht Braunschweig 3 (Kumbela 14, Nielsen 21, Hochscheidt 89) Hanover 96 0 Hertha Berlin 1 (Allagui 11) Hoffenheim 1 (Polanski 30) Played Saturday VfB Stuttgart 2 (Maxim 69, Harnik 89) SC Freiburg 0 Werder Bremen 1 (di Santo 15) Schalke 04 1 (Goretzka 33) Nuremberg 0 Borussia Moenchengladbach 2 (Arango 18, Kruse 79-pen) Augsburg 1 (Moelders 31) Bayern Munich 0 Eintracht Frankfurt 2 (Joselu 51, Meier 85) Mainz 05 0 Dortmund 2 (Lewandowski 51, Reus 77) VfL Wolfsburg 1 (Olic 34) Played Friday Hamburg 2 (Calhanoglu 4, Westermann 82) Bayer Leverkusen 1 (Brandt 58)"
29,29/11/2013,22:45,Football: German Bundesliga table,"German Bundesliga table after Friday's match (played, won, drawn, lost, goals for, goals against, points):",Bayern Munich          13 11 2 0 30  7 35 Bayer Leverkusen       13 10 1 2 28 14 31 Borussia Dortmund      13  9 1 3 32 14 28 B. Moenchengladbach    13  8 1 4 30 16 25 VfL Wolfsburg          14  7 2 5 20 16 23 Schalke 04             13  6 3 4 26 26 21 Mainz 05               13  6 1 6 20 25 19 Hertha Berlin          13  5 3 5 20 17 18 VfB Stuttgart          13  4 4 5 24 23 16 Hamburg                14  4 4 6 30 31 16 FC Augsburg            13  5 1 7 15 23 16 Werder Bremen          13  4 3 6 15 23 15 Hanover                13  4 2 7 15 22 14 Hoffenheim             13  3 4 6 28 30 13 Eintracht Frankfurt    13  2 5 6 17 24 11 SC Freiburg            13  2 5 6 14 24 11 Nuremberg              13  0 8 5 13 26  8 Eintracht Braunschweig 13  2 2 9  8 24  8
30,26/10/2013,17:32,Football: German Bundesliga results,German Bundesliga results on Saturday:,"Bayern Munich 3 (Mandzukic 29, 51, Goetze 54) Hertha Berlin 2 (Ramos 4, Ben-Hatira 58) Schalke 04 1 (Meyer 62) Borussia Dortmund 3 (Aubameyang 14, Sahin 51, Blaszczykowski 74) Bayer Leverkusen 2 (Rolfes 34, Can 83) Augsburg 1 (Hahn 24) Hanover 1 (Sane 56) Hoffenheim 4 (Salihovic 10, Herdling 18, Roberto Firmino 62, 64) Mainz 05 2 (Okazaki 8, 68) Eintracht Braunschweig 0 Playing later (1630 GMT) VfL Wolfsburg v Werder Bremen Played Friday VfB Stuttgart 1 (Ibisevic 3-pen) Nuremberg 1 (Drmic 6) Playing Sunday SC Freiburg v Hamburg (1330 GMT) Bourssia Moenchengladbach v Eintracht Frankfurt (1530 GMT)"
