,date,hour,title,subtitle,text
8,01/11/2020,18:16,Alario double guides unbeaten Leverkusen past Freiburg,Argentina striker Lucas Alario continued his fine run of form with two crucial first-half goals as Bayer Leverkusen came from behind to beat Freiburg 4-2 in the Bundesliga on Sunday.,"After a disastrous first half hour for Leverkusen, Alario struck twice before the break to turn the game on its head and fire his team back into the top four. The Argentine now has seven goals from eight games in all competitions, and has found the net in each of his last three league appearances. Leverkusen, meanwhile, remain the only Bundesliga team yet to be beaten after the first six games of the season. Freiburg took the lead after just three minutes, Lucas Hoeler latching onto a 50-yard through ball from Lukas Kuebler and flicking the ball past Leverkusen keeper Lukas Hradecky. Jonathan Schmid doubled the lead with a brilliant volley five minutes later but the goal was annulled after Hoeler was ruled offside in the build-up. Leverkusen were bracing themselves for a long afternoon when Sven Bender was shown the red card for a trip on Hoeler in front of goal, but the decision was reversed by VAR. Having ridden their luck in the first half hour, Leverkusen ruthlessly took their chances from then on, with Alario turning the game on its head with two quick goals before half-time. The Argentine pounced on a misplaced pass from Nicolas Hoefler to slot home the equaliser, before turning in a low cross from Lars Bender to put Leverkusen ahead just minutes before the break. Peter Bosz's side looked to be in the clear when Nadiem Amiri smashed in a third on 65 minutes, but a tap-in from substitute Nils Petersen quickly brought Freiburg back into the game. Yet the home side's revival was short-lived, as centre-back Jonathan Tah rose high at a corner to head in Leverkusen's fourth and seal the three points. While Leverkusen return to the top four, Freiburg now sit just three places adrift of the bottom three, having not won since the opening day of the season."
9,24/10/2020,18:30,Lewandowski hits hat-trick as Bayern Munich rout Frankfurt,Robert Lewandowski took his Bundesliga tally to 10 goals in five games this season with a hat-trick as Bayern Munich thumped Eintracht Frankfurt 5-0 on Saturday.,"Lewandowski has scored nine goals in his last three league games and wrapped up his treble within an hour at the Allianz Arena. Defending champions Bayern have scored 22 goals this term -- 10 more than league leaders RB Leipzig who stayed top with a 2-1 win over 10-man Hertha Berlin. Bayern sit one point behind in second place. In Munich, Leroy Sane marked his return from injury with the fourth goal during a brief cameo, before England Under-17 midfielder Jamal Musiala also came off the bench to net the fifth. However, Bayern's victory could come at a price as Canadian left-back Alphonso Davies was in clear distress after going off early with an ankle injury. Lewandowski underlined his status as one of the world's best strikers last season by scoring a career-best 55 goals in 47 games, including 34 in the Bundesliga. The Polish international opened the scoring on 10 minutes when he fired home after a Thomas Mueller pass. Frankfurt goalkeeper Kevin Trapp couldn't do anything to stop Lewandowski's header from a Joshua Kimmich corner in the 26th minute. Bayern had a penalty appeal turned down when Douglas Costa's cross clipped the hand of Frankfurt's Makoto Hasebe. Lewandowski wrapped up the victory on the hour mark with a clinical finish from another Costa cross. After sitting out the last two games, Sane ghosted past a defender and drove a shot into the bottom corner with 18 minutes to play. Manuel Neuer pulled off a great save to deny Frankfurt striker Bas Dost before Musiala grabbed the final goal as the visitors suffered their first league defeat of the season. Leipzig came from behind to seal a 2-1 win over Hertha, whose Colombian striker Jhon Cordoba scored in the eighth minute. Leipzig drew level when defender Dayot Upamecano fired home from a free-kick on 11 minutes, but Berlin were reduced to 10 men after the break when substitute Deyovaisio Zeefuik was shown two yellow cards within four minutes of coming on. Leipzig made the man advantage count when Marcel Sabitzer converted a penalty with 13 minutes left. Hertha were lucky not to finish with nine men when another sub, Jessic Ngankam, scythed down Leipzig left-back Angelino and the referee changed his decision to a yellow card having initially showed a straight red. Borussia Moenchengladbach warmed up for Tuesday's Champions League game at home to Real Madrid with a 3-2 comeback win at Mainz. Germany midfielder Lars Stindl gave Gladbach an early lead, but the visitors were 2-1 down at half-time after French striker Jean-Philippe Mateta scored twice for Mainz. Gladbach midfielder Jonas Hofmann converted a penalty on 76 minutes, after a shot by replacement Marcus Thuram was blocked by a Mainz hand before Matthias Ginter headed the winner as Gladbach climbed to fifth. Union Berlin were held to a 1-1 draw at home to Freiburg as Vincenzo Grifo's first-half goal was cancelled out two minutes later by Union midfielder Robert Andrich."
10,03/10/2020,17:58,Haaland nets twice as Dortmund run riot,Erling Braut Haaland again demonstrated his deadly finishing by netting twice on Saturday as Borussia Dortmund climbed to second in the Bundesliga table with a 4-0 demolition of Freiburg.,"Dortmund bounced back from last weekend's shock defeat at Augsburg as Haaland shone to leave him on 21 goals in 23 games for Dortmund since his January transfer as the burly Norwegian claimed clinically-taken goals. Having also scored in Wednesday's German Super Cup 3-2 defeat at Bayern Munich, the 20-year-old Haaland has netted five goals in as many games this season. Dortmund were missing England winger Jadon Sancho and goalkeeper Roman Buerki, both recovering from illness having tested negative for the coronavirus. Club captain Marco Reus made his first start for eight months after a groin injury. US teenager Giovanni Reyna, who assisted all three goals, was outstanding alongside Reus in the attacking midfield role for Dortmund. The 17-year-old played Haaland into space for the burly Norwegian to score both his goals, then delivered a pin-point corner for Emre Can's headed goal. Haaland, 19, once again showed dazzling finishing when he fired home from a right angle on 31 minutes. Can then rose highest from a corner and his bullet header put Dortmund 2-0 up two minutes after the break. Reyna and Haaland combined again when they got in behind the defence as the American delayed his pass which the Norwegian hammered into the net on 66 minutes. Winger Felix Passlack claimed his first Bundesliga goal in added time to complete the rout with Haaland providing the final pass. Defending champions Bayern Munich host Hertha Berlin on Sunday out to bounce back from last weekend's shock defeat at Hoffenheim to end their 23-match winning streak. Eintracht Frankfurt top the league table after their 2-1 win over previous leaders Hoffeheim. Croatia striker Andrej Kramaric netted his eighth goal in four games with a superb strike, curled inside the far corner, to give Hoffenheim the lead on 18 minutes. However, Japan midfielder Daichi Kamada turned the game when he tapped home on 54 minutes, then powered through the defence before Bas Dost stabbed the ball over the line on 19 minutes from time. It could have been 3-1 as Frankfurt had a late goal disallowed. Champions League side Moenchenegladbach romped to a 3-1 win at Cologne as Alassane Plea and Stefan Lainer fired home before Lars Stindl added a penalty on 56 minutes. Cologne scored a consolation goal when Elvis Rexhbecaj beat Gladbach keeper Yann Sommer from 20 metres out. Bremen earned a second win in three games when Leonardo Bittencourt's right-footed shot on 27 minutes sealed their 1-0 win at home to new boys Arminia Bielefeld. The hosts survived a late scare as Bielefeld had a goal disallowed just before the whistle. Leverkusen were held to a 1-1 draw at Stuttgart as Patrik Schick's early goal was cancelled out by an equaliser by the hosts' striker Sasa Kalajdzic. On Friday, Union Berlin enjoyed their first win of the season with a 4-0 thumping of Mainz at home as Germany striker Max Kruse scored his first goal for the hosts."
11,19/09/2020,21:15,Haaland and Reyna shine as Dortmund youngsters down Gladbach,Erling Braut Haaland scored twice and 17-year-old Giovanni Reyna shone as youthful Borussia Dortmund swept aside fellow Champions League side Borussia Moenchengladbach 3-0 on Saturday on the opening weekend of the Bundesliga season.,"After holders Bayern Munich had kicked off the 2020/21 campaign on Friday with a record 8-0 thrashing of Schalke, Dortmund's youngsters also dazzled at home to Gladbach. ""It was a really good start to the season. We have a lot of young guys, it's fun to play with guys near my age,"" said USA Under-17 international Reyna. ""This is an exciting group and we have to keep working."" Haaland converted a second-half penalty, then again showcased his clinical eye for goal by finishing a superb counter as Dortmund attacked from their own goal. Coach Lucien Favre banked on youth by starting two 17-year-olds in Reyna and England Under-21 midfielder Jude Bellingham, who made his league debut, with Sancho and Haaland, both 20, leading Dortmund's attack. Reyna, making just his third league start, paid back the faith by scoring the opening goal and winning the penalty Haaland converted. Reyna drilled home Bellingham's superb pass from a tight ankle on 34 minutes, then had his ankle clipped after a darting run into the area to win the penalty for Haaland. Sancho tried to convince Haaland to let him take the spot-kick, but ""I was confident whoever took it, would score, which is the most important thing"" said Reyna. Haaland then stole the show with a stunning end-to-end sprint to support Sancho's break before crashing home Dortmund's third goal on 78 minutes. The towering Norwegian, the first player in Bundesliga history to score a hat-trick from the bench, now has 18 goals in 20 games for Dortmund since his arrival in January. For the first time since March, some German league clubs were able to welcome back limited numbers of fans, depending on permission from local health authorities. The biggest crowd of the day was in Dortmund, as 9,300 cheered the impressive home win. ""It's amazing to have fans back, they support us so much,"" added Reyna. Having finished runners-up to Bayern for the last two seasons, Dortmund are on a collision course with the European champions who they meet in the German Super Cup showdown on September 30 in Munich. Earlier, Hertha Berlin's new-signing Jhon Cordoba scored on his debut in a 4-1 away romp at Werder Bremen as the ambitious capital city club also threw down an early marker. In front of 8,500 in Bremen, Hertha defender Peter Pekarik and Belgian-born winger Dodi Lukebakio scored quick-fire goals at the end of the first half to leave Werder 2-0 down at the break and the hosts were whistled off the pitch by their own fans. Colombia striker Cordoba, signed from Cologne in mid-week, came on to start the move which Brazil Under-23 forward Matheus Cunha finished as Hertha went 3-0 up with an hour gone. Davie Selke scored Bremen's second-half consolation goal before Cordoba capped his debut by tucking home Hertha's fourth goal on 90 minutes. Just like Bayern, Cologne also had to play behind closed doors due to a rising rate of infection for their 3-2 home defeat to Hoffenheim, for whom Andrej Kramaric scored a hat-trick. The Croatia striker put the visitors ahead after three minutes following a mix up in defence, netted a penalty and smashed home the winning goal in added time after Cologne had launched a late fight back. In the capital, playmaker Michael Gregoritsch and winger Andre Hahn scored late goals as Augsburg beat hosts Union Berlin 3-1 in front of 4,600 fans. Newly-promoted Arminia Bielefeld earned a point with a 1-1 draw at Eintracht Frankfurt on their return to the top flight in front of 6,500. Stuttgart, who also came up, gave Freiburg a scare with late goals by Sasa Kalajdzic and Silas Wamangituka as they fought back in a 3-2 defeat in front of 8,000."
12,27/06/2020,18:01,"Bremen snatch play-off survival chance, champions Bayern rout Wolfsburg","Werder Bremen gave themselves hope of avoiding relegation from the German Bundesliga by thrashing Cologne 6-1 to grab a play-off place on the last day of the season, while champions Bayern Munich routed Wolfsburg before lifting the trophy on Saturday.","Japan striker Yuya Osako scored twice as Bremen stole the lifeline of the relegation/promotion play-off place from Fortuna Duesseldorf, who lost 3-0 at Union Berlin and were relegated with Paderborn, finishing one point behind Bremen. Florian Kohfeldt's Werder will face second-tier opponents in either Heidenheim or possibly neighbours, rivals and fellow fallen giants Hamburg in the play-off first leg on Thursday. Bremen have spent more seasons than any other team in the Bundesliga, having only spent one term in the second tier, in 1980-81. A burst of goals from Osako, Milot Rashica and Niclas Fuellkrug -- all in the space of eight minutes -- had Werder 3-0 up at the break against Cologne at the Weserstadion. Former Everton midfielder Davy Klaassen then fired home a rebound just after the break before Osako, facing his old side, added his second and USA international Josh Sargent completed the rout. Dominick Drexler pulled a goal back for Cologne. Werder, the four-time Bundesliga champions, also needed a favour from Berlin and got one as Union beat Fortuna 3-0 with goals from Nigerian duo Anthony Ujah and Suleiman Abdullahi either side of veteran midfielder Christian Gentner's effort. Bremen will find out their play-off opponents on Sunday, with Heidenheim currently in the play-off place ahead of the final round of matches in the second division. At Wolfsburg, Bayern striker Robert Lewandowski scored a penalty for his 34th league goal of the season, finishing as the top scorer for the fifth time. Kingsley Coman, Michael Cuisance and Thomas Mueller also got on the scoresheet as Bayern, champions for the eighth straight season, finished 13 points clear of second-placed Borussia Dortmund. Mueller set up Coman for Bayern's opening goal to finish the campaign with a league record 21 assists, and his goal that rounded out the win was also Bayern's 100th league goal this season -- one short of the Bundesliga record. Wolfsburg captain Josuha Guilavogui was sent off for a second yellow card after fouling Cuisance, leading to Lewandowski's penalty. Meanwhile, Borussia Moenchengladbach and RB Leipzig secured qualification for next season's Champions League after 2-1 wins over Hertha Berlin and Augsburg respectively, as fifth-placed Bayer Leverkusen missed out by two points despite beating Mainz 1-0. Dortmund, who had already wrapped up second place, crashed to a 4-0 home defeat by Hoffenheim, for whom Croatia striker Andrej Kramaric scored all four goals, including one penalty. That result allowed Hoffenheim to leapfrog Wolfsburg and take sixth place, although both sides will go into the Europa League next season along with Leverkusen. Before kick-off in Dortmund, Mario Goetze, whose winning goal sealed Germany's victory in the 2014 World Cup final, was given a send-off by the club. He will leave this summer with his contract having expired, but the 28-year-old attacking midfielder has not announced his future club. Elsewhere, Timo Werner signed off with a brace in RB Leipzig's 2-1 win at Augsburg in what was his final appearance for the club before moving to Chelsea. Schalke's disastrous second half of the season was completed with a 4-0 thrashing at the hands of Freiburg as they finished the season 12th, having been third in December. Eintracht Frankfurt beat bottom side Paderborn 3-2 in Saturday's other game."
13,05/06/2020,22:47,Freiburg hand Gladbach Champions League setback,Borussia Moenchengladbach's push for a Champions League place was stalled by Freiburg who clinched a 1-0 win in the Bundesliga on Friday.,"Gladbach, enjoying their best season since 1984, remain in fourth place - the final Champions League qualifying spot - on 56 points. However, Bayer Leverkusen could replace them on Saturday should they defeat defending champions and league leaders Bayern Munich. With just four games left, Freiburg boosted their Europa League hopes with victory secured by Nils Petersen's goal in the 58th minute. Petersen had only been on the pitch for a minute after replacing Roland Sallai when he powerfully headed home from a free-kick. To make matters worse for Gladbach, their French striker Alassane Plea was red-carded in the second half. French striker Marcus Thuram, who made global headlines last weekend when he took a knee to protest the death of George Floyd, was unable to breakthrough despite his side having the best of the first hour. When Plea was sent-off, Gladbach's sporting director Max Eberl protested too vigorously through his anti-coronavirus face mask and was also dismissed. Plea will now miss next weekend's home clash with Bayern Munich."
14,30/05/2020,21:10,Lewandowski hits brace as Bayern Munich go 10 points clear,Bayern Munich opened a 10-point lead at the top of the Bundesliga on Saturday with a 5-0 drubbing of relegation-threatened Fortuna Dusseldorf behind closed doors with the league's top-scorer Robert Lewandowski scoring twice.,"Duesseldorf defender Mathias Joergensen scored an early own goal before Benjamin Pavard, Lewandowski (2) and Alphonso Davies hit the target. With five games left, Bayern, who have won their last eight league games, are comfortably on course for an eighth straight league title. However, second-placed Borussia Dortmund could trim their lead on Sunday at bottom side Paderborn. Several records fell as Lewandowski now has 43 goals in all competitions, a season's best for the Poland striker with games in hand. Also head coach Hansi Flick claimed his 22nd win in his first 25 games, bettering the start made by Pep Guardiola when he took charge in 2013. ""Statistics and records don't interest me, what's important is to have a successful season,"" said Flick, in his first season since replacing Niko Kovac in November. ""At Bayern Munich, you are expected to win. I am very happy, we were very aggressive and didn't give them any chances."" Lewandowski, who had never previously scored in six games against Duesseldorf, made amends with goals either side of half-time. Fortuna, who were unbeaten in their three games since the league resumed after a two-month coronavirus-enforced hiatus, were humbled at the Allianz Arena where they last poached a 3-3 draw in November 2018. They fell behind on 15 minutes when Joergensen turned the ball into his own net after Pavard mishit his shot. Right-back Pavard then grabbed the second with a powerful header on 29 minutes before Lewandowski made it 3-0 just before the break after being presented with a tap-in by Thomas Mueller. Duesseldorf were floored with two goals in as many minutes as Lewandowski profited again with another poacher's goal after Serge Gnabry's good work. Davies then scored the game's best goal. After some high pressing, the Canadian teen won the ball in the Duesseldorf area, barged past a succession of defenders and fired home to make it 5-0 on 52 minutes. Werder Bremen boosted their survival hopes with a 1-0 win at Schalke, who are winless in 11 games and continue to plummet. Midfielder Leonardo Bittencourt scored a first-half winner. ""This is a very, very important away win,"" said Bremen coach Florian Kohfeldt. ""We have taken seven points from the last three games, but if you look at the table, we are still behind."" Bremen have spent more seasons in the Bundesliga than any other club, but currently sit second from bottom. However, Saturday's victory leaves them just three points from guaranteed safety with six games left. They are two points behind Duesseldorf in 16th, which carries a relegation play-off at the end of the season. Werder could climb out of the relegation places for the first time since December on Wednesday if they beat Eintracht Frankfurt at home. Bittencourt hit a stunning strike from just outside the box which beat Schalke's Bayern-bound goalkeeper Alexander Nuebel on 32 minutes. Schalke succumbed to their fourth straight defeat, piling pressure on head coach David Wagner. In the same game, Schalke's American midfielder Weston McKennie wore a 'Justice for George' armband as part of the growing protests over the death of an unarmed black man during a police arrest in the United States. ""To be able to use my platform to bring attention to a problem that has been going on too long feels good!!!,"" tweeted 21-year-old McKennie. ""We have to stand up for what we believe in and I believe that it is time that we are heard."" George Floyd died in Minneapolis in an arrest by a police officer who pinned him to the ground for several minutes by kneeling on his neck. Hertha remain unbeaten with three wins and a draw since Bruno Labbadia took charge during the lockdown after their 2-0 win at home to Augsburg thanks for goals by Javairo Dilrosun and Krzysztof Piatek. Having routed Leverkusen 4-1 away on Tuesday, Wolfsburg crashed to a 2-1 defeat at home to 10-man Eintracht Frankfurt. Japan midfielder Daichi Kamada scored the winner 10 minutes from time while Frankfurt had replacement midfielder Lucas Torro sent off in the dying stages for a second yellow card. Frankfurt took the lead when striker Andre Silva converted a penalty on 27 minutes, but Wolfsburg equalised when right-back Kevin Mbabu headed home on 58 minutes. Hoffenheim are seventh after their 1-0 win at Mainz thanks to Ihlas Bebou who darted into the area, swept past two defenders, and fired home on 43 minutes. On Friday, Leverkusen went third when Germany midfielder Kai Havertz became the first player in Bundesliga history to score 35 goals before his 21st birthday to seal a 1-0 win at Freiburg."
15,29/05/2020,22:42,Havertz fires Leverkusen third with Freiburg winner,Exciting youngster Kai Havertz broke another Bundesliga record on Friday after scoring the winner in a 1-0 victory at Freiburg which moved Bayer Leverkusen into third place.,"Havertz, 20, became the first player in the history of the league to reach 35 goals before turning 21 years old eight minutes after the break, when he combined with Leon Bailey before squeezing home under intense pressure from Dominique Heintz. The dynamic German was already the youngest player to reach 50 and 100 appearances in the German top flight and became the youngest ever player to score a league goal for Leverkusen in 2017. Havertz's goal was his fifth in his four appearance since the Bundesliga returned from its coronavirus-enforced break and puts Leverkusen a point ahead of fourth-placed RB Leipzig, who travel to Cologne on Monday night. They are also three points ahead of Borussia Moenchengladbach in fifth ahead of their match with Union Berlin on Sunday. Havertz's goal was the first shot on target in a largely drab encounter in which Freiburg could have snatched at least a point. Lucas Hoeler missed a glaring opportunity for the hosts two minutes before the break, pushing wide when sent through one-on-one with Leverkusen stopper Lukas Hradecky. And chasing an equaliser late on, Nils Petersen forced Hradecky to save the three points for Leverkusen with a fine first time strike that the goalkeeper did well to tip away."
