,date,hour,title,subtitle,text
16,17/05/2020,21:04,Five things from the Bundesliga comeback,Bayern Munich maintained their four-point lead at the top of the Bundesliga as Germany gave fans across the world their first taste of elite football for two months amid empty stands and stringent hygiene guidelines designed to curtail the spread of the coronavirus.,"AFP looks at the five things we learned from one of oddest weekends in the game's history. The Bundesliga has a head start of at least a month on the other major leagues aiming to restart this summer, and some of strange scenes seen in Germany will become the new normal should football return to England, Italy and Spain. La Liga and Serie A are aiming for mid-June as a potential start date for their suspended seasons, and fans in both countries may have to get used to silent, empty stadiums, socially-distanced goal celebrations, footballers in face masks and the spectre of players catching COVID-19. Italy's clubs for example are debating a medical protocol that currently rules that if a player tests positive for the virus he and anyone who has come into close contact with him must be quarantined for two weeks, in contrast to Germany where only the player is isolated. How Bundesliga teams fare under their hygiene regulations could provide the model for the coming months. Heading into his team's tough trip to giant-killers Union Berlin, Bayern Munich coach Hansi Flick wondered whether his team would be able to last a full 90 minutes after only being given the go-ahead to resume full team training last week. However a dominant display in the German capital, against a team that had already beaten two different league leaders at home this season, showed why they are the strongly-tipped to win their eighth straight league title. Bayern had two thirds of possession at the Alten Foesterei stadium, and once Robert Lewandowski slotted home his 26th league goal of the season from the penalty spot five minutes before the break, the result was never in doubt as the champions went on to claim a 2-0 win. In the aftermath of Dortmund's 4-0 thumping of Ruhr rivals Schalke, teen striking sensation Erling Braut Haaland was a young man of few words with the awaiting media desperate for something from the 19-year-old goal machine. However, according to AFP subsidiary SID, Haaland mumbled a total of eight English words to reporters, including ""Why not?"" and ""Yes"". It didn't really matter, as Haaland had done his talking on the pitch, picking up where he left off before the world went into virus lockdown. The Norwegian, who turns 20 this summer, swept home the opener, the league's first goal of its restart, before laying on the first of Raphael Guerreiro's brace, showing once again that he is Europe's player to watch. He has 41 goals this season in all competitions and 13 for Dortmund in just 12 games since joining in January from Red Bull Salzburg. Specialist website DWDL.de reported on Sunday that over six million people in Germany watched the first top-tier matches in two months, with 3.68 million tuning into broadcaster Sky Germany's subscription channels on Saturday. A further 2.45 million tuned into the 'Konferenz' -- a simultaneous live broadcast of the five afternoon games -- on free-to-air Sports News Channel. Sky Germany had a market share of 27.4 percent on their pay-to-view channels and 18.2 percent on their free channel. The German Football League (DFL) told AFP that matches were televised by more than 70 broadcasters worldwide, all on previously-agreed deals. British newspaper the Daily Mail reports that UK viewers were left frustrated as the BT Sport application showing the matches buckled under the weight of demand from fans. Germany has one of the world's most vibrant football fan cultures, with raucous fans packing stadiums where entrance fees are priced at a fraction of what Premier League fans have to shell out. And while millions tuned in to watch some live football, a significant portion of match-going supporters are livid at the idea of games going ahead without the noisy backdrop provided by German fans. On Saturday Augsburg fans left a banner inside their team's ground which read ""Football gives life -- your business is sick"". St Pauli, meanwhile, on Sunday published a picture on Twitter of a banner that read: ""Football lives through its fans! Without you, it's all nothing!"""
17,16/05/2020,17:36,Leipzig title hopes hit by Freiburg draw on Bundesliga restart,"RB Leipzig were held to a 1-1 draw by Freiburg as the Bundesliga restarted following the coronavirus suspension on Saturday, suffering a further knock to their dwindling title hopes.","Julian Nagelsmann's third-placed side sit four points behind league leaders Bayern Munich ahead of the reigning champions' visit to Union Berlin on Sunday, and it would have been worse if Freiburg midfielder Robin Koch's late effort had not been ruled out by VAR. Leipzig's title dreams had started to slip away before the lockdown started, as back-to-back draws with Bayer Leverkusen and Wolfsburg in March had seen them fall five points off the pace. Players and coaches sitting on the bench wore protective masks in compliance with the stringent safety guidelines implemented to allow the Bundesliga to resume before Europe's other top leagues. The hosts started brightly at an eerily-quiet Red Bull Arena, with Timo Werner and Nordi Mukiele both going close to opening the scoring in the first half an hour. But Freiburg claimed a surprise lead 12 minutes before half-time as Vincenzo Grifo's low corner was diverted in by centre-back Manuel Gulde. Leipzig continued to dominate possession in the second period and wasted a golden chance in the 57th minute as on-loan Everton winger Ademola Lookman volleyed wide when totally unmarked just yards from goal. Freiburg had to rely on their goalkeeper the next time Leipzig carved them open, as Alexander Schwolow stretched out a leg to brilliantly deny Werner a 28th goal of the season. Leipzig gave themselves fresh hope of turning the game around in the 77th minute, though, as Yussuf Poulsen headed past Schwolow. The home side pushed for a winner, as Marcel Sabitzer and Patrik Schick joined Lookman in coming off the bench, but failed to carve out another clear-cut opportunity. Instead, it was Freiburg who thought they had snatched a dramatic injury-time victory, only for Koch's close-range finish to be ruled out for offside following a VAR review."
18,07/05/2020,14:22,Bundesliga moves restart from May 15 to following day,"The German league announced Thursday it has pushed back the planned restart of the Bundesliga from Friday, May 15, until the following day.","German Chancellor Angela Merkel has granted permission for the Bundesliga to resume behind closed doors with strict hygiene measures, plus regular testing of players and backroom staff. Christian Seifert, CEO of the German Football League (DFL), confirmed on Thursday that matches will resume on Saturday, May 16. Second-placed Borussia Dortmund host arch rivals Schalke in the Ruhr derby in the pick of the matches on the first day back. Defending champions Bayern Munich, who sit four points clear of Dortmund, will travel to face Union Berlin on the Sunday. The Bundesliga will be the first of Europe's top leagues to restart since the coronavirus pandemic forced lockdown measures across the continent. Fixtures (all times GMT) Saturday, May 16 Borussia Dortmund v Schalke 04, RB Leipzig v Freiburg, Hoffenheim v Hertha Berlin, Fortuna Duesseldorf v Paderborn, Augsburg v VfL Wolfsburg (1330), Eintracht Frankfurt v Borussia Moenchengladbach (1630) Sunday, May 17 Cologne v Mainz (1330), Union Berlin v Bayern Munich (1600) Monday, May 18 Werder Bremen v Bayer Leverkusen (1830)"
19,05/05/2020,03:15,"In 'weird' times, Freiburg's Schmid prepares for football's restart","Freiburg midfielder Jonathan Schmid said he is ""not at all"" afraid to return to the pitch but acknowledges that a second wave of coronavirus infections would put paid to German football's plans to complete its interrupted season.","""Germany wants to finish their championship,"" the 29-year-old Frenchman told AFP. ""We're training for that. We'll be ready when it resumes."" The German Football League (DFL) wants to restart matches in empty stadiums from May 16, providing it gets the final green light from Chancellor Angela Merkel's government. A decision is expected on Wednesday. Those plans were thrown into question on Monday when the league said its testing of players, coaches and backroom staff had produced 10 positive cases. Three are known to be from top-flight side Cologne. Germany has been less affected by the pandemic than other European countries, an outcome partly attributed to mass testing. Schmid said any signs that football's return had produced a new surge in infections would halt the restart plans. ""If there is a second wave and it affects some clubs, I think the season will be over,"" said Schmid. ""The clubs don't want to risk everything. But it's also important to get back on track for the economic survival of the clubs."" Despite having two children, Schmid said he was not worried about the possibility of infection. ""No, not at all afraid. If we're allowed to do it, then it's safe,"" said Schmid. ""We get tested once a week. If I am positive, I will stay away from my children and my wife. That's the advantage for us, we're being followed."" Most German clubs resumed training on April 7 but put in place stringent social distancing measures. ""At first it was weird. You arrive at the training area already changed and go straight home for a shower. We don't have a lot of time to communicate either. ""We don't shake hands, we greet each other from a distance. It feels weird. The coaches don't want us to get too close to each other. ""But the most important thing is to get back on the pitch... with the ball, doing a few exercises and a fresh environment, it was a change compared to being at home!"" The training is evolving. ""Now we are working in groups of four. Avoiding contact; no tackling."" ""Football is a contact sport. A player needs that,"" Schmid said. ""We're already happy to be back on the pitch, on the ball, and having fun with a few team-mates on the field. ""We're ready to go! We've been training more intensely than we do in the pre-season. There have been a lot of sprints, a lot of changes of direction. ""To avoid injuries that we are training harder. Maybe there will be less training and more games. As a player, I'd rather play lots as they do in England than train for five days!"" If the Bundesliga resumes it will be behind closed doors, with players' voices echoing around empty stadiums. It is not the way Schmid wanted to try to lead his club into a place in European competition next season. ""I've never played behind closed doors. There'll be something missing. With the stadium and the fans behind us, it's tough for away teams to win at Freiburg. It's always a plus,"" said Schmid, who came up through the club's youth system. ""You have to be prepared for that and keep giving it your all."" There has been talk of Bundesliga players wearing masks on the field. ""Walking around with a mask is uncomfortable. I wear one when we go shopping. It's not comfortable to breathe. So playing football...,"" he said, ending with a laugh. Like their Bundesliga counterparts at other clubs, Freiburg players have taken a pay cut. ""The club asked us to lower our salaries to help groundstaff and office workers. We agreed. It was a good thing to do it compared to everything they do for us. ""We wanted to give back something that would allow them to continue to live, because they also have families and rent to pay. It's harder for them than it is for us. A little gesture does good."""
20,02/03/2020,12:30,African players in Europe: Sarr sparkles as Watford stun Liverpool,Ismaila Sarr overshadowed fellow Senegalese Sadio Mane by scoring twice as lowly Watford won 3-0 to end the 44-match unbeaten Premier League streak of runaway leaders Liverpool.,"Mane has been among the key figures as the Reds march toward a first league title in three decades, but he had to take a back seat at Vicarage Road as Sarr blossomed. His pace and trickery unsettled Liverpool and he was rewarded with two goals before setting up Troy Deeney for the third. ISMAILA SARR (Watford) The Hornets' record signing was up against his idol Mane and stabbed home the opener at the near post and then showed his pace and poise to chip Alisson Becker for Watford's second. Sarr then turned provider for the third as he teed up Deeney to complete a famous win that lifted Watford out of the bottom three. JORDAN AYEW (Crystal Palace) Ayew scored the only goal as Palace got the better of rivals Brighton to ease any fear of being dragged into a relegation battle. The Ghanaian's strike took his league tally for the season to seven -- matching his best tally for a single campaign in England. MBWANA SAMATTA (Aston Villa) Samatta did Tanzania proud by scoring in the League Cup final against Manchester City, but his diving header at the near post just before half-time was merely a consolation for Villa as City won 2-1 to lift the trophy for a third straight season. YOUSSEF EN-NESYRI (Sevilla) En-Nesyri scored a 93rd-minute winner as Sevilla beat Osasuna 3-2 to move up to third in La Liga. The Moroccan striker, who joined Sevilla from Leganes in January, opened the scoring with a guided shot into the corner before Lucas Ocampos made it two on the stroke of half-time. Osasuna came back in the second half through goals from Aridane and Roberto Torres, only for En-Nesyri to snatch victory for Sevilla in injury-time with a close-range finish. RAMY BENSEBAINI (Borussia Moenchengladbach) Algerian Bensebaini scored a crucial early goal for Moenchengladbach as they beat Augsburg 3-2 to keep pace with the top of the Bundesliga table. Bensebaini, in his first start in 2020 after returning from injury, headed home a cross from Lars Stindl to put the visitors 1-0 up. When asked how it felt to be back in the Foals' line-up after the match, he simply replied ""it was fun"". ACHRAF HAKIMI (Borussia Dortmund) Having made his name as one of Dortmund's best going forward this season, the Real Madrid loanee was called on to do more than his fair share of defending against a stubborn Freiburg side. Working on the edge of a four-man midfield, Hakimi's pace was valuable during the 1-0 win as he snuffed out several Freiburg counter attacks. He did have a shot on goal deflected in the dying stages but was unable to add to his tally of two Bundesliga goals this season. STEPHANE BAHOKEN (Angers) The Cameroon striker was rewarded with a start for his team at Brest after coming off the bench against Montpellier last weekend and scoring the winner a minute later. He delivered again in Brest, although he needed a full 43 minutes to bag the only goal of the match this time. MAX-ALAIN GRADEL (Toulouse) Ivory Coast winger Gradel, 32, returned to the Toulouse starting line-up last weekend for the first time in a Ligue 1 game since early December following injury. He kept his place and wore the captain's armband but could not prevent the division's bottom side from going down 2-0 at home to Rennes. They have now taken just a single point from their last 17 league games and are heading fast towards relegation. KARL TOKO-EKAMBI (Lyon) Cameroon forward Toko-Ekambi, who joined Lyon on loan from Villarreal in January, came off the bench and contributed to their 2-0 win over derby rivals Saint-Etienne. Having earlier had a goal disallowed for offside, he won the late penalty which Moussa Dembele scored to seal the victory. Toko-Ekambi had started the 1-0 Champions League last-16, first leg win over Juventus in midweek and hit the bar in the first half against the Italians."
21,02/03/2020,12:30,African players in Europe: Sarr sparkles as Watford stun Liverpool,Ismaila Sarr overshadowed fellow Senegalese Sadio Mane by scoring twice as lowly Watford won 3-0 to end the 44-match unbeaten Premier League streak of runaway leaders Liverpool.,"Mane has been among the key figures as the Reds march toward a first league title in three decades, but he had to take a back seat at Vicarage Road as Sarr blossomed. His pace and trickery unsettled Liverpool and he was rewarded with two goals before setting up Troy Deeney for the third. ISMAILA SARR (Watford) The Hornets' record signing was up against his idol Mane and stabbed home the opener at the near post and then showed his pace and poise to chip Alisson Becker for Watford's second. Sarr then turned provider for the third as he teed up Deeney to complete a famous win that lifted Watford out of the bottom three. JORDAN AYEW (Crystal Palace) Ayew scored the only goal as Palace got the better of rivals Brighton to ease any fear of being dragged into a relegation battle. The Ghanaian's strike took his league tally for the season to seven -- matching his best tally for a single campaign in England. MBWANA SAMATTA (Aston Villa) Samatta did Tanzania proud by scoring in the League Cup final against Manchester City, but his diving header at the near post just before half-time was merely a consolation for Villa as City won 2-1 to lift the trophy for a third straight season. YOUSSEF EN-NESYRI (Sevilla) En-Nesyri scored a 93rd-minute winner as Sevilla beat Osasuna 3-2 to move up to third in La Liga. The Moroccan striker, who joined Sevilla from Leganes in January, opened the scoring with a guided shot into the corner before Lucas Ocampos made it two on the stroke of half-time. Osasuna came back in the second half through goals from Aridane and Roberto Torres, only for En-Nesyri to snatch victory for Sevilla in injury-time with a close-range finish. RAMY BENSEBAINI (Borussia Moenchengladbach) Algerian Bensebaini scored a crucial early goal for Moenchengladbach as they beat Augsburg 3-2 to keep pace with the top of the Bundesliga table. Bensebaini, in his first start in 2020 after returning from injury, headed home a cross from Lars Stindl to put the visitors 1-0 up. When asked how it felt to be back in the Foals' line-up after the match, he simply replied ""it was fun"". ACHRAF HAKIMI (Borussia Dortmund) Having made his name as one of Dortmund's best going forward this season, the Real Madrid loanee was called on to do more than his fair share of defending against a stubborn Freiburg side. Working on the edge of a four-man midfield, Hakimi's pace was valuable during the 1-0 win as he snuffed out several Freiburg counter attacks. He did have a shot on goal deflected in the dying stages but was unable to add to his tally of two Bundesliga goals this season. STEPHANE BAHOKEN (Angers) The Cameroon striker was rewarded with a start for his team at Brest after coming off the bench against Montpellier last weekend and scoring the winner a minute later. He delivered again in Brest, although he needed a full 43 minutes to bag the only goal of the match this time. MAX-ALAIN GRADEL (Toulouse) Ivory Coast winger Gradel, 32, returned to the Toulouse starting line-up last weekend for the first time in a Ligue 1 game since early December following injury. He kept his place and wore the captain's armband but could not prevent the division's bottom side from going down 2-0 at home to Rennes. They have now taken just a single point from their last 17 league games and are heading fast towards relegation. KARL TOKO-EKAMBI (Lyon) Cameroon forward Toko-Ekambi, who joined Lyon on loan from Villarreal in January, came off the bench and contributed to their 2-0 win over derby rivals Saint-Etienne. Having earlier had a goal disallowed for offside, he won the late penalty which Moussa Dembele scored to seal the victory. Toko-Ekambi had started the 1-0 Champions League last-16, first leg win over Juventus in midweek and hit the bar in the first half against the Italians."
22,09/03/2019,20:39,'Perfect day' as Bayern return to Bundesliga summit with Liverpool looming,"Bayern Munich warmed up for Liverpool with a ""perfect day"" by knocking Borussia Dortmund from the top of the Bundesliga for the first time since September with a 6-0 thrashing of Wolfsburg on Saturday.","Bayern, who host Liverpool on Wednesday in their Champions League, last 16, return leg clash after a goalless draw at Anfield, went top on goal difference from Dortmund, who needed late goals to win 3-1 at home to Stuttgart. ""I'm very pleased. We want to be just as focused on Wednesday,"" said Bayern head coach Niko Kovac. Bayern ran riot in Munich as Robert Lewandowski scored twice, leaving him with 20 goals in 17 league games against Wolfsburg, while Serge Gnabry, James Rodriguez and Joshua Kimmich also netted. ""We are now where we want to be -- first in the table and that's where we want to stay,"" added Kovac with nine rounds of league games left. Having been told on Tuesday, along with Bayern team-mates Jerome Boateng and Mats Hummels, that his Germany career is over, Mueller took out his frustration, setting up the first goal and scoring Munich's second. ""The three wanted to give a response and they all played well -- it was a perfect afternoon,"" said goal-scorer Kimmich. Gnabry gave Bayern the lead on 34 minutes at the Allianz Arena by tapping home Mueller's cross, then turned provider three minutes later when he served up a simple tap in for Lewandowski to make it 2-0. Rodriguez, thriving in the attacking midfield role, got on the scoresheet when his superb 52nd-minute shot hit the top corner. Having set up the first goal, Mueller showed Germany head coach Joachim Loew what he is missing by wrong-footing Wolfsburg goalkeeper Koen Casteels to score with his heel on 76 minutes. Kimmich scored with a header on 82 minutes and Lewandowski claimed his second by guiding his header into the far corner three minutes later. Lewandowski, the top-scoring foreigner in Bundesliga history with 197 goals, has now scored in each of his last seven games against Wolfsburg, who he single-handedly battered in 2015 with five goals in just nine minutes. In Dortmund, late goals by Paco Alcacer and Chelsea-bound Christian Pulisic saw off dogged Stuttgart, but Borussia are now second after 23 weeks on top. ""I don't care about who is top now,"" said Dortmund captain Marco Reus. ""It only matters who is top at the end and everything is still open."" The win, only Dortmund's second in their last nine games, was vital to stay level on 57 points with Bayern. Despite some dogged Stuttgart defending, Dortmund took the lead at Signal Iduna Park when Reus netted a penalty on 62 minutes. The lead lasted just nine minutes as Stuttgart's Marc-Oliver Kempf headed home unmarked. However, Alcacer calmed nerves when the Spanish striker stabbed home on 84 minutes after a goal-mouth scramble. The third goal came when Axel Witsel beat three defenders, played Mario Goetze into the box to set up Pulisic, who netted in stoppage time. ""They parked a gigantic bus (in front of goal) -- it was hard to find the holes,"" complained Dortmund coach Lucien Favre. ""We tried everything and managed it, we ran a lot and defended a lot, but all in all, the win was deserved."" Third-placed RB Leipzig were held to a goalless draw at home by Augsburg, who beat Dortmund last Friday and went down fighting against Bayern last month. Mid-table Hertha Berlin crashed to a 2-1 defeat at Freiburg after the visitors captain Vedad Ibisevic cancelled out a Nils Petersen goal, but then scored an own-goal by turning the ball into the Berlin net. Later, Borussia Moenchengladbach bounced back from last weekend's 5-1 thumping at home to Bayern with a 1-0 win at mid-table Mainz, thanks to a second-half goal from defender Nico Elvedi. Gladbach stay fourth, level on 47 points with Leipzig, and both clubs lag nine points behind new leaders Bayern and Dortmund."
