,date,hour,title,subtitle,text
44,17/05/2019,02:15,Valencia seek perfect end to remarkable recovery in La Liga,Valencia lost to Arsenal in the Europa League semi-finals but hold pole position for La Liga's last Champions League spot as the race for the top four reaches its climax on Saturday.,"Pierre-Emerick Aubameyang's hat-trick ended Valencia's hopes of qualifying by lifting a trophy and their chances looked slim in the league too, when they trailed Getafe by three points ahead of the penultimate weekend. But a 3-1 win over Alaves, combined with Getafe losing away to a wounded Barcelona, means it is Valencia with their fate in their own hands, as they prepare to face Real Valladolid at Jose Zorrilla. A superior head-to-head over Getafe means they need only match the result of Jose Bordelas' side, who host a Villarreal team sitting 14th and with little left to play for. Yet Valladolid's position appears in Valencia's favour too. Victory away at Rayo Vallecano last weekend means their safety is already secured. Win, and Valencia will be guaranteed Champions League football in consecutive seasons for the first time in seven years, a feat that not too long ago seemed almost unthinkable. After five games, they were 15th and still to win. After 10, they were 14th, having won once and scored seven goals. After 15 games, they had won three but were back in 15th, ground to a halt by nine draws. When Marcelino was appointed in 2017, he was the club's 12th coach in five years and only one of them -- Nuno Espirito Santo -- had overseen enough matches to make even one full league season. Most waited for the trigger to click but Marcelino stayed and after 10 draws in 13 games, they won, coming from behind in the Copa del Rey to beat Segunda B side Ebro, who had a man sent off after 29 minutes. ""There was this click,"" said striker Kevin Gameiro in an interview with AFP this month. ""And there was also a bit of luck."" Defeats by Girona, Juventus and Real Madrid tempered hopes of a recovery but in between came three victories in a row and after, five games unbeaten, including a Champions League win over Manchester United. Eighth in the table at the start of the year, Valencia then surged through March and April, 10 wins thrusting them within sight of the top four. ""The word surrender does not exist in my vocabulary,"" said Marcelino. They stumbled again, twice, defeated last month by Atletico Madrid and Eibar, the resurgence almost evaporating in the space of four days. But their rivals wobbled too as Getafe lost their nerve and Sevilla faded, the bounce from bringing in Joaquin Caparros to replace Pablo Machin proving short-lived. Sevilla's decision to act has them lying sixth, needing to win at home to in-form Athletic Bilbao on Saturday and needing both Valencia and Getafe to lose. Valencia's decision to persevere may be about to pay off, a top-four finish the perfect boost ahead of the Copa del Rey final on May 25 against Barcelona, who will be without Luis Suarez and perhaps goalkeeper Marc-Andre ter Stegen. ""The spirit of the team has merged with the spirit of Valencia, which is always: never give up,"" said striker Rodrigo earlier this month. For Getafe, the Europa League would be a disappointment, even for a team who were promoted to the top flight only two years ago and whose annual wage bill is more than ten times less than Real Madrid, the club they hope to finish one place behind. ""Everything can still happen,"" said Bordalas. Getafe have a chance, which is perhaps more than can be said for Girona, whose players and coach Eusebio Sacristan conceded their loss at home to Levante last weekend had been decisive in the fight against relegation. ""All that's left is to say sorry,"" said an emotional Eusebio afterwards. ""I was convinced I could do it but I failed."" They are 18th, needing to make up three points and a six-goal deficit in goal difference to overtake Celta Vigo on the final day. Celta have the added advantage of hosting already-relegated Rayo Vallecano while Girona play at Alaves. Barcelona's title-winning campaign will end away at Eibar on Sunday just as Real Madrid's miserable season finishes at home to Real Betis."
45,08/05/2019,02:25,"Arsenal lean on Lacazette, Aubameyang to save their season",Arsenal's collapse at the business end of the Premier League season means the success or failure of Unai Emery's first campaign now solely depends on lifting the Europa League and as a result sealing Champions League football.,"The Gunners travel to Emery's old club Valencia on Thursday defending a 3-1 semi-final, first leg lead given to them by star strikers Alexandre Lacazette and Pierre-Emerick Aubameyang at the Emirates last week. Arsenal's awful record on the road this season will give the Spanish side plenty of encouragement that they can overturn a two-goal deficit. Emery's men conceded three times in losing at Wolves and Leicester in their last two away league games and were also defeated at BATE Borisov and Rennes before turning Europa League ties around at the Emirates. Attack may therefore be the visitors' best form of defence in the cauldron of the Mestalla and Arsenal are at least getting what they paid for from Lacazette and Aubameyang. ""We played against two strikers that are very good which is why they cost the millions that they did,"" said Valencia coach Marcelino Garcia Toral. ""With the slightest error they punish you."" Arsenal have taken one point from their last four Premier League games to realistically end their chances of a top-four finish and the first leg against Valencia could easily have gone the same way as Marcelino's men scored an early away goal and led the Gunners to a merry dance for the first 20 minutes. However, one moment of magic turned the tie as Lacazette played in Aubameyang, who paused, left Neto, Ezequiel Garay and Facundo Roncaglia on the floor before squaring for his strike partner to roll into an empty net. Lacazette added his second eight minutes later and Aubameyang's late strike gave Arsenal the two-goal cushion they may well need. The Londoners' first season without Arsene Wenger for 22 years has been dogged by many of the same defensive problems suffered by the Frenchman towards the end of his reign. But Wenger's final two big signings have come good as club record fees were paid for Lacazette in the summer of 2017 and Aubameyang in January 2018. After a difficult first six months in England, many thought Aubameyang's arrival was ominous for Lacazette's longevity at the club, but the two have formed a fine partnership on and off the field. Only Liverpool's Mohamed Salah has scored more Premier League goals than Aubameyang's 20, but it is Lacazette who won the club's player of the year prize for his all round contribution with 18 goals and 12 assists. Those figures are all the more impressive as they have often had to battle for just one starting spot. Both players have voiced their displeasure at Emery's reluctance throughout the campaign to play with two strikers. ""You know that I like to play with two strikers but I don't want to say it,"" admitted Aubameyang, while Lacazette conceded to French television station RMC he ""could be even happier"" if he started more regularly. ""Every player wants to play each match for 90 minutes, but as a manager I need to use the player in the best moment,"" said Emery in defence of his decisions throughout the season. ""Sometimes our performances are better with both, but sometimes our big performances are better with only one, and after they make an impact replacing another striker."" Given the problems Emery is trying to patch up at the other end, the Gunners are likely to need the firepower of both to ensure they make it to Baku to try and save their season next month."
46,02/05/2019,22:58,Arsenal strike late to edge towards Europa League final,"Arsenal took a huge step towards the Europa League final as a double from Alexandre Lacazette and Pierre-Emerick Aubameyang's late strike earned a 3-1 semi-final, first leg win over Valencia on Thursday.","The Spanish side's bright start was rewarded with Mouctar Diakhaby's away goal, but Lacazette quickly turned the game around with two goals in eight minutes before Aubameyang's late intervention gave the Gunners a two-goal advantage to defend at the Mestalla on May 9. Arsenal boss Unai Emery is a Europa League specialist having won the competition three times when in charge at Sevilla. And the Spaniard's decision to start Lacazette and Aubameyang together against his former side was richly rewarded despite a terrible start from the hosts. Arsenal are desperate not just for silverware in Emery's first season but the guarantee of Champions League qualification for next season that winning the Europa League would bring. A run of three straight Premier League defeats has left Emery's men needing more favours from Chelsea or Tottenham to stand any chance of a top-four Premier League finish. The Gunners had conceded three times in all three of those defeats to Crystal Palace, Wolves and Leicester and the same defensive deficiencies cost them again early on. Valencia had already missed a glorious chance to take the lead when Ezequiel Garay somehow turned Rodrigo's driven cross over the bar from point-blank range. However, the hosts did not learn their lesson and from another set-piece, Valencia took the lead when Diakhaby got the final touch at the back post to force home Rodrigo's header across goal. Emery has been reticent to start Lacazette and Aubameyang together up front, but the game turned on one moment of magic from Arsenal's two prolific strikers. Lacazette played in Aubameyang and the Gabon international left his marker and Valencia goalkeeper Neto on the ground before squaring for his strike partner to roll into an empty net. Seven minutes later, Arsenal led as terrible defending allowed Lacazette a free header from Granit Xhaka's cross and a weak hand from Neto could not prevent the ball crossing the line. The chances continued to come for Arsenal's front two as Aubameyang volleyed into the ground and over just before the break. Lacazette then had two glorious opportunities to complete his hat-trick as he firstly failed to connect with an inch-perfect Aubameyang cross before Neto made a brilliant save at his near post to keep the Spanish side in the tie. At the other end Petr Cech also had to make a smart stop as he raced from his goal to deny substitute Kevin Gameiro. The veteran stopper has announced he will retire at the end of the season. And Cech's final game could well be against his former club Chelsea in next month's final as the Blues secured a 1-1 draw away at Eintracht Frankfurt in the first leg of the other semi-final. Arsenal still have work to do with their terrible away record this season likely to give Valencia plenty of encouragement. However, they moved much closer to booking their place in Baku when Aubameyang turned home at the back post in the final minute."
47,02/05/2019,03:00,Gameiro to torment Arsenal in Emery reunion,Kevin Gameiro has knocked Arsenal out of one Europa League semi-final and now he wants to do it again.,"Gameiro helped Atletico Madrid end Arsene Wenger's hopes of a glorious finale last season, a 2-1 aggregate win sending them through to the final, where they would sail past Marseille. Twelve months on, it is Unai Emery in charge of Arsenal and Gameiro leading the line for Valencia who, like their opponents, may well need to win the Europa League to play in the Champions League next term. ""It's going to be a different game to last year, they have a new coach and he has brought his own style to the Arsenal team,"" Gameiro told AFP Sport. ""We will have to be aware of all their strengths and weaknesses because they play a fast game, they control the ball and have players who can break quickly. It will need us to give everything to win."" If Gameiro knows Arsenal, he knows Emery too, having played under the Spaniard at Sevilla, where together they won the Europa League three times on the bounce in 2014, 2015 and 2016. In the first final, Gameiro owned the decisive touch, his winning penalty in the shoot-out giving Sevilla victory over Benfica. In the third, he scored again, a tap-in turning the tide against Liverpool in a 3-1 win in Basel. ""We haven't kept in touch but I saw Unai again when Atletico played a friendly against Arsenal in Singapore and it will nice to see him again,"" Gameiro said. ""He is a great motivator. In these big games and big moments, he knows how to get the best out of his players. He has won this competition three times, he knows how it works. But we both want to be in this final."" This season, Gameiro has scored six goals since the turn of the year after managing only two before it, a trajectory similar to his team, who have recovered well from a painfully slow start. After 12 games, Valencia had managed only two La Liga victories and sat 15th in the table but a second-half surge has seen them move to within three points of the top four. ""It was a complicated start to the season with a lot of draws but after Christmas there was this click,"" Gameiro said. ""We had a bit of luck and suddenly started to believe we could win matches again. We just needed our confidence back because we have a very talented squad."" Marcelino, appointed in May 2017, came under pressure but Valencia held their nerve. ""He continued in the same way and stayed loyal to his beliefs,"" Gameiro said. ""There were a lot of late signings last summer and they maybe needed a bit of time to acclimatise to the club and the coach. I think I was the same, I needed slightly longer to adapt than I expected. ""I questioned myself and realised I needed to change to succeed here. You'd rather start slowly and finish fast than the other way round."" With a Copa del Rey final against Barcelona still to come next month, Valencia are fighting on three fronts for what could be a spectacular end to the season. But if overcoming Sevilla and Getafe to take fourth seems unlikely, breaking Barca's four-year hold on the Copa del Rey seems an even more formidable task. Beating Arsenal, and then either Chelsea or Frankfurt in the final, seems Valencia's best hopee. ""There will be a lot of pressure and it is good for us to play the first game in London,"" Gameiro said. ""We know they are strong at home but if we can manage the difficult moments, we can capitalise in the second leg."""
48,01/05/2019,02:25,Emery turns to Europa League once more to salvage Arsenal's season,Unai Emery's first season in charge at Arsenal is in danger of imploding unless the Spaniard can again prove himself to be a Europa League specialist and cover up an alarming dip in the Gunners' Premier League form.,"Arsenal have lost four of their past five league games to Everton, Crystal Palace, Wolverhampton Wanderers and Leicester City to slip down to fifth and relying on more favours from Chelsea or Tottenham to have any chance of a top-four finish. However, winning the Europa League would also offer a much-needed return to the Champions League next season after a two-year absence. For 20 years under Arsene Wenger, Arsenal enjoyed the riches and the glamour of the Champions League and the impact of missing out has had serious implications on the budget Emery has had to work with. In January, he revealed the club could not afford to make any permanent signings. Emery is a specialist in Europe's second-tier competition, winning it three times when at Sevilla, and he is also well acquainted with Arsenal's semi-final opponents, Valencia, who he managed between 2008 and 2012. Emery also did a stellar job at the Mestalla, leading Valencia to three consecutive third-placed finishes behind dominant Barcelona and Real Madrid sides managed by Pep Guardiola and Jose Mourinho. ""Emery was inducted into the Valencia hall of fame as one of the managers to have spent most time at Valencia, qualifying the team for the Champions League and performing well in it,"" Valencia-based journalist Luis Cortes told AFP. However, doubts remain over his ability to lead Arsenal's rebuild back to the heights they once enjoyed under Wenger. The same defensive issues that haunted the Frenchman's final years in charge have been in evidence in recent weeks, conceding three times in three consecutive league defeats for the first time since 1967. Emery has constantly changed personnel and formations, but is yet to find the right balance with one of his two star forwards Alexandre Lacazette and Pierre-Emerick Aubameyang often left out. Yet, there have been notable successes. Top-four rivals Tottenham, Chelsea and Manchester United were all beaten at the Emirates this season and Emery's men won home and away to Napoli in the Europa League quarter-finals. Arsenal go into the final two games of the league season just two points off the top four, compared to languishing 12 points behind in Wenger's final season. ""At the beginning of the season we knew it was going to be very difficult (to finish in the top four),"" said Emery after the weekend's chastening 3-0 defeat at Leicester. ""We will continue, we will not look at the table, the Europa League is a big motivation for us."" Valencia find themselves in a similar situation to Arsenal in looking at the Europa League to save a disappointing domestic season. A shock 1-0 home defeat to Eibar on Saturday leaves Los Che sixth in La Liga and three points outside the top four with three games left. Former Arsenal defender Gabriel Paulista will return to the Emirates on Thursday and wants to mark Valencia's centenary year in style. ""I want to be in the history of Valencia,"" said the Brazilian. ""It is the year of the centenary and in 100 years' time I want people to remember that Gabriel Paulists won the Europa League with Valencia,"" he told the club's website."
49,24/04/2019,21:33,Atletico edge five-goal thriller with Valencia to delay Barca celebrations,Atletico Madrid delayed Barcelona winning La Liga by a few days at least after Alvaro Morata and Antoine Griezmann each scored in a 3-2 victory over Valencia on Wednesday.,"Defeat at the Wanda Metropolitano would have crowned Barca kings of Spain for a 26th time in their history, with the Catalans now set to celebrate at their own Camp Nou on Saturday instead. A Barcelona win there over Levante will wrap up their fourth league triumph in five years and they could even be home and dry before kick-off, if Atletico fail to take a point at home to struggling Real Valladolid earlier in the day. Regardless, success for Ernesto Valverde's side is surely now only a matter of timing given Atletico remain nine points behind the leaders with four games left to play. Real Madrid, who visit Getafe on Thursday, are 16 adrift. If Getafe win, they will also move five points ahead of Valencia, whose chances of snatching fourth place and Champions League qualification would now appear remote. But there will be some satisfaction at least for Atletico in making Barcelona win it on their own terms while also avoiding the embarrassment of conceding the title with a loss in front of their home fans. Angel Correa's stunning strike in the 81st minute proved the winner after Valencia had fought back, Kevin Gameiro and a Dani Parejo penalty twice pulling them level after goals from Morata and Griezmann. Morata's early strike continued his excellent form since his move to Atletico in January, his finish at the back post taking his tally to six goals in 13 games for the club. Griezmann, meanwhile, back from suspension, now has 25 goals in all competitions this season, an impressive return, particularly in a side not renowned for its creativity. Atletico were ahead inside 10 minutes as Juanfran's cross met the outstretched foot of Morata at the back post. It was no less than they deserved for an aggressive opening but Valencia grew into the half and equalised shortly before half-time. Francis Coquelin's crossfield pass picked out Carlos Soler, who cushioned inside to Santi Mina. Mina flicked the ball brilliantly between Diego Godin and Stefan Savic before squaring to Gameiro, who had time to pick his spot. Atletico regrouped during the interval and were back in front four minutes after, Griezmann jumping ahead of Jose Gaya to nod in Thomas Lemar's cross. But Valencia came again and a chaotic contest took another twist when Gameiro's shot was shown by VAR to have been blocked by the arm of Saul Niguez. Parejo powered into the corner. The game was in the balance as Griezmann glanced a header wide before Correa, on as a substitute, provided the winning touch. Thomas Partey played into his feet but Correa did the rest, turning, twisting and then bending the ball inside Neto's left-hand post. Barca will have to wait."
50,04/04/2019,00:08,'It hurts': Valencia inflict first defeat on Zidane's new Madrid,Zinedine Zidane dropped Gareth Bale and endured his first defeat since returning to Real Madrid as his side were deservedly beaten 2-1 by a resurgent Valencia on Wednesday.,"The last time Zidane left Bale on the bench, the Welshman proved a spectacular substitute against Liverpool in the Champions League final 10 months ago but there was to be no rescue act at Mestalla. Instead, Valencia surged to a convincing victory, Goncalo Guedes and Ezequiel Garay scoring in each half to leave Marcelino's team within a point of La Liga's top four. Karim Benzema headed in a late consolation in injury-time. ""We lacked a bit of spark up front,"" Zidane said. ""I am not going to criticise my players. They have tried and we played a good team. But losing always hurts."" After a miserable start to the season, Valencia could yet enjoy a barnstorming finish. Champions League qualification is now within touching distance while a Copa del Rey final against Barcelona and Europa League last 16 tie against Villarreal still await. ""The game played out how we hoped,"" said Marcelino. ""It was a complete performance."" For Zidane, after two opening victories, this was perhaps something of a reality check, even if Madrid's reappointed coach has insisted he is under no illusions regarding the task ahead. They now trail leaders Barcelona by 13 points, the exact same margin they were behind the Catalans under Zidane at this stage last season. This was reminiscent too of the limp displays that have undone Madrid in recent months, blunt in the final third, overly-generous in defence and bereft of either snap or spark in midfield. Bale had started each of Zidane's first two games, offering hope there might yet be a future for him in the new era, but his relegation to the bench suggests the Frenchman's old doubts may linger. Zidane's press conference on Tuesday had been littered with questions about players' futures but Raphael Varane and Marcelo both started in defence, as did Keylor Navas, restored in goal ahead of Zidane's son Luca and the injured Thibaut Courtois. Valencia were far superior in the first half and the only surprise was that it took 35 minutes for them to score. Navas punched a corner to the edge of the box where Guedes bounced the ball off Carlos Soler, stopped it and curled between the goalkeeper's right hand and the near post. Valencia unleashed a series of efforts in search of a second. Kevin Gameiro headed wide, Geoffrey Kondogbia half-volleyed over and Rodrigo's bending shot whistled inches past the post. Madrid had barely featured as Bale came on for Marco Asensio in the 64th minute, along with Isco, who replaced the quiet Toni Kroos. Bale might have had an equaliser shortly after had it not been for Dani Parejo's sliding block and then the he sent a sumptous pass to the far post, but it was cleared away from the waiting Benzema. Valencia should have wrapped it up with 15 minutes left as five sprawled forward on the break but Rodrigo miscontrolled while his cutback was flicked by Soler, harmlessly into the hands of Navas. If Madrid were more threatening they might have capitalised but there was no counter and instead victory was secured when Garay headed in Parejo's cross with seven minutes left. Sergio Ramos had a late penalty taken off him, ruled out by VAR, before Benzema nodded in a consolation in added time. It was too little too late."
51,31/03/2019,18:23,Valencia stay in Champions League hunt,Valencia maintained their hopes of a place in next season's Champions League after Daniel Parejo's penalty on the stroke of half-time gave them a vital 1-0 victory at Sevilla on Sunday.,"Parejo's spot-kick, which came after Ever Banega brought down Jose Gaya, extended Valencia's unbeaten run to nine matches and moves them up to sixth, level on 43 points with Sevilla and just three back from the final Champions League spot. That place is occupied by Getafe, who fell 2-0 at home to mid-table Leganes on Saturday and have to play the league's top three -- leaders Barcelona, Atletico Madrid and Real Madrid -- and Sevilla in their final nine games. Despite a slightly simpler league fixture list Marcelino's Valencia however have an all-Spanish Europa League quarter-final tie with Villarreal to contend with, as well as the Copa Del Rey final against Barcelona between now and the end of the season. Both teams are way behind Real Madrid, who are third and host bottom club Huesca later on Sunday hoping to keep the pressure on neighbours Atletico Madrid in the fight for second after Diego Simeone's side hammered fifth-placed Alaves 4-0 on Saturday. Barcelona are 10 points clear of Atleti and heavy favourites to retain their La Liga after Lionel Messi fired them to their sixth league win on the bounce, 2-0 at home to local rivals Espanyol."
