,date,hour,title,subtitle,text
134,03/12/2015,17:42,"I have got to prove myself, admits Neville",Gary Neville on Thursday said he could not turn down the opportunity to strike out on his own in coaching with La Liga club Valencia but said any doubts about his appointment would be understandable.,"The Manchester United legend has been working as part of Roy Hodgson's backroom staff with the England national team but the 40-year-old has now agreed to take over at the Mestalla until the end of the season, giving up his work as a leading and often outspoken pundit for British broadcaster Sky. ""If I'd turned down this job I could have said goodbye to my credibility,"" Neville told a press conference on Thursday, a day after his appointment was announced by Valencia, who lie ninth in La Liga. Neville admitted that, in his role as a pundit in England, he would have been surprised to see a leading club appoint a foreign coach with no experience of managing at the top level. ""I would be sceptical and want to be proven otherwise. I want to show to the players I am capable of doing this job,"" said Neville, who succeeds Nuno Espirito Santo, the Portuguese who was dismissed after a 1-0 defeat at Sevilla on Sunday. ""The doubts and concerns will only be wiped out by winning football matches. I won't shy away from the direct approach I had on television. ""I have got to prove myself, turn the doubters. I have to provide the answers on football pitch in coming months."" Neville will be assisted by his younger brother Phil and former Valencia player Miguel Angel Angulo and will rely on them for help with the language. ""My biggest challenge will be learning Spanish. I'll need help in that regard. I have to pick up some key phrases as early as possible and learn as quickly as possible,"" he said. Neville said that he sees no reason why he cannot combine the job with his commitments as part of the England coaching staff going into Euro 2016, with friendly matches against Germany and the Netherlands to come in March. ""In terms of the FA, when I spoke to Roy he was incredibly supportive and positive and enthusiastic for me,"" he said. ""He understood completely the opportunity for myself. He was behind me 100 percent. ""We have two games in March in the international break and I want to complete the job through to the European Championship. ""Valencia will be my priority for 95 to 99 percent of the time, apart from those games in March."" The 85-times capped Neville enjoyed a glittering playing career at United under Alex Ferguson and he admitted he had discussed the move with his former mentor. ""I didn't consult Sir Alex but I did speak to him. He offered words of encouragement and support. I would be stupid not to accept that support."" Valencia play Barcelona at home on Saturday but Neville will not take charge of the team until after that match, explaining that he wanted the team's preparations for facing the European champions to be ""consistent"" throughout the week. His first game at the helm will be a crucial Champions League match against Lyon next midweek."
135,02/12/2015,13:20,Gary Neville named Valencia coach,"England coach and Manchester United legend Gary Neville has been named Valencia boss for the rest of the season, the Spanish side announced on Wednesday.","""Valencia have reached an agreement with English coach Gary Neville for him to be coach of the first team until June 30, 2016,"" the club said in a statement. ""Neville will officially begin his work on Sunday, December 6 ahead of the Champions League match against Lyon which will take place at Mestalla on Wednesday, December 9."" Neville's brother Phil has been at the club since the start of the season, working as an assistant to Nuno Espirito Santo before he left the club after a poor run of results on Sunday. ""I am very excited and feel very proud to have received this great opportunity with Valencia,"" Neville told the club's website. ""It is a huge club of immense prestige and I remember well from my time as a player the great passion and loyalty of their fans."""
136,30/11/2015,19:17,Valencia confirm boss Nuno departure,Valencia confirmed on Monday that Portuguese coach Nuno Espirito Santo has left the La Liga club.,"Nuno had already said on Sunday night following a 1-0 defeat to Sevilla that he was resigning. ""Nuno Espirito Santo, who until now was the coach, is no longer tied to Valencia, after coming to an amicable agreement with the institution,"" said a statement on Valencia's website. Former player Salvador Gonzalez will take charge of the team, assisted by Nuno's assistant, the former Manchester United player Phil Neville, until a permanent appointment is made. Having qualified the team for this season's Champions League, the Portuguese coach leaves with Valencia down in ninth in the table having lost eight of 20 matches this season in all competitions. They also need to beat Lyon in their final Champions League group game to have any chance of reaching the knock-out stages. They host leaders and champions Barcelona this coming weekend in La Liga. Spanish press have touted a number of names as possible replacements including former Argentina coach Alejandro Sabella, former Barca boss Frank Rijkaard, Dane Michael Laudrup and even former Real Madrid, Chelsea and AC Milan coach Carlo Ancelotti."
137,24/11/2015,20:07,Zenit beat Valencia to maintain perfect record,Russian champions Zenit St Petersburg extended their winning streak in the Champions League to five games with a 2-0 win over Spanish high-flyers Valencia on Tuesday.,"Goals by Oleg Shatov and Artem Dzyuba ensured the Saint Petersburg outfit, who had already qualified for the knock-out rounds, will top Group H. Zenit, who had won their opening group match 3-2 in Valencia, sat back from the kick-off, giving up possession and threatening on the counter-attack. In the 15th minute, Dzyuba received Hulk's pass from the left and helped the ball on to Shatov, who escaped the offside trap before shooting home from close range. Valencia, who could have secured a last 16 spot with victory, poured forward in search of an equaliser. However, the visitors lacked accuracy in picking out striker Paco Alcacer with long-range passes. After the interval Zenit, spurred on by a capacity 21,000 crowd, moved up a gear pinning Valencia back. Argentinian full back Ezequiel Garay missed a clear chance to increase Zenit's lead in the 58th minute when he headed inches wide from Hulk's corner. Valencia's second-half substitute Santi Mina had the ball in the net in the 67th minute but his strike was ruled out for offside. In the 74th minute, Zenit skipper Miguel Danny played a one-two with Shatov before finding the unmarked Dzyuba, who found the back of the net to secure victory. Valencia's slight hopes to save the day went up in smoke with 10 minutes to go when their Portuguese full back Ruben Vezo was sent off for a professional foul on Shatov."
138,07/11/2015,18:10,Valencia stick five past high-flying Celta,Valencia eased the pressure on coach Nuno Espirito Santo with by far their best result of the season to thrash Celta Vigo 5-1 at Balaidos on Saturday.,"Paco Alcacer and Dani Parejo both struck twice before Shkodran Mustafi added a late header to lift Valencia to within two points of the top four. Victory takes Valencia up to sixth, three points behind Celta in third. Celta had started the day with the chance to move level with Real Madrid and Barcelona at the top of the table. By contrast, Valencia travelled to Galicia with rumours surrounding Nuno's future after a dreadful performance in losing 1-0 to Gent in the Champions League on Wednesday. True to form, Celta dominated the majority of the match, but they suffered just their second defeat of the season thanks to some brilliant Valencia finishing and comical defending from the hosts. Alcacer had once again been named in Vicente del Bosque's Spain squad on Friday despite scoring just once from open play all season. However, he justified the former Real Madrid coach's faith by sweeping home Parejo's pass for the opener on 12 minutes. Celta were deservedly level 11 minutes later when Augusto Fernandez headed home from close range. The home side were then outraged when they had the ball in the net again moments later, but referee Inaki Vicandi Garrido had already blown for a Celta free-kick on the edge of the area. Parejo turned the game on its head just before half-time with a stunning free-kick that found the top corner. Seconds into the second-half it was 3-1 as Alcacer pounced on a short back-pass from Jonny to coolly slot home his second of the afternoon. Alcacer then turned provider for Parejo to score the fourth before Mustafi added a fifth from a corner 13 minutes from time. League leaders Real Madrid and Barcelona are both in action on Sunday in their final match before they clash in El Clasico on November 21. Madrid travel to Sevilla, whilst Barcelona host fifth-placed Villarreal at the Camp Nou."
139,07/11/2015,02:20,Asian tycoons frustrated in hunt for glory,East Asian tycoons are digging deep into their pockets for European football glory but have not got the dividends yet.,"The move by Chinese toys and game video group Rastar this week to take control of heavily indebted Spanish La Liga side Espanyol is the latest example of what experts say are often vanity purchases. The Asian magnates are jostling with Russian oligarchs, oil-fuelled Arab states and American sports groups for control of European teams. ""Some may doubt the economic rationale of certain investments in football,"" said Raffaele Poli, director of the Football Observatory at the International Centre for Sports Studies (CIES) at Neuchatel in Switzerland. ""There may be image questions for these very rich personalities, its a kind of 'folie de grandeur' to want to invest in a sector that is very popular in Asia,"" added the analyst. Espanyol has welcomed Rastar's owner Chen Yansheng as a saviour however. Former club president, Daniel Sanchez Llibre, who was among a group who will receive up to 17.8 million euros ($19.6 million) for up to 56% of the club stock, said Rastar has agreed to pay the club's debts to the Spanish tax man. The sale ""was an opportunity we couldn't miss"", he added. Rastar could inject up to 45 million euros more in the club who live in the shadow of glitzy city neighbours Barcelona. Other Asian tycoons have also ploughed hundreds of millions of dollars into clubs ranging from Indonesian billionaire Erick Thohir at Inter Milan to Singapore tycoon Peter Lim at Valencia. Chinese figures are taking an increasingly strong role. Wang Jianlin, head of the Wanda property giant and a fervent football fan, spent 44 million euros this year on a 20% stake in Atletico Madrid. Even lower level clubs are of interest. A Thai consortium led by businessman Dejphon Chansiri took over English Championship side Sheffield Wednesday this year. Ledus, a lighting company based in Guangzhou province, has bought French second division team Sochaux. French economist Bastien Drut said Spanish and Italian clubs are much more attractive for the Asian tycoons. ""The financial situation of these clubs is bad, they have heavy debts,"" he said. Many might want to get their hands on an English Premier League side. Of the current top four, Manchester City are Abu Dhabi-owned, Arsenal are controlled by American Stan Kroenke, Leicester City by Thai tycoon Vichai Raksriaksorn and Manchester United by the American Glazier family. But the league's television riches and global popularity has put the 20 clubs largely out of reach of an easy takeover, according to Rob Wilson, football finance expert at Sheffield Hallam University in England. He added that UEFA's financial fair play rules could deter the huge investment needed to buy an English club. ""I think potential investors are looking for better value now -- that will come from large clubs that have fallen from prestigious positions in any of the major European leagues,"" said Wilson. Singapore businessman Lim took control of financially-stricken Valencia in October last year, paying an estimated 420 million euros, and bank-rolled a return to the Champions League for the first time in three years. Lim's Meriton group announced last month that it would inject another 100 million euros into Valencia, who are not yet qualified for the Champions League final 16. Italian media said Thohir paid more than 300 million euros for 70% of Inter Milan. The fallen Italian giants have not won the domestic title since 2010 and not been in the Champions League since 2012. Last month they announced another 74 million euro loss. A Thai businessman, Bee Taechaubol, had been in talks for a major stake in city neighbours AC Milan. But the deal with Silvio Berlusconi seems deadlocked. Thohir said that revenues are improving but Inter and Italian football need to compete with the Premier League. ""We need to do more to get a greater visibility for the whole of Serie A in Asia and in the United States,"" he said."
140,27/10/2015,13:09,Knee injury sidelines Valencia's Rodrigo,"Valencia striker Rodrigo Moreno will miss three months of the season after tearing a knee ligament in Sunday's defeat at Atletico Madrid, the club confirmed on Tuesday.","The 24-year-old striker had failed to score a league goal this season so Monday's tests are a fresh blow to Rodrigo, who made a loan move from Benfica permanent in the close season. ""Rodrigo suffered a partial tear in the posterior cruciate ligament in his left knee,"" a Valencia statement confirmed. Valencia lost 2-1 at Atletico on Sunday and are currently ninth in La Liga. They are however second in Champions League Group H, but Rodrigo will miss their three remaining games against leaders Zenit, Belgians Gent and France's Lyon."
141,19/10/2015,15:36,Valencia boss drops Negredo for Gent visit,Valencia coach Nuno Espirito Santo has left former Spanish international Alvaro Negredo out of his squad for the Champions League visit of Belgian champions Gent on Tuesday as a fall-out between the two escalated.,"Negredo, who played a vital role in getting Valencia back into the group stages for the first time in three years with his away goal in a 4-3 aggregate win over Monaco in the playoffs, was also left out of the squad for Saturday's 3-0 win over Malaga. The former Manchester City striker claimed in an interview with Madrid sports daily Marca last week that the poor return from all of Valencia's forwards this season may be because the coaching staff are asking them to play too far away from goal. ""All the decisions we take for the squad are based in sporting motives,"" Nuno said on Monday. ""We are looking for the best for the team. This is a long year and everyone will be important."" Despite his goal against Monaco, Negredo has failed to live up to his 30 million euro ($34 million) price tag since joining from City at the start of last season. ""I believe in all the players in this squad and it is my obligation as a coach to get the best performance out of every player,"" added Nuno. Victory at the weekend was just Valencia's third in eight league games this season, but a 1-0 win at Lyon last time out in the Champions League has kept them on course to qualify for the last 16. ""It is fundamental to consolidate the sensations and performances from the game against Malaga, but it is a different opponent and a different competition. ""We think we are well-placed in the Champions League, we have two games at home and away to go that will decide our fate."" Australian goalkeeper Matt Ryan again missed out on the squad as he continues to recover from knee surgery, whilst Tunisian international Aymen Abdennour is also absent through injury."
142,26/09/2015,12:57,Aussie 'keeper Ryan back in Valencia training,Australian international goalkeeper Mathew Ryan returned to training on Saturday with Valencia after nearly a month out due to knee surgery.,"""The new news of the morning was Australian Mathew Ryan's return to the group,"" Valencia said in a statement on their website. The 23-year-old missed Australia's World Cup qualifying victories against Bangladesh and Tajikistan, as well as Valencia's opening Champions League defeat to Zenit St Petersburg. Ryan could return to action as early as Tuesday when Valencia travel to Lyon in the Champions League."
143,16/09/2015,22:48,Hulk-powered Zenit win at Valencia,Two stunning strikes from Brazilian international Hulk guided Zenit St Petersburg to a 3-2 win at Valencia on Wednesday despite a spirited fightback by the Spanish side.,"Hulk thumped home two powerful efforts to give the Russians a 2-0 half-time lead before Joao Cancelo and Andre Gomes hauled Valencia level after the break. However, the home side's good work was undone when Axel Witsel struck the winner moments later to give Andres Villas-Boas's men the perfect start in Group H. Zenit lead Gent and Lyon by two points after the Belgians salvaged a point with nine men in a 1-1 draw in the other match in the group. Valencia had started the stronger as a Cancelo drive from distance deceived Yuri Lodygin and came back off the post. However, the hosts were stung after just seven minutes by a flowing counter-attack from the Russian champions as Hulk received the ball on his favoured left foot and arrowed a shot into the far corner. The Spanish side were dominant in possession but struggling to create clear-cut chances and were left frustrated when Scottish referee Craig Thomson turned down a strong penalty appeal for a handball by Javi Garcia. Zenit then doubled their advantage in spectacular fashion just before half-time when Hulk took aim from 25 yards and thumped the ball past the helpless Jaume Domenech. Valencia boss Nuno Espirito Santo made a double substitution at the break as Paco Alcacer and Gomes were introduced and both made their presence felt as the hosts roared back in the second-half. Alcacer had a goal narrowly ruled out for offside before Cancelo did half the arrears with an intelligent hit from a narrow angle which caught Lodygin by surprise. Gomes pulled a volley wide from the edge of the area as the pressure from Valencia continued to build. And the Portuguese midfielder then levelled 17 minutes from time with a neat turn and shot that Lodygin should have made a better fist of keeping out. Yet, just when it seemed Valencia were in pole position to complete a famous comeback, Zenit struck the winner as Witsel was left unmarked on the edge of the area and his low drive found the net via the inside of the far post."
144,30/08/2015,01:20,Abdennour swaps Monaco for Valencia,"Tunisian international defender Aymen Abdennour has joined Valencia from Monaco for an undisclosed fee, the Spanish club has confirmed.","""Valencia Football Club has reached an agreement with AS Monaco for the signing of central defender Aymen Abdennour,"" Valencia said in a statement on their website. The deal comes just four days after Valencia dumped Monaco out of the Champions League to qualify for the group stages for the first time in three years. According to reports in the Spanish press, Los Che will pay up to 25 million euros for the 26-year-old. ""Valencia is a big club in Spain and in Europe, I didn't have any doubts,"" said Abdennour. ""I am happy to be here in a serious and ambitious project."" Abdennour will replace Nicolas Otamendi at the heart of the Valencia defence after the Argentine left to join Manchester City earlier this month."
145,25/08/2015,23:01,Valencia survive Monaco comeback to reach Champions League group stage,"Valencia held off Monaco in their Champions League play-off tie to qualify for the group stages, despite a 2-1 second-leg defeat at the Stade Louis II on Tuesday as they progrssed 4-3 on aggregate.","The Spanish side -- two-time runners up in the competition having lost the 2000 and 2001 finals to Real Madrid and Bayern Munich respectively -- held a 3-1 advantage from the first leg and Alvaro Negredo's early second-leg goal proved the difference against the principality club. Valencia started superbly and -- clearly buoyed by Sofiane Feghouli's late third goal in the first leg last Wednesday at the Mestalla -- took a deserved lead when Monaco defender Fabinho gave the ball away and former Manchester City striker Negredo flighted a sumptuous chip over home 'keeper Danijel Subasic from the left side of the penalty box in the fourth minute. Last season's quarter-finalists Monaco had no answer to Valencia's verve and swagger early on and Negredo should have made it two only to blaze over when unmarked in the area after another fine team move. But despite being on the backfoot, Leonardo Jardim's side levelled after 17 minutes. Australian international goalkeeper Mathew Ryan's unconvincing punch fell kindly to Andrea Raggi and the Italian full-back's superb swivel and shot flew into the bottom corner. The La Liga club were all of a sudden looking nervous with Monaco looking stronger and stronger as the first period progressed without properly testing Ryan in the visiting goal. Monaco continued to press and the Ligue 1 side -- 2004 runners-up when they lost 3-0 to Jose Mourinho's Porto -- scored a second after 75 minutes to re-ignite their hopes of progressing. Ryan could only palm a free-kick against the chest of Monaco substitute Guido Carrillo who inadvertantly teed up fellow substitute Elderson with the Nigerian international poking in from a yard out. Monaco huffed and puffed but they couldn't find the third goal which would've forced extra-time. Nuno Espirito Santo's Valencia side came through 4-3 to maintain their record of never having lost a European qualifying tie over two legs. The Spanish side are back in the group stages after a two-year absence, while Monaco fail to reach the group stages for the tenth time in 12 seasons since reaching the final in 2004."
