,date,hour,title,subtitle,text
176,10/11/2013,19:40,Football: Choupo-Moting strike lifts Mainz,Cameroon striker Eric Choupo-Moting scored a late goal to lift Mainz up to ninth in the Bundesliga on Sunday with a 1-0 win over Eintracht Frankfurt.,"The 24-year-old came off the bench to head home at the far post and kick off the party, with carnival season due to begin in Mainz on Monday, by giving Thomas Tuchel's side three points. The result leaves Frankfurt 15th in the league, just above the relegation places after their fourth straight defeat. Later VfB Stuttgart moved up to eighth after picking up their first win in five games with a 3-1 win at Freiburg, who stay in the bottom three. Stuttgart raced into a 2-0 lead with striker Vedad Ibisevic firing home after nine minutes before 17-year-old forward Timo Werner added a second a minute later. Germany striker Mike Hanke pulled a goal back for Freiburg 12 minutes from time before Werner, a Germany Under-19 international, added his second with a superb finish following a strong run. On Saturday, European champions Bayern Munich set a new record for the longest unbeaten run in Bundesliga history with a 3-0 victory at home to Augsburg. Bayern have now gone 37 league matches since their last defeat, at Bayer Leverkusen in October 2012, breaking Hamburg's previous record of 36 from January, 1983. Pep Guardiola's Bayern face their biggest test in a fortnight when they travel to second-placed Borussia Dortmund in a repeat of last season's Champions League final. Guardiola also set a personal record as he celebrated his 12th league match without defeat -- with 32 pointsa it's the best start by a new Bundesliga coach in the league's history. The Champions League holders opened the scoring at Munich's Allianz Arena when Germany centre-back Jerome Boateng headed home from a corner after just five minutes. France winger Franck Ribery then smashed home a free-kick on 42 minutes before Germany's Thomas Mueller netted a penalty in the fifth minute of injury time. Bayern, who have won 31 of their last 37 Bundesliga matches, were without Germany's Bastian Schweinsteiger, who will miss the forthcoming internationals against Italy and England with an ankle injury. It was Bayern's second milestone of the week after they equalled Barcelona's record from the 2002/03 season of nine consecutive Champions League wins with a 1-0 midweek success at Viktoria Pilsen. Breaking records is nothing remarkable for Bayern these days having set or equalled 25 league markers under Guardiola's predecessor Jupp Heynckes last season. Bayern also extended their lead at the top of the table to four points as second-placed Dortmund went down 2-1 at VfL Wolfsburg. It was Dortmund's second defeat of the week after losing 1-0 at home to Arsenal in the Champions League. After Germany winger Marco Reus put Dortmund ahead with a thunderbolt of a free-kick on the stroke of half-time, Wolves hit back to pick up their fourth straight victory to leave them fifth. Swiss defender Ricardo Rodriguez smashed home a free kick before Croatia striker Ivica Olic hit a great goal in off the far post with 20 minutes left. Third-placed Bayer Leverkusen are level with Dortmund on 28 points after beating Hamburg 5-3 with South Korea's star striker Son Heung-Min scoring a hat-trick. Son completed his hat-trick within 55 minutes before setting up Stefan Kiessling for Leverkusen's fourth. Borussia Moenchengladbach scored three goals in the last 18 minutes to come from behind and seal a 3-1 win at home to Nuremberg to stay fourth. Schalke 04 bounced back from their Champions League defeat at Chelsea as they came from behind to beat Werder Bremen 3-1, with Ghana midfielder Kevin-Prince Boateng netting two headers. Hertha Berlin stayed seventh after their 3-2 win at Hoffenheim, with Colombia's Adrian Ramos scoring two goals, including the winner six minutes from time."
177,05/11/2013,19:34,Football: Arsenal to target Dortmund's Lewandowski - Wenger,Arsenal manager Arsene Wenger has said the Gunners must contain Poland striker Robert Lewandowski in Wednesday's Champions League clash at Borussia Dortmund in their bid to stay top of Group F.,"Lewandowski netted the crucial 82nd-minute goal which sealed Dortmund's impressive 2-1 victory at Arsenal's Emirates Stadium a fortnight ago to throw the group wide open. Having become the first player to score four goals in a Champions League semi-final, Lewandowski warmed up for Arsenal with an 18-minute hat-trick in Friday's 6-1 Bundesliga rout of VfB Stuttgart. ""Usually at home, Lewandowski is quite dangerous and the best way to keep him quiet is by controlling the ball,"" said Wenger. ""We want to control possession and we want to control the game."" With Arsenal, Dortmund and Napoli all level on six points, the Gunners top the table on goal difference and having lost to Dortmund in London, Wenger's side is desperate to win the return. ""We definitely want to win after losing at home,"" said Wenger. ""Dortmund is a very positive side, so at least you have a guarantee that both teams will be trying to win the game."" In the build-up to the match, Dortmund coach Jurgen Klopp, a heavy metal-fan, described Wenger as having organised Arsenal into a finely-tuned ""orchestra"" and the Frenchman continued the musical analogy. ""I am not a music specialist, but Dortmund are a very good team, so we should see a good symphony,"" quipped Wenger. The showdown at Dortmund's Westfalenstadion promises to be a high-quality confrontation between the Premier League leaders and Borussia, who are second only to Bayern Munich in the Bundesliga. Dortmund bounced back from their opening 2-1 defeat at Napoli with a 3-0 home win over Marseille before beating Arsenal in London, but Germany winger Marco Reus said Borussia can take nothing for granted. ""We have improved since Napoli, but you can't compare this to the (German) league, this is the Champions League and the smallest mistake will be punished,"" said Reus. ""It will be another 50-50 match, I believe we produced a great performance in London and will have to do so again."" According to Klopp, Germany centre-back Mats Hummels is ""97.5 percent"" sure to miss the game with back and thigh injuries. Left-back Marcel Schmelzer could feature having played 70 minutes of the Stuttgart victory after struggling with a hamstring injury."
178,05/11/2013,02:10,"Football: Atletico look to seal knockout spot, English duo to beat German rivals",Atletico Madrid's stunning form domestically and in Europe can earn its first reward on Wednesday with a place in the Last 16 of the Champions League if they beat Austria Vienna in Madrid.,"Elsewhere both Premier League leaders Arsenal and rivals Chelsea will be seeking to secure wins over last season's beaten finalists Borussia Dortmund and fellow Bundesliga outfit Schalke 04 respectively. Group E Chelsea (ENG) v Schalke 04 (GER) Chelsea host Schalke smarting from their shock 2-0 defeat at Newcastle at the weekend, a defeat that could lead Blues boss Jose Mourinho to tinker with his line-up. After an opening loss to Basel Chelsea have got into their European stride, with impressive wins against Steaua Bucharest and at Schalke last time out. ""We are in a stable position to qualify in the Champions League but if we lose again we are in a difficult position,"" Mourinho warned. Schalke, sharing top spot with Chelsea on six points, travel to Stamford Bridge on the back of a 2-0 win over Hertha Berlin in the Bundesliga. Basel (SUI) v Steaua Bucharest (ROM) Basel came away from Bucharest with a disappointing draw a fortnight ago which left them in third and on target for a post-Christmas ticket to the Europa League. After upsetting Chelsea in their first group game though they will be anxious to bag all the points here to keep them in the running for a place in the knockout stages. Group F Borussia Dortmund (GER) v Arsenal (ENG) Dortmund ruined Arsene Wenger's 64th birthday celebrations with a 2-1 win at the Emirates a fortnight ago. Dortmund 'keeper Roman Weidenfeller is wary of a reaction, saying: ""We have irritated them with our win in London. Now they want to strike back."" The Bundesliga outfit could not be in better shape, meting out a 6-1 drubbing to Vfb Stuttgart last Friday. Arsenal, second on goal difference to Dortmund, make the trip in good heart themselves having seen off Liverpool 2-0 to pull five points clear in the Premier League. Wenger said: ""We go to Dortmund now and we were very disappointed with how we lost to them. It was a very sloppy goal when we were in control but we got a good result in Germany last season against Bayern Munich. So we have been there before and are used to the atmosphere over there and hopefully we can get a good result."" Napoli (ITA) v Marseille (FRA) Rafael Benitez's Napoli are on a three-match winning run in Serie A, and host Marseille after a 2-1 win at the Velodrome on matchday three. That's left the Italians bang in contention for a place in the knockout round, level on six points with Dortmund and Arsenal, while for pointless Marseille, who ended a five match losing run in Ligue 1 on Saturday, it's a case of win or bust. The Italians are without right back Giandomenico Mesto, who underwent knee surgery on Monday. Group G Zenit St Petersburg (RUS) v FC Porto (POR) Zenit can steal a march on Porto for the runners-up spot by beating them on Wednesday and open up a four point gap with two games remaining. The Russian side made heavy weather of beating Porto in their match a fortnight ago as the hosts played most of the match with only 10 men. Zenit, though, go into the game having seen their eight match winning streak ended at the weekend with a 1-1 draw by Amkar Perm. Porto too were held to a surprise draw, 1-1 away at unheralded Belenenses. Porto boast a good away record away against Russian sides, winning four and losing one, while Zenit have never lost at home to Portuguese clubs in five matches. Atletico Madrid (ESP) v Austria Vienna (AUT) Atletico have made light work of a weak group and can seal their place in the Last 16 -- for the first time since the 2008/09 campaign -- with victory over an Austrian team they outclassed last month in a 3-0 win. A win for Atletico would also set a new club record of four successive wins in European club football's premier competition, beating the three in the 1958/59 season. Atletico warmed up for the game with a comfortable 2-0 win at home to Athletic Bilbao on Sunday for their 11th win in 12 La Liga games. Coach Diego Simeone will be looking to his Brazilian-born striker Diego Costa to inflict more pain on their opponents after he scored a double against them in the first match. ""It's not just his goals, in his participation in the play and the connection he has with the other players he makes the team better,"" purred Simeone of his leading scorer, who has more than made up for the sale of Falcao in the close season. Group H Ajax (NED) v Celtic (SCO) Ajax need at least a point from this game if they are not to be in serious danger of missing out even on third spot and a place in the Europa League. Celtic by contrast will be seeking a repeat of the win they grabbed against the Dutch side last month which reignited hopes of qualifying for the knockout stages for the second successive season. Ajax have made their worst ever start to a CL campaign while Celtic are bidding to avoid a third successive away defeat. Celtic manager Neil Lennon says that he wants his players to take their chances otherwise it could prove very costly. His Ajax counterpart, though, Frank de Boer believes that if his young team repeat the performance they produced against Celtic in the first game they will take the points. ""If we play like that again in two weeks, then we will beat them in the Amsterdam ArenA. I really believe in that."" Barcelona (ESP) v AC Milan (ITA) Barcelona can all but seal their place in the Last 16 with victory at home to a woefully out of sorts and injury-hit Milan side. Barcelona's worries are small by comparison to the Italians, who have made their worst start to a Serie A season in over 20 years, their loss to Fiorentina at the weekend their fifth of the season already. However, coach Massimiliano Allegri appears to be benefiting from some unaccustomed patience from the club directors who have called for no one to panic. However defeat in Barcelona and a Celtic win would really heap pressure on them in the chase for the second spot. The Scottish side are yet to host them and will fancy their chances of avenging an unfortunate defeat at the San Siro."
179,01/11/2013,22:25,Football: German Bundesliga table,"German Bundesliga table after Friday's match (played, won, drawn, lost, goals for, goals against, points):",Borussia Dortmund        11 9 1 1 31  9 28 Bayern Munich            10 8 2 0 22  6 26 Bayer Leverkusen         10 8 1 1 22 10 25 Moenchengladbach         10 5 1 4 23 15 16 Hertha Berlin            10 4 3 3 17 12 15 Wolfsburg                10 5 0 5 14 12 15 Schalke                  10 4 2 4 18 22 14 Hoffenheim               10 3 4 3 25 23 13 VfB Stuttgart            11 3 4 4 21 20 13 Hanover                  10 4 1 5 12 16 13 Mainz                    10 4 1 5 15 21 13 Hamburg                  10 3 3 4 23 22 12 Werder Bremen            10 3 3 4  9 15 12 Eintracht Frankfurt      10 2 4 4 13 18 10 Augsburg                 10 3 1 6 11 19 10 Nuremberg                10 0 7 3 11 19  7 Freiburg                 10 0 5 5  9 21  5 Eintracht Braunschweig   10 1 1 8  7 23  4
180,26/10/2013,17:32,Football: German Bundesliga results,German Bundesliga results on Saturday:,"Bayern Munich 3 (Mandzukic 29, 51, Goetze 54) Hertha Berlin 2 (Ramos 4, Ben-Hatira 58) Schalke 04 1 (Meyer 62) Borussia Dortmund 3 (Aubameyang 14, Sahin 51, Blaszczykowski 74) Bayer Leverkusen 2 (Rolfes 34, Can 83) Augsburg 1 (Hahn 24) Hanover 1 (Sane 56) Hoffenheim 4 (Salihovic 10, Herdling 18, Roberto Firmino 62, 64) Mainz 05 2 (Okazaki 8, 68) Eintracht Braunschweig 0 Playing later (1630 GMT) VfL Wolfsburg v Werder Bremen Played Friday VfB Stuttgart 1 (Ibisevic 3-pen) Nuremberg 1 (Drmic 6) Playing Sunday SC Freiburg v Hamburg (1330 GMT) Bourssia Moenchengladbach v Eintracht Frankfurt (1530 GMT)"
181,20/10/2013,19:43,Football: Hamburg hold Stuttgart in six-goal thriller,Hamburg remain unbeaten in three league games under coach Bert van Marwijk after picking up a point in their thrilling 3-3 draw with 10-man VfB Stuttgart on Sunday.,"Ex-Holland coach Van Marwijk took charge in September after predecessor Thorsten Fink was fired following a disastrous start to the season, including a 6-2 drubbing at Borussia Dortmund. Hamburg captain Rafael van der Vaart earned his side a point when he equalised for the third time for the hosts on 67 minutes on Van Marwijk's home debut. Stuttgart spent the last six minutes with 10 men after Germany Under-21 centre-back Antonio Ruediger was shown a straight red for hitting Dutch midfielder Van der Vaart in the ribs. ""We have improved again and are playing football the way I like it,"" said Van Marwijk as Hamburg rallied at 3-2 down after ex-Arsenal defender Johan Djourou conceded a second-half own goal. ""We had a couple of really nice attacks, which pleased me. We had a bit of bad luck with the own goal."" After a draw at Frankfurt and a 5-0 hammering of Nuremberg, the point kept Hamburg 15th, having been in the bottom three when Van Marwijk took over, while Stuttgart are eighth. Wolfsburg moved up to ninth with a 2-1 win at Augsburg with Wolves ex-Bayern Munich midfielder Luiz Gustavo heading the first-half winner. On Saturday, European champions Bayern extended their unbeaten Bundesliga run to 34 games by coming from behind for a 4-1 home win over Mainz to go back to the top. Having last lost in the German league back in October 2012, Bayern are now just two matches short of equalling Hamburg's 30-year-old, 36-match streak. Bayern were punished for a poor first-half in Munich when Mainz striker Shawn Parker fired home after capitalising on a mistake by centre-back Jerome Boateng. But Bayern roared back when Germany midfielder Mario Goetze came off the bench for the second-half and played a key part in the hosts' first three second-half goals. His dream pass through to Arjen Robben allowed the winger to equalise on 50 minutes and two minutes later, Goetze combined with the Dutchman for Germany's Thomas Mueller to fire home to make it 2-1. With Bayern finally making their 80 percent possession pay off, Goetze fired in a cross for Mario Mandzukic to score their third on 69 minutes. And when Bayern vice-captain Bastian Schweinsteiger was fouled in the area, Mueller stepped up to drill home the penalty for his second of the game eight minutes from time. Bayer Leverkusen had briefly gone top on Friday thanks to a controversial 'phantom' goal in their 2-1 win at Hoffenheim. The German Football Federation (DFB) will investigate on Monday while Hoffenheim have called for a replay after Stefan Kiessling's 70th-minute winner came in bizarre circumstances. Replays showed his header only ended in the back of the net after flying through a hole in the side netting. Schalke 04, who host Chelsea in the Champions League on Tuesday, needed a 91st-minute winner from Roman Neustaedter to seal a 3-2 win at bottom side Eintracht Braunschweig. Dortmund, who are at Arsenal on Tuesday in the Champions League, stayed second with a hard-fought 1-0 win at home to Hanover 96. Germany winger Marco Reus hit the winning penalty after just four minutes when Hanover's Japan defender Hiroki Sakai fouled left-back Erik Durm in the area. Borussia stay second and level on 22 points with third-placed Leverkusen, just a point behind Bayern. Second-from-bottom Freiburg picked up a point with a goalless draw at Werder Bremen, while Eintracht Frankfurt drew 1-1 at home to Nuremberg."
182,20/10/2013,18:46,Football: Hamburg hold Stuttgart in six-goal thriller,Hamburg remain unbeaten in three league games under coach Bert van Marwijk after picking up a point in their thrilling 3-3 draw with 10-man VfB Stuttgart on Sunday.,"Ex-Holland coach Van Marwijk took charge in September after predecessor Thorsten Fink was fired following a disastrous start to the season, including a 6-2 drubbing at Borussia Dortmund. Hamburg captain Rafael van der Vaart earned his side a point when he equalised for the third time for the hosts on 67 minutes. Stuttgart spent the last six minutes with 10 men after centre-back Antonio Ruediger was shown a straight red for hitting Dutch midfielder Van der Vaart in the ribs. ""We have improved again and are playing football the way I like it,"" said Van Marwijk as Hamburg rallied at 3-2 down after ex-Arsenal defender Johan Djourou conceded a second-half own goal. ""We had a couple of really nice attacks, which pleased me. We had a bit of bad luck with the own goal."" After a draw at Frankfurt and a 5-0 hammering of Nuremberg, the point lifts Hamburg up to 14th, having been in the bottom three when Van Marwijk took over, while Stuttgart are eighth. On Saturday, Bayern Munich extended their unbeaten Bundesliga run to 34 games by coming from behind for a 4-1 home win over Mainz to go back to the top. Having last lost in the German league back in October 2012, Bayern are now just two matches short of equalling Hamburg's 30-year-old, 36-match streak. Bayern were punished for a poor first-half in Munich when Mainz striker Shawn Parker fired home after capitalising on a mistake by centre-back Jerome Boateng. But Bayern roared back when Germany midfielder Mario Goetze came off the bench for the second-half and played a key part in the hosts' first three second-half goals. His dream pass through to Arjen Robben allowed the winger to equalise on 50 minutes and two minutes later, Goetze combined with the Dutchman for Germany's Thomas Mueller to fire home to make it 2-1. With Bayern finally making their 80 percent possession pay off, Goetze fired in a cross for Mario Mandzukic to score their third on 69 minutes. And when Bayern vice-captain Bastian Schweinsteiger was fouled in the area, Mueller stepped up to drill home the penalty for his second of the game eight minutes from time. Bayer Leverkusen had briefly gone top on Friday thanks to a controversial 'phantom' goal in their 2-1 win at Hoffenheim. The German Football Federation (DFB) will investigate on Monday while Hoffenheim have called for a replay after Stefan Kiessling's 70th-minute winner came in bizarre circumstances. Replays showed his header only ended in the back of the net after flying through a hole in the side netting. Schalke 04, who host Chelsea in the Champions League on Tuesday, needed a 91st-minute winner from Roman Neustaedter to seal a 3-2 win at bottom side Eintracht Braunschweig. Dortmund, who are at Arsenal on Tuesday in the Champions League, stayed second with a hard-fought 1-0 win at home to Hanover 96. Germany winger Marco Reus hit the winning penalty after just four minutes when Hanover's Japan defender Hiroki Sakai fouled left-back Erik Durm in the area. Borussia stay second and level on 22 points with third-placed Leverkusen, just a point behind Bayern. Second-from-bottom Freiburg picked up a point with a goalless draw at Werder Bremen, while Eintracht Frankfurt drew 1-1 at home to Nuremberg. Later Sunday, Augsburg are home to Wolfsburg."
183,20/10/2013,17:39,Football: Hamburg hold Stuttgart in six-goal thriller,Hamburg remain unbeaten in three league games under coach Bert van Marwijk after picking up a point in their thrilling 3-3 draw with ten-man VfB Stuttgart on Sunday.,"Ex-Holland coach Van Marwijk took charge in September after predecessor Thorsten Fink was fired following a disastrous start to the season, including a 6-2 drubbing at Borussia Dortmund. Hamburg captain Rafael van der Vaart earned his side a point when he equalised for the third time for the hosts on 67 minutes. Stuttgart spent the last six minutes with ten men after centre-back Antonio Ruediger was shown a straight red for hitting Dutch midfielder Van der Vaart in the ribs. After a draw at Frankfurt and a 5-0 hammering of Nuremberg, the point lifts Hamburg up to 14th in the league, having been in the bottom three when Van Marwijk took over, while Stuttgart are eighth. On Saturday, Bayern Munich extended their unbeaten Bundesliga run to 34 games by coming from behind for a 4-1 home win over Mainz to go back to the top of the Bundesliga. Having last lost in the German league back in October 2012, Bayern are now just two matches short of equalling Hamburg's 30-year-old, 36-match streak. Bayern were punished for a poor first-half in Munich when Mainz striker Shawn Parker fired home after capitalising on a mistake by centre-back Jerome Boateng. But Bayern roared back when Germany midfielder Mario Goetze came off the bench for the second-half and played a key part in the hosts' first three second-half goals. His dream pass through to Arjen Robben allowed the winger to equalise on 50 minutes and two minutes later, Goetze combined with the Dutchman for Germany's Thomas Mueller to fire home to make it 2-1. With Bayern finally making their 80 percent possession pay off, Goetze fired in a cross for Mario Mandzukic to score their third on 69 minutes. And when Bayern vice-captain Bastian Schweinsteiger was fouled in the area, Mueller stepped up to drill home the penalty for his second of the game eight minutes from time. Bayer Leverkusen had briefly gone top on Friday thanks to a controversial 'phantom' goal in their 2-1 win at Hoffenheim. The German Football Federation (DFB) will investigate on Monday while Hoffenheim have called for a replay after Stefan Kiessling's 70th-minute winner came in bizarre circumstances. Replays showed his header only ended in the back of the net after flying through a hole in the side netting and a DFB sports court is set to meet on Monday. Schalke 04, who host Chelsea in the Champions League on Tuesday, needed a 91st-minute winner from Roman Neustaedter to seal a 3-2 win at bottom side Eintracht Braunschweig. Dortmund, who are at Arsenal on Tuesday in the Champions League, stayed second with a hard-fought 1-0 win at home to Hanover 96. Germany winger Marco Reus hit the winning penalty after just four minutes when Hanover's Japan defender Hiroki Sakai fouled left-back Erik Durm in the area. Borussia stay second and level on 22 points with third-placed Leverkusen, just a point behind Bayern. Second-from-bottom Freiburg picked up a point with a goalless draw at Werder Bremen, while Eintracht Frankfurt drew 1-1 at home to Nuremberg. Later Sunday, Augsburg are home to Wolfsburg."
184,20/10/2013,17:38,Football: German Bundesliga table,"German Bundesliga table after Sunday afternoon's match (played, won, drawn, lost, goals for, goals against, points):",Bayern Munich             9 7 2 0 19  4  23 Borussia Dortmund         9 7 1 1 22  7  22 Bayer Leverkusen          9 7 1 1 20  9  22 Hertha Berlin             9 4 3 2 15  9  15 Schalke 04                9 4 2 3 17 19  14 Borussia Moenchengladbach 9 4 1 4 19 14  13 Hanover 96                9 4 1 4 11 12  13 VfB Stuttgart             9 3 3 3 19 13  12 Werder Bremen             9 3 3 3  9 12  12 Hoffenheim                9 2 4 3 21 22  10 Eintracht Frankfurt       9 2 4 3 12 14  10 Augsburg                  8 3 1 4  9 15  10 Mainz 05                  9 3 1 5 13 21  10 Hamburg                   9 2 3 4 20 22   9 VfL Wolfsburg             8 3 0 5  9 11   9 Nuremberg                 9 0 6 3 10 18   6 Freiburg                  9 0 5 4  9 18   5 Eintracht Braunschweig    9 1 1 7  7 21   4
