,date,hour,title,subtitle,text
119,15/03/2014,19:37,Football: Dortmund shocked at home by 10-man Gladbach,Borussia Dortmund stay second in the Bundesliga despite slumping to a 2-1 defeat at home to ten-man Borussia Moenchengladbach on Saturday.,"The result means runaway leaders Bayern Munich hosting fourth-placed Bayer Leverkusen at the Allianz Arena later, the European champions can extend their lead to 23 points with a 16th-straight league win. Leverkusen are the last German team to win against Bayern -- who are unbeaten in all of their 49 matches since -- dating back to October 28, 2012. Behind the scenes, Bayern have endured arguably the most turbulent week in the club's history after Uli Hoeness was convicted of major tax fraud on Thursday and resigned as club president 24 hours later. If Bayern go 23 points clear, they could be confirmed Bundesliga champions next Saturday, if they pick up another three points and their rivals lose, to go 26 points clear with eight games left to play. Gladbach earned their first win in ten games to dent Dortmund's confidence ahead of Wednesday's Champions League last 16 clash at home to Zenit St Petersburg when they hold a 4-2 lead from the first leg. ""That is a bitter result for us, so the disappointment is huge,"" said Dortmund captain Sebastian Kehl. Dortmund are now just one point clear of third-placed rivals Schalke ahead of the Ruhr Valley derby on March 25. ""We could have a cushion behind us, now things are tight,"" admitted Dortmund midfielder Nuri Sahin. Swiss coach Lucien Favre extended his Gladbach contract last week until 2017 and his side produced a devastating nine-minute first-half spell at Dortmund's Westfalenstadion. ""Don't worry, you'll still finish second in the league,"" Favre told Klopp after the final whistle. Gladbach took the lead when a scuffed shot from Brazilian striker Raffael wrong-footed Dortmund goalkeeper Roman Weidenfeller on 31 minutes after Patrick Herrmann got the better of Borussia defender Mats Hummels to fire in a cross. The hosts doubled their lead five minutes before the break when Herrmann found Juan Arango and the Venezuelan put in a great final pass for Germany squad striker Max Kruse to fire home five minutes before the break. Gladbach midfielder Havard Nordtveit was sent off for a second yellow card for the final 20 minutes and new-signing Milos Jojic pulled one back for Dortmund on 77 minutes. Mainz moved up to fifth with a sensational 4-2 victory at Hoffenheim with Japan's Shinji Okazaki netting their last two goals as the guests scored three times in seven stunning second-half minutes to come from 2-0 down. The win keeps Thomas Tuchel's Mainz in the hunt for a European spot next season and are only three points short of a Champions League berth. Relegation-threatened VfB Stuttgart, with new coach Huub Stevens in charge, are winless in their last 10 matches as they were held to a 1-1 draw at Werder Bremen. Stuttgart's Martin Harnik hammered a first-half penalty attempt off the post just before the break against his old club, but defender Georg Niedermeier gave the guests a 55th-minute lead. Bremen's Germany midfielder Aaron Hunt fired home a direct free-kick on 79 minutes to share a point. Wolfsburg drop to sixth after their 1-1 draw at bottom side Eintracht Braunschweig as only three points separate the bottom four clubs including Freiburg, Hamburg and Stuttgart. Hertha's European aspirations suffered a dent as they lost 2-0 at home to Hanover 96 to stay ninth and four points off the top six. On Friday, Schalke 04 moved up to third -- an automatic Champions League spot -- with a 2-1 win at Augsburg as Dutch striker Klaas-Jan Huntelaar scored twice. Having scored a hat-trick in last Saturday's 4-0 rout of Hoffenheim, Huntelaar took his tally to six goals in his last four games. The victory is a welcome boost for the Royal Blues ahead of Tuesday's trip to Real Madrid where they face the near-impossible task of over-turning their 6-1 home leg defeat."
120,15/03/2014,17:43,Football: Dortmund shocked at home by 10-man Gladbach,Borussia Dortmund stay second in the Bundesliga despite slumping to a 2-1 defeat at home to ten-man Borussia Moenchengladbach on Saturday.,"With runaway leaders Bayern Munich hosting fourth-placed Bayer Leverkusen at the Allianz Arena later, the European champions can extend their lead further to 23 points with a 16th-straight league win. Leverkusen are the last German team to win against Bayern -- who are unbeaten in all of their 49 matches since -- dating back to October 28, 2012. Behind the scenes, Bayern have endured arguably the most turbulent week in the club's history after Uli Hoeness was convicted of major tax fraud on Thursday and resigned as club president 24 hours later. If Bayern go 23 points clear, they could be confirmed Bundesliga champions next Saturday, if they pick up another three points and their rivals lose, to go 26 points clear with eight games left to play. Gladbach earned their first win in ten games to dent Dortmund's confidence ahead of Wednesday's Champions League last 16 clash at home to Zenit St Petersburg when they hold a 4-2 lead from the first leg. Swiss coach Lucien Favre extended his Gladbach contract last week until 2017 and his side produced a devastating nine-minute first-half spell at Dortmund's Westfalenstadion. Gladbach took the lead when a scuffed shot from Brazilian striker Raffael wrong-footed Dortmund goalkeeper Roman Weidenfeller on 31 minutes after Patrick Herrmann got the better of Borussia defender Mats Hummels to fire in a cross. The hosts doubled their lead five minutes before the break when Herrmann found Juan Arango and the Venezuelan put in a great final pass for Germany squad striker Max Kruse to fire home five minutes before the break. Gladbach midfielder Havard Nordtveit was sent off for a second yellow card for the final 20 minutes and new-signing Milos Jojic pulled one back for Dortmund on 77 minutes. Mainz moved up to fifth with a sensational 4-2 victory at Hoffenheim with Japan's Shinji Okazaki netting their last two goals as the guests scored three times in seven stunning second-half minutes to come from 2-0 down. The win keeps Thomas Tuchel's Mainz in the hunt for a European spot next season and are only three points short of a Champions League berth. Relegation-threatened VfB Stuttgart, with new coach Huub Stevens in charge, are winless in their last 10 matches as they were held to a 1-1 draw at Werder Bremen. Stuttgart's Martin Harnik hammered a first-half penalty attempt off the post just before the break against his old club, but defender Georg Niedermeier gave the guests a 55th-minute lead. Bremen's Germany midfielder Aaron Hunt fired home a direct free-kick on 79 minutes to share a point. Wolfsburg drop to sixth after their 1-1 draw at bottom side Eintracht Braunschweig as only three points separate the bottom four clubs including Freiburg, Hamburg and Stuttgart. Hertha's European aspirations suffered a dent as they lost 2-0 at home to Hanover 96 to stay ninth and four points off the top six. On Friday, Schalke 04 moved up to third -- an automatic Champions League spot -- with a 2-1 win at Augsburg as Dutch striker Klaas-Jan Huntelaar scored twice. Having scored a hat-trick in last Saturday's 4-0 rout of Hoffenheim, Huntelaar took his tally to six goals in his last four games. The victory is a welcome boost for the Royal Blues ahead of Tuesday's trip to Real Madrid where they face the near-impossible task of over-turning their 6-1 home leg defeat."
121,14/03/2014,12:08,Football: Bayern eye title despite Hoeness shame,Bayern Munich host Bayer Leverkusen in Saturday's top Bundesliga match with the European champions reeling from Uli Hoeness' resignation after his conviction for major tax fraud.,"Sami Hyypia-coached Leverkusen were the last team to beat runaway leaders Bayern in the league when they left the Allianz Arena with a shock 2-1 win in October 2012. Since then Bayern are unbeaten in 49 league matches and enjoy a 20-point lead in the table. But the club is in turmoil after Hoeness resigned as both president and chairman of the advisory board on Friday after being sentenced to three and a half years in jail on Thursday, The 62-year-old, who won the 1974 World Cup with West Germany, cheated the German state out of 28.5 million euros ($39.5 million) of taxes. ""Tax evasion was the mistake of my life,"" Hoeness said in a statement on the Bayern website. ""I want to avert harm to my club. ""Bayern Munich is my life's work and always will be. ""I will stay committed to this great club and its people as long as I live."" Having been the driving force behind the Champions League holders since joining them as an 18-year-old in 1970, Hoeness played a huge part in turning them into a European powerhouse. Bayern have won 21 of their 23 German league titles and all five of their European Cup or Champions League victories with him involved either as a player, club manager or president. Leverkusen have problems of their own and last won on February 7, losing six of their last seven matches. Third-placed Bayer were knocked out of the Champions League's last 16 on Wednesday when they lost 2-1 at Paris Saint-Germain after being drubbed 4-0 at home. Bayern right-back Rafinha, centre-back Jerome Boateng and winger Thomas Mueller could all return having been left out of the starting side which drew 1-1 with Arsenal on Tuesday in the Champions League last 16. Leverkusen are set to welcome back centre-back Emir Spahic, who was suspended for their Champions League match in Paris. Second-placed Borussia Dortmund host Borussia Moenchengladbach on Saturday with the hosts welcoming back Poland striker Robert Lewandowski after a knee strain. Dortmund coach Jurgen Klopp will be without injured winger Marco Reus and suspended attacking midfielder Henrikh Mkhitaryan. ""Unless something unusual happens, he won't be involved,"" said Klopp of Reus, with either Jonas Hofmann or new-signing Milos Jojic set to take Reus' place. The Germany winger, who is suffering with a leg injury, has been off-form of late and last scored in December's 2-1 defeat to Hertha Berlin. While Dortmund have won their last three games to regain second in the table, Gladbach have slumped to eighth and are winless in their last nine games. Coach Lucien Favre signed a contract extension on Wednesday and the Foals have agreed a transfer with an unnamed club for Germany goalkeeper Marc-Andre ter Stegen. The 21-year-old will leave at the end of the season and is strongly rumoured to be Barcelona's replacement for Victor Valdes. Schalke 04 can leap-frog Leverkusen into third place on Friday when they are at sixth-placed Augsburg. The Royal Blues of Schalke will be without Peru winger Jefferson Farfan, who has a knee injury. Schalke travel to Real Madrid on Tuesday looking to overturn the near-impossible Champions League 6-1 deficit from their drubbing in Gelsenkirchen a fortnight ago. Fifth-placed Wolfsburg are looking to brush off back-to-back defeats when they travel to bottom side Eintracht Braunschweig and keep up the hunt for a Champions League place. At the bottom of the table, VfB Stuttgart's new coach Huub Stevens will be trying to coax their first win in ten matches having taken charge after Thomas Schneider was sacked. Stuttgart are only out of the bottom three on goal difference, while Robin Dutt's Bremen are up to 11th after successive wins over strugglers Hamburg and Nuremberg. Playing Friday (all times 1430 GMT unless stated) Augsburg v  Schalke 04 Playing Saturday Borussia Dortmund v Bor. Moenchengladbach, Werder Bremen v VfB Stuttgart, Hoffenheim v Mainz 05, Eintracht Braunschweig v VfL Wolfsburg, Hertha Berlin v Hanover 96, Bayern Munich v Bayer Leverkusen (1730)"
122,14/03/2014,01:45,Football: Bayern eye title despite Hoeness shame,Bayern Munich host Bayer Leverkusen in Saturday's top Bundesliga match with the European champions still reeling after club president Uli Hoeness was convicted of major tax fraud.,"Sami Hyypia-coached Leverkusen were the last team to beat runaway leaders Bayern in the league when they left the Allianz Arena with a shock 2-1 win in October 2012. Since then Bayern are unbeaten in 49 league matches and enjoy a 20-point lead in the table. But the Bavarian giants are in turmoil after Hoeness was sentenced to three and a half years in prison on Thursday. The 62-year-old, who won the 1974 World Cup with West Germany, cheated the German state out of 28.5 million euros ($39.5 million) of taxes. The European champions have said a decision on Hoeness' future at the club will be announced after his appeal is heard within the next week. Having been the driving force behind the Champions League holders since joining them as an 18-year-old in 1970, Hoeness played a huge part in turning them into a European powerhouse. Bayern have won 21 of their 23 German league titles and all five of their European Cup or Champions League victories with him involved either as a player, club manager or president. ""He's very important for us and for the whole club,"" summed up France winger Franck Ribery. Leverkusen have problems of their own and last won on February 7, losing six of their last seven matches. Third-placed Bayer were knocked out of the Champions League's last 16 on Wednesday when they lost 2-1 at Paris Saint-Germain after being drubbed 4-0 at home. Bayern right-back Rafinha, centre-back Jerome Boateng and winger Thomas Mueller could all return having been left out of the starting side which drew 1-1 with Arsenal on Tuesday in the Champions League last 16. Leverkusen are set to welcome back centre-back Emir Spahic, who was suspended for their Champions League match in Paris. Second-placed Borussia Dortmund host Borussia Moenchengladbach on Saturday with the hosts welcoming back Poland striker Robert Lewandowski after a knee strain. Dortmund coach Jurgen Klopp will be without injured winger Marco Reus and suspended attacking midfielder Henrikh Mkhitaryan. ""Unless something unusual happens, he won't be involved,"" said Klopp of Reus, with either Jonas Hofmann or new-signing Milos Jojic set to take Reus' place. The Germany winger, who is suffering with a leg injury, has been off-form of late and last scored in December's 2-1 defeat to Hertha Berlin. While Dortmund have won their last three games to regain second in the table, Gladbach have slumped to eighth and are winless in their last nine games. Coach Lucien Favre signed a contract extension on Wednesday and the Foals have agreed a transfer with an unnamed club for Germany goalkeeper Marc-Andre ter Stegen. The 21-year-old will leave at the end of the season and is strongly rumoured to be Barcelona's replacement for Victor Valdes. Schalke 04 can leap-frog Leverkusen into third place on Friday when they are at sixth-placed Augsburg. The Royal Blues of Schalke will be without Peru winger Jefferson Farfan, who has a knee injury. Schalke travel to Real Madrid on Tuesday looking to overturn the near-impossible Champions League 6-1 deficit from their drubbing in Gelsenkirchen a fortnight ago. Fifth-placed Wolfsburg are looking to brush off back-to-back defeats when they travel to bottom side Eintracht Braunschweig and keep up the hunt for a Champions League place. At the bottom of the table, VfB Stuttgart's new coach Huub Stevens will be trying to coax their first win in ten matches having taken charge after Thomas Schneider was sacked. Stuttgart are only out of the bottom three on goal difference, while Robin Dutt's Bremen are up to 11th after successive wins over strugglers Hamburg and Nuremberg. Playing Friday (all times 1430 GMT unless stated) Augsburg v  Schalke 04 Playing Saturday Borussia Dortmund v Bor. Moenchengladbach, Werder Bremen v VfB Stuttgart, Hoffenheim v Mainz 05, Eintracht Braunschweig v VfL Wolfsburg, Hertha Berlin v Hanover 96, Bayern Munich v Bayer Leverkusen (1730)"
123,07/03/2014,02:40,Football: Full-strength Bayern tune up for Arsenal,Runaway leaders Bayern Munich will be at virtually full strength for Saturday's Bundesliga clash at VfL Wolfsburg as they tune up for next week's Champions League clash with Arsenal.,"Long-term knee-injury victim Holger Badstuber is the only absentee as stars Franck Ribery, Arjen Robben, Thomas Mueller and Xherdan Shaqiri all return from recent knocks. Ribery, UEFA's best player in Europe last season, has not played for Bayern in more than a month after an operation on his buttocks, but made an appearance for France on Wednesday. ""I felt good, those few minutes against the Netherlands were good to get some match practice back. I'm ready,"" said Ribery after France enjoyed a 2-0 win over the Dutch. Bayern are looking to extend their record unbeaten league run to 49 matches and to claim their 11th consecutive victory. Fifth-placed Wolfsburg were hammered 6-2 at Hoffenheim last Sunday and Bayern's director of sport Matthias Sammer expects a backlash at the Volkswagen Arena. ""They suffered a setback in Hoffenheim and they will try and show a reaction, so we must have a few answers to that,"" said Sammer. With a 20-point lead, Bayern could even wrap up the Bundesliga title before the end of the month. Coach Pep Guardiola will want a convincing win before Tuesday's Champions League last 16, second leg at home to Arsenal with the hosts leading 2-0 from the first-leg in London. Second-placed Borussia Dortmund head to Freiburg on Sunday with a shortage of strikers. Poland's Robert Lewandowski sat out Wednesday's international against Scotland with a knee strain and Under-23 striker Marvin Ducksch is out for a fortnight with an ankle injury. It leaves Dortmund coach Jurgen Klopp with only reserve striker Julian Schieber fit, but Germany winger Marco Reus could be switched to play up front. Bayer Leverkusen coach Sami Hyypia is enduring the first crisis of his career after five straight defeats as they look for a first victory in seven years at Hanover 96 on Saturday. ""My coaching career has not been very long and this is the first time that I'm in such a situation,"" said the 40-year-old ex-Liverpool defender. ""Of course, I have spoken to many people to ask advice on what I could do. ""I want to develop myself and I wouldn't be learning so fast if we weren't in this situation."" Hyypia is hoping to have defensive midfielder Sven Bender back after a dead leg. Schalke 04 are looking to bounce back from successive horror defeats when they host Hoffenheim. The Royal Blues were drubbed 6-1 by Real Madrid in the Champions League, then crashed 5-1 at Bayern last Sunday in the Bundesliga. ""We have to look forward now and give the right response on the pitch against Hoffenheim,"" said coach Jens Keller. Peru winger Jefferson Farfan is doubtful with an inflamed knee while centre-back Kyriakos Papadopoulos is definitely out after being sent off in Munich. At the other end of the table, VfB Stuttgart coach Thomas Schneider must avoid a ninth straight defeat when his side host bottom side Eintracht Braunschweig. Schneider came close to being dismissed after Sunday's 2-1 defeat at Eintracht Frankfurt and another loss would surely mean the 41-year-old being fired, despite having only taken charge in August. Schneider has the fans' backing as the Mercedes Benz Arena will be sold out for only the second time this season. Relegation-threatened Hamburg host Frankfurt desperate for three points to escape the bottom three. Playing Saturday (all times 1430 GMT unless specified) Schalke 04 v Hoffenheim, Bor. Moenchengladbach v Augsburg, VfB Stuttgart v Eintracht Braunschweig, Hannover 96 v Bayer Leverkusen, VfL Wolfsburg v Bayern Munich, Hamburg v Eintracht Frankfurt, Nuremberg v Werder Bremen (1730) Playing Sunday Freiburg v Borussia Dortmund, Mainz 05 v Hertha Berlin (1630)"
124,02/03/2014,19:36,Football: Hoffenheim dent Wolfsburg's top four hopes,VfL Wolfsburg's hopes of breaking into the Bundesliga's top four suffered a setback on Sunday after being drubbed 6-2 at mid-table Hoffenheim.,"Wolfsburg finished the match with 10 men as German international Christian Traesch was sent off. Dieter Hecking's Wolves had hoped for three points in Hoffenheim to take fourth spot from Schalke 04, who were routed at runaway league leaders Bayern Munich on Saturday. Dutch striker Bas Dost had equalised for Wolves with 15 minutes gone after Roberto Firmino's fourth-minute strike gave Hoffenheim the lead, but the hosts responded with three goals. Hoffenheim led 4-1 at the break as defender Niklas Suele netted before French striker Anthony Modeste scored two goals in four minutes. Croatia forward Ivan Perisic pulled a goal back for Wolves with 15 minutes left. But the visitors had right-back Traesch sent off for a foul in the area and Hoffenheim's Sejad Salihovic netted the penalty before Modeste's replacement Sven Schipplock hit their sixth. Wolfsburg's result leaves them fifth. It means all three teams immediately behind leaders Bayern Munich and second-placed Borussia Dortmund, who beat Nuremberg 3-0 on Saturday, suffered defeats over the weekend. VfB Stuttgart are fourth from bottom after losing 2-1 at Eintracht Frankfurt in what was a club record eighth straight defeat and heaped further pressure on coach Thomas Schneider. Stuttgart striker Martin Harnik's first-half goal was cancelled out by Eintracht midfielder Jan Rosenthal ten minutes from time before captain Alexander Meier hit the 89th-minute winner. On Saturday, an Arjen Robben hat-trick saw Bayern open a 20-point lead at the top of the table with a 5-1 win over ten-man Schalke 04. The Royal Blues suffered a second drubbing in four days after losing 6-1 to Real Madrid in Wednesday's Champions League clash. Bayern extended their record unbeaten league run to 48 matches, dating back to October 2012, and earned their 15th straight league victory. Bayern raced into a 4-0 lead inside half-an-hour as left-back David Alaba netted a free-kick, then Robben scored either side of Mario Mandzukic's header. Schalke were gifted a goal when Jefferson Farfan's corner was turned into his own net by Munich right-back Rafinha, in for captain Philipp Lahm, with 25 minutes left. To compound Schalke's misery, Greece centre-back Kyriakos Papadopoulos was shown a straight red for bringing down Mandzukic in the area. His foul allowed Robben to wrap up his hat-trick with a 77th-minute penalty. Coach Pep Guardiola flippantly told reporters ""don't ask me about the title"" in broken German on Friday, but with 11 league games left, Bayern can wrap up their 24th German league title by the end of March. Dortmund went second after their comfortable win over Nuremberg as Germany defender Mats Hummels netted on his return after four weeks out with a foot injury. Poland star Robert Lewandowski scored his 15th league goal of the season before Henrikh Mkhitaryan netted their third seven minutes from time. Bayer Leverkusen's dreadful form continued with their fourth straight home defeat as they lost 1-0 at home to Mainz, who moved up to sixth with their fifth win in eight games. Cameroon striker Eric Choupo-Moting slammed home the winner past goalkeeper Bernd Leno on 37 minutes as Leverkusen suffered their eighth defeat in ten games to drop to third. Curiously, both goalkeepers scored own goals as Borussia Moenchengladbach, who are winless in their last eight games, were held to a 1-1 draw at bottom side Eintracht Braunschweig."
125,28/02/2014,02:15,Football: German league table,"German league table ahead of the weekend's matches (played, won, drawn, lost, goals for, goals against, points):",Bayern Munich                   22   20  2  0   61  9  62 Bayer Leverkusen                22   14  1  7   39 25  43 Borussia Dortmund               22   13  3  6   51 27  42 Schalke 04                      22   12  5  5   41 30  41 VfL Wolfsburg                   22   12  3  7   38 26  39 Borussia Moenchengladbach       22   10  5  7   39 28  35 Hertha Berlin                   22   10  4  8   34 27  34 Augsburg                        22   10  4  8   34 32  34 Mainz 05                        22   10  4  8   31 35  34 Hoffenheim                      22    6  8  8   46 46  26 Hanover  96                     22    7  3 12   29 41  24 Nuremberg                       22    4 11  7   27 37  23 Eintracht Frankfurt             22    5  7 10   24 38  22 Werder Bremen                   22    5  7 10   25 46  22 VfB Stuttgart                   22    5  4 13   35 47  19 Hamburg                         22    5  4 13   38 51  19 Freiburg                        22    4  6 12   22 44  18 Eintracht Braunschweig          22    4  3 15   16 41  15
