,date,hour,title,subtitle,text
65,29/06/2015,13:30,Australian keeper Langerak joins Stuttgart,"Australian international goalkeeper Mitch Langerak has joined Stuttgart from Borussia Dortmund, his new club announced on Monday.","Langerak, 26, has signed a three-year contract tying him to the Swabian club until 2018. He will find himself competing for a first-team place with Poland's Przemyslaw Tyton after the departure of Sven Ulreich to Bayern Munich. Langerak joined Borussia in 2010 from Melbourne but never really held down a regular number one spot and had to be satisfied with an understudy role to Roman Weidenfeller. Although he made 17 appearances last season, the arrival of Swiss international Roman Burki from Freiburg seemed to have pushed him further down the pecking order."
66,12/04/2015,19:41,10-man Stuttgart down Bremen to put Hamburg bottom,Ten-man VfB Stuttgart climbed off the bottom of the Bundesliga on Sunday with a dramatic 3-2 win at home to Werder Bremen thanks to striker Daniel Ginczek's double.,"Bremen looked to have rescued a point when defender Jannik Vestergaard headed them level on 86 minutes, just after Stuttgart winger Martin Harnik was sent off for a second yellow card, having earlier wasted two clear chances. But Ivory Coast winger Serey Die put through a superb pass which Ginczek slotted home with ice-cold finishing to claim Stuttgart's 91st-minute winner. The hosts took the lead when midfielder Christian Gentner volleyed home on 16 minutes, but Werder levelled early in the second half through Germany Under-20 striker Davie Selke. Ginczek headed Stuttgart into a 2-1 lead with 70 minutes gone before claiming his second in the dying stages. Earlier, Nigeria striker Anthony Ujah and Germany's Jonas Hector produced some individual brilliance to seal 10-men Cologne's 3-2 win over Hoffenheim to pull away from the relegation places. Ujah calmy converted Japan international Yuya Osako's defence-splitting pass on 54 minutes after Matthias Lehmann had converted Cologne's first-half penalty. Cologne had Pawel Olkowski sent off for a straight red and Eugen Polanski drilled home Hoffenheim's resulting penalty on 70 minutes. Hector settled the tie with a superb individual goal after dribbling around four defenders on 78 minutes before Modeste scored Hoffenheim's second with a late header. On Saturday, Robert Lewandowski scored twice as injury-hit leaders Bayern Munich romped to a 3-0 league win over Eintracht Frankfurt ahead of Wednesday's Champions League quarter-final at Porto. Bayern are now only three wins from claiming a third straight German league title. Lewandowski, the Bundesliga's top-scorer last season, has 16 goals for the season and is third in the current rankings. Frankfurt were missing the league's top scorer with Alexander Meier, who has 19 goals in 26 matches, suffering from a knee injury. Centre-back Medhi Benatia, who has a groin injury, joined flu-victim Bastian Schweinsteiger, plus Jerome Boateng, wingers Franck Ribery, Arjen Robben and left-back David Alaba on Bayern's casualty list. Bayern needed just 15 minutes to take the lead when Lewandowski produced a superb turn and volley, then headed home, with suspicion of offside, on 66 minutes. Thomas Mueller added the third eight minutes from time when he fired home from a seemingly-impossible angle. Second-placed Wolfsburg remain ten points behind Bayern and on course for the Champions League next season after their 2-0 win at 10-men Hamburg, who drop to bottom. Goals either side of half-time by defensive midfielder Josuha Guilavogui and right winger Daniel Caligiuri sealed Wolves' win. Hamburg had Swiss defender Johan Djourou, who brawled with team-mate Valon Behrami in the dressing room at half-time, sent off for a second yellow card in the dying stages. Borussia Moenchengladbach picked up their fourth straight league win with an impressive 3-1 victory over Borussia Dortmund to stay third in the table. Gladbach's Sweden left-back Oscar Wendt scored after just 29 seconds and Brazilian forward Raffael added their second on 32 minutes. Norway's Havard Nordveit then fired home when left unmarked at the far post for Gladbach with 67 minutes gone before Ilkay Gundogan pulled a late goal back for Dortmund. Bayer Leverkusen stayed fourth with a 3-2 win over Mainz, 24 hours before sacking Bosnia international Emir Spahic, who is being investigated by police for allegedly assaulting a club steward. South Korea striker Son Heung-Min opened the scoring with 15 minutes gone and Stefan Kiessling added a second early in the second-half before Hakan Calhanoglu drilled home a 73rd-minute free-kick. Mainz's South Korea international Koo Ja-Cheol converted two late penalties. Fifth-placed Schalke are now 10 points adrift of a Champions League place for next season after their goalless draw with relegation-threatened Freiburg. Augsburg stay sixth despite their shock 2-1 defeat at Paderborn, who remain in the relegation places."
67,12/04/2015,19:41,10-man Stuttgart down Bremen to put Hamburg bottom,Ten-man VfB Stuttgart climbed off the bottom of the Bundesliga on Sunday with a dramatic 3-2 win at home to Werder Bremen thanks to striker Daniel Ginczek's double.,"Bremen looked to have rescued a point when defender Jannik Vestergaard headed them level on 86 minutes, just after Stuttgart winger Martin Harnik was sent off for a second yellow card, having earlier wasted two clear chances. But Ivory Coast winger Serey Die put through a superb pass which Ginczek slotted home with ice-cold finishing to claim Stuttgart's 91st-minute winner. The hosts took the lead when midfielder Christian Gentner volleyed home on 16 minutes, but Werder levelled early in the second half through Germany Under-20 striker Davie Selke. Ginczek headed Stuttgart into a 2-1 lead with 70 minutes gone before claiming his second in the dying stages. Earlier, Nigeria striker Anthony Ujah and Germany's Jonas Hector produced some individual brilliance to seal 10-men Cologne's 3-2 win over Hoffenheim to pull away from the relegation places. Ujah calmy converted Japan international Yuya Osako's defence-splitting pass on 54 minutes after Matthias Lehmann had converted Cologne's first-half penalty. Cologne had Pawel Olkowski sent off for a straight red and Eugen Polanski drilled home Hoffenheim's resulting penalty on 70 minutes. Hector settled the tie with a superb individual goal after dribbling around four defenders on 78 minutes before Modeste scored Hoffenheim's second with a late header. On Saturday, Robert Lewandowski scored twice as injury-hit leaders Bayern Munich romped to a 3-0 league win over Eintracht Frankfurt ahead of Wednesday's Champions League quarter-final at Porto. Bayern are now only three wins from claiming a third straight German league title. Lewandowski, the Bundesliga's top-scorer last season, has 16 goals for the season and is third in the current rankings. Frankfurt were missing the league's top scorer with Alexander Meier, who has 19 goals in 26 matches, suffering from a knee injury. Centre-back Medhi Benatia, who has a groin injury, joined flu-victim Bastian Schweinsteiger, plus Jerome Boateng, wingers Franck Ribery, Arjen Robben and left-back David Alaba on Bayern's casualty list. Bayern needed just 15 minutes to take the lead when Lewandowski produced a superb turn and volley, then headed home, with suspicion of offside, on 66 minutes. Thomas Mueller added the third eight minutes from time when he fired home from a seemingly-impossible angle. Second-placed Wolfsburg remain ten points behind Bayern and on course for the Champions League next season after their 2-0 win at 10-men Hamburg, who drop to bottom. Goals either side of half-time by defensive midfielder Josuha Guilavogui and right winger Daniel Caligiuri sealed Wolves' win. Hamburg had Swiss defender Johan Djourou, who brawled with team-mate Valon Behrami in the dressing room at half-time, sent off for a second yellow card in the dying stages. Borussia Moenchengladbach picked up their fourth straight league win with an impressive 3-1 victory over Borussia Dortmund to stay third in the table. Gladbach's Sweden left-back Oscar Wendt scored after just 29 seconds and Brazilian forward Raffael added their second on 32 minutes. Norway's Havard Nordveit then fired home when left unmarked at the far post for Gladbach with 67 minutes gone before Ilkay Gundogan pulled a late goal back for Dortmund. Bayer Leverkusen stayed fourth with a 3-2 win over Mainz, 24 hours before sacking Bosnia international Emir Spahic, who is being investigated by police for allegedly assaulting a club steward. South Korea striker Son Heung-Min opened the scoring with 15 minutes gone and Stefan Kiessling added a second early in the second-half before Hakan Calhanoglu drilled home a 73rd-minute free-kick. Mainz's South Korea international Koo Ja-Cheol converted two late penalties. Fifth-placed Schalke are now 10 points adrift of a Champions League place for next season after their goalless draw with relegation-threatened Freiburg. Augsburg stay sixth despite their shock 2-1 defeat at Paderborn, who remain in the relegation places."
68,11/04/2015,14:48,Rock-bottom Stuttgart need killer instinct,"Bottom side VfB Stuttgart must show ""a killer instinct"" on Sunday in the battle to avoid their first relegation for 40 years, says their Germany defender Anthony Ruediger.","Stuttgart host mid-table Werder Bremen on Sunday with just one league win in 11 games dating back to mid-December, and are five points from safety with seven games to go. The 2007 German champions are bidding to avoid their first relegation since 1975 but are enduring the worst season in the club's proud history. After four months out with a knee injury, Ruediger, who has five caps for Germany, is ready to help resume his side's battle to stay in Germany's top flight. ""Good isn't enough. We need to run until there is nothing more left. We need to show some balls, we need the killer instinct,"" said the 22-year-old. ""We need more courage and more aggression."" Having been bottom of the table last December, Bremen are up to ninth and just four points from a European place for next season. Following a run of five straight wins up until mid February, Bremen's form has dipped in recent weeks with only six points from a possible 18 in their last six games. Bremen coach Viktor Skripnik lost four kilogrammes (eight pounds) in weight due to stress when they were in the relegation zone and the Ukrainian is more concerned about the ten points his side is from the drop zone, rather than dreaming about playing in Europe next season. ""Mathematically, we are not guaranteed to stay up yet. Three points (in Stuttgart) would be good, then we can talk about other things,"" said Skripnik."
69,21/03/2015,17:36,Dortmund down 10-man Hanover after Euro exit,Borussia Dortmund bounced back from their mid-week Champions League exit with a 3-2 Bundesliga victory over 10-man Hanover on Saturday to earn their first win in four games.,"On Sunday, runaway leaders Bayern Munich will be looking to add to their 11-point lead when they host third-placed Borussia Moenchengladbach while second-placed Wolfsburg are at mid-table Mainz. Dortmund bounced back from their 3-0 defeat at home to Juventus on Wednesday, which sealed a 5-1 aggregate defeat in the last 16, and two goalless draws in the Bundesliga as Gabon international Pierre-Emerick Aubameyang netted twice to leave him with 12 goals in 25 league games. Dortmund took the lead in Hanover after Germany winger Marco Reus's no-look pass split the defence and allowed Aubameyang to bury his shot in the 19th minute. The lead lasted just 12 minutes as ex-Dortmund midfielder Leon Bittencourt stole possession on the halfway line, and sprinted to the edge of the area where he fed Lars Stindl whose weak shot beat the Borussia defence. Dortmund rode their luck when captain Mats Hummels headed off the line early in the second half from Spanish striker Joselu just before the hosts were reduced to ten men. Bittencourt was sent off on 55 minutes for a foul on Dortmund veteran Sebastian Kehl just six minutes after fouling Jakub Blaszczykowski. Dortmund made the numerical advantage count almost immediately as Reus again provided the final pass for Japan midfielder Shinji Kagawa to score their second on 57 minutes for his first league goal since September. Kagawa then set up Aubameyang for his second goal with a cross which saw the Gabon forward head home on 61 minutes. Hanover set up a nervous last ten minute when Stindl beat Dortmund goalkeeper Roman Weidenfeller to make it 3-2 with 82 minutes gone, but the win leaves Borussia tenth with Hanover 14th. Bremen stay ninth after being held to a 1-1 draw at mid-table Cologne as a first-half goal by Germany Under-29 striker Davie Selke for the visitors was cancelled out by an 88th-minute penalty from Cologne midfielder Matthias Lehmann. Freiburg climbed out of the bottom three with a 2-0 win at home to Augsburg thanks to second-half goals from Jonathan Schmid and Nils Petersen. Paderborn stay second-from-bottom after their goalless draw at home to ten-man Hoffenheim, who had Bosnia defender Ermin Bicakcic sent off for a second yellow card. VfB Stuttgart remain rooted to the foot of the table despite their 3-1 comeback win at home to Eintracht Frankfurt. After Frankfurt midfielder Haris Seferovic gave his side a second-half lead Stuttgart striker Daniel Ginczek cancelled out the advantage by scoring twice in as many minutes. Romania midfielder Alexandru Maxim then added Stuttgart's third to seal their first home win since September. The result means just two points separate the bottom four teams of Stuttgart, Freiburg, Paderborn and Hamburg in Germany's top flight."
70,18/03/2015,14:39,Dortmund plan to recall loaned Germany starlets,"Borussia Dortmund plan on recalling loaned Germany Under-21 internationals Moritz Leitner and Jonas Hofmann for next season, according to director of sport Michael Zorc on Wednesday.","Leitner, 22, has spent the season on loan at VfB Stuttgart, where he has scored one goal in 18 games, while Hofmann, 21, has netted three times in 10 games at Mainz, but both had previously played for Dortmund's senior side and Germany's junior teams. ""Both of them will return at the end of the season, that's how things stand,"" Zorc told German magazine Sport Bild. Zorc also believes Dortmund are moving closer to extending the contract of Germany midfielder Ilkay Gundogan, whose contract expires in June 2016. ""Let me put it in sober terms, I believe that both for him and us a contract extension would make sense,"" Zorc told German daily Bild. The club are hoping Gundogan will follow the lead of Germany team-mate Marco Reus who extended his Borussia stay until 2019 by signing a new deal last month. Dortmund are tenth in the Bundesliga and host Italian champions Juventus on Wednesday in the last 16 of the Champions League, looking to overturn a 2-1 defeat from the first leg in Turin last month."
71,03/03/2015,17:04,Loew distances himself from doping allegations,Germany's World Cup-winning coach Joachim Loew on Tuesday distanced himself from allegations of doping levelled at his former clubs Freiburg and Stuttgart.,"On Monday, an evaluation commission from Freiburg's sport medicine clinic claimed anabolic steroids were used at the Bundesliga clubs during the late 1970s and early 1980s. ""Doping has no place in sport, I completely disapprove of it, that is as true for me as a player as it still is today as the national coach,"" Loew told SID, an AFP subsidiary. Germany's head coach played in midfield for Freiburg from 1978-80, then again from 1982-84, while he spent the 1980/81 season at Stuttgart, whom he later coached. Having won the 1984 Bundesliga title, Stuttgart, who are currently bottom of the table, say they will co-operate with any investigation, but want a full copy of the commission's report to retrace the evidence. ""For us, it is hard to give out any information because we don't have any facts at hand and it happened well before our time,"" Stuttgart's director of sport Robin Dutt told Sky Sports. ""Nevertheless, we want to give a water-tight explanation, because we are interested in clean sport. ""In professional football, there is regular drugs testing and it appears there are no irregular findings. ""Therefore I strongly believe that in football we have a clean sport across the board."" Freiburg, who were in the second division during the period stipulated, say they will also support an investigation. The club spoke out against the use of performance-enhancing drugs, but said they are also waiting to see ""detailed results or a full report"". Former Bayern Munich and Switzerland coach Ottmar Hitzfeld, who played for Stuttgart from 1975-78, told broadcaster Sport1: ""I am totally surprised by these reports. I can't imagine that one of my teammates knowingly doped."" And Hans-Jurgen Sundermann, Stuttgart's coach from 1976-79 and 1980-82, told SID, an AFP subsidiary: ""That's absurd. I can't imagine that happening and can entirely rule it out."" Rainer Koch, chairman of the German Football Association'S (DFB) anti-doping commission, said he was concerned that they had not been informed beforehand. ""There have been serious allegations made which obviously must be completely cleared up,"" he said. ""It is strange however that the anti-doping commission has not previously been informed. ""The commission's findings are new to us and we have seen neither the results nor the report, therefore we can't comment. ""In order to assess the matter seriously, we must see a detailed report."""
72,15/02/2015,19:36,Paderborn shock Hanover to break winless run,Paderborn claimed a 2-1 come-back win at mid-table Hanover 96 on Sunday to break their 10-match winless streak and climb out of the Bundesliga's relegation places.,"Hanover took the lead at home when Brazilian defender Marcelo fired home on 66 minutes, but Paderborn roared back with two goals in seven minutes to take the three points. Replacement striker Srdjan Lakic levelled just a minute after coming on and his 72nd-minute header was followed up when Alban Meha found the back of the net with a free-kick on 79 minutes. It was Paderborn's first win since the start of November and saw them climb from 17th before kick-off to 12th. Earlier, Freiburg had briefly escaped the bottom three with a 2-0 win at Hertha Berlin in Sunday's basement battle. The defeat dampened Pal Dardai's debut in charge of Hertha after the Hungarian national team coach took charge when Jos Lukukay was sacked earlier this month. But Paderborn's victory pushed Freiburg back to 16th and in the relegation places with Hertha second from bottom on a bumper weekend of goals in the German league. There were 38 goals in the German league's nine games as leaders Bayern Munich enjoyed an 8-0 rout of Hamburg while Wolfsburg won a 5-4 thriller at Bayer Leverkusen. On Saturday, Bayern claimed the biggest Bundesliga win for 30 years to warm up for Tuesday's Champions League clash at to Shakhtar Donetsk by hammering Hamburg in Munich. Stars Arjen Robben, Thomas Mueller and Mario Goetze all netted twice as Bayern ran riot at Munich's Allianz Arena ahead of Tuesday's last-16, first-leg clash against Shakhtar in Lviv. This was Bayern's biggest league win since routing Kickers Offenbach 9-0 in March 1984 and it was the league's highest score since Borussia Moenchengladbach crushed Eintracht Braunschweig 10-0 in October the same year. It was Hamburg's heaviest ever league defeat. Just over two years after their 9-2 drubbing at Munich's Allianz Arena, Hamburg were again made to suffer having also been beaten 3-1, 5-0 and 6-0 on their last four visits to Bavaria. Second-placed Wolfsburg had Bas Dost to thank for their 5-4 win at Leverkusen as the towering Dutch striker claimed four goals while Bayer's Son Heung-Min scored a hat-trick, yet still lost. Having gone 3-0 up, Wolfsburg survived a spirited fight-back as Son claimed a hat-trick in just ten second-half minutes. Leverkusen finished with 10 men after Bosnia defender Emir Spahic was sent off late on for a second yellow card before Dost hit his fourth goal in the 93rd minute to secure a dramatic victory. The result leaves Wolfsburg both eight points ahead of third-placed Gladbach and as many behind leaders Bayern. Moenchengladbach claimed a 1-0 win at Cologne as Swiss midfielder c headed their 91st-minute winner. Two home fans were arrested after a 30-strong group invaded the pitch after the final whistle. Schalke 04 suffered a 1-0 defeat at Eintracht Frankfurt in preparation for hosting holders Real Madrid in Wednesday's Champions League last 16, first-leg, tie. Frankfurt's Brazilian midfielder Lucas Piazon headed home from a corner with 65 minutes gone to leave his side ninth while Schalke dropped to fourth. Werder Bremen's remarkable run continues with a 3-2 win at Augsburg for their fifth straight victory which has taken them from 18th to eighth and the verge of a European place. VfB Stuttgart stayed bottom of the table after their 2-1 defeat at Hoffenheim, thanks to Sebastian Rudy's 93rd-minute winner. On Friday, Borussia Dortmund moved out of the relegation zone with a 4-2 home victory over Mainz as Germany winger Marco Reus got on the scoresheet, just days after committing to Dortmund until 2019."
73,15/02/2015,17:48,Freiburg escape bottom three with Hertha win,Freiburg escaped the Bundesliga's bottom three with a 2-0 win at Hertha Berlin in Sunday's basement battle on a bumper weekend of goals in the German league.,"Freiburg took the lead against Hertha at Berlin's Olympic Stadium as Felix Kraus fired home with the help of the post on 14 minutes before Maximilian Philipp headed their second on 52 minutes. After back-to-back defeats, the win lifts Freiburg up to 15th as they swap places with fellow strugglers Hertha, who drop to 16th and back amongst the bottom three. There were 35 goals in the German league's first eight games of the weekend as leaders Bayern Munich enjoyed an 8-0 rout of Hamburg while Wolfsburg won a 5-4 thriller at Bayer Leverkusen. On Saturday, Bayern claimed the biggest Bundesliga win for 30 years to warm up for Tuesday's Champions League clash at to Shakhtar Donetsk by hammering Hamburg in Munich. Stars Arjen Robben, Thomas Mueller and Mario Goetze all netted twice as Bayern ran riot at Munich's Allianz Arena ahead of Tuesday's last-16, first-leg clash against Shakhtar in Lviv. This was Bayern's biggest league win since routing Kickers Offenbach 9-0 in March 1984 and it was the league's highest score since Borussia Moenchengladbach crushed Eintracht Braunschweig 10-0 in October the same year. It was Hamburg's heaviest ever league defeat. Just over two years after their 9-2 drubbing at Munich's Allianz Arena, Hamburg were again made to suffer having also been beaten 3-1, 5-0 and 6-0 on their last four visits to Bavaria. Second-placed Wolfsburg had Bas Dost to thank for their 5-4 win at Leverkusen as the towering Dutch striker claimed four goals while Bayer's Son Heung-Min scored a hat-trick, yet still lost. Having gone 3-0 up, Wolfsburg survived a spirited fight-back as Son claimed a hat-trick in just ten second-half minutes. Leverkusen finished with 10 men after Bosnia defender Emir Spahic was sent off late on for a second yellow card before Dost hit his fourth goal in the 93rd minute to secure a dramatic victory. The result leaves Wolfsburg both eight points ahead of third-placed Gladbach and as many behind leaders Bayern. Moenchengladbach claimed a 1-0 win at Cologne as Swiss midfielder c headed their 91st-minute winner. Two home fans were arrested after a 30-strong group invaded the pitch after the final whistle. Schalke 04 suffered a 1-0 defeat at Eintracht Frankfurt in preparation for hosting holders Real Madrid in Wednesday's Champions League last 16, first-leg, tie. Frankfurt's Brazilian midfielder Lucas Piazon headed home from a corner with 65 minutes gone to leave his side ninth while Schalke dropped to fourth. Werder Bremen's remarkable run continues with a 3-2 win at Augsburg for their fifth straight victory which has taken them from 18th to eighth and the verge of a European place. VfB Stuttgart stayed bottom of the table after their 2-1 defeat at Hoffenheim, thanks to Sebastian Rudy's 93rd-minute winner. On Friday, Borussia Dortmund moved out of the relegation zone with a 4-2 home victory over Mainz as Germany winger Marco Reus got on the scoresheet, just days after committing to Dortmund until 2019."
